publishedAt,title,description,content,url,image,source
2020-12-12 18:30:00+00:00,This iPhone technology may make a comeback in next generation of Apple phones,A new survey by Apple hints at what the company may be planning with the new iPhone 13.The survey asked the users questions about the existing biometric authentication feature FaceID,Apple is popular for taking radical decisions when it comes to excluding some popular technology such as removing the headphone jack as well as an industry favourite Touch ID. The Apple iPhone SE (2nd generation) was the last phone that came with a T... [1647 chars],https://www.livemint.com/technology/apps/this-iphone-technology-may-make-a-comeback-in-next-generation-of-apple-phones-11607860627801.html,https://images.livemint.com/img/2020/12/13/600x338/2020-12-10T194657Z_1628812651_RC2JKK9F3PYF_RTRMADP_3_APPLE-CYDIA-LAWSUIT_1607860717125_1607860739137.JPG,"{'name': 'Livemint', 'url': 'https://www.livemint.com'}"
2020-12-12 18:24:00+00:00,Top analyst has good news about next year's Apple iPhone models,"TF International's Ming-Chi Kuo says that Apple will revert back it to its old iPhone release schedule next year by shipping all four models on the very same day. This year, the pandemic forced Apple to stagger release dates.","If the latest rumor about the 2021 Apple iPhone models is true, the iPhone 13 series might be sent to you in a manila envelope. That's a joke, although it is true that Apple has been removing accessories from the box. For the currently available iPho... [2024 chars]",https://www.phonearena.com/news/kuo-shares-good-news-about-iphone-13-models_id129028,https://m-cdn.phonearena.com/images/article/129028-two_1200/Top-analyst-has-good-news-about-next-years-Apple-iPhone-models.jpg,"{'name': 'PhoneArena', 'url': 'https://www.phonearena.com'}"
2020-12-12 17:42:01+00:00,"Verge Weekender: Disney’s big day, Cyberpunk 2077, latest at Google, and our favorite gadgets","Disney announced a slew of new programming, the FDA approved emergency use for a coronavirus vaccine, we got a first look at the Apple Airpods Max, and Google CEO Sundar Pichai addressed the controversy over the departure of AI researcher Timnit Gebru.","Happy Saturday and welcome to the inaugural edition of the Verge Weekender, a short recap of some of the stories we covered this week on The Verge.
The big event of the week was Disney’s investor day, where the company announced new Disney Plus serie... [4012 chars]",https://www.theverge.com/2020/12/12/22169555/verge-weekender-disney-cyberpunk-2077-google-gadgets-spacex-vaccine-airpods,https://cdn.vox-cdn.com/thumbor/E3E-8U5Z3pfv0zeacI8HNoBozbE=/0x146:2040x1214/fit-in/1200x630/cdn.vox-cdn.com/uploads/chorus_asset/file/14834051/acastro_190228_1777_vpn_0002.jpg,"{'name': 'The Verge', 'url': 'https://www.theverge.com'}"
2020-12-11 21:56:48+00:00,Watch 'A Charlie Brown Christmas' for free on Apple TV+ this weekend,"In addition to being available for free on Apple TV+ through the weekend, PBS will start airing the Peanuts special this Sunday.","For everyone who wants to partake in the Christmas tradition, Apple TV+ will be streaming A Charlie Brown Christmas for free to everyone this weekend. The Peanuts special, which has been beloved for generation after generation, is streaming for free ... [1119 chars]",https://www.imore.com/watch-charlie-brown-christmas-free-apple-tv-weekend,https://www.imore.com/sites/imore.com/files/styles/large/public/field/image/2020/11/charlie-brown-christmas.jpg,"{'name': 'iMore', 'url': 'https://www.imore.com'}"
2020-12-11 21:43:55+00:00,Apple’s most affordable M1 Mac has its first discount at Amazon,"Apple recently released three new computers that are powered by the revolutionary new Apple M1 processor that has everyone talking. The M1 MacBook Pro has been discounted for a few weeks now at Amazon, and you can still save $50 on either the 256GB model or the 512GB model.","If you purchase an independently reviewed product or service through a link on our website, we may receive an affiliate commission.
Apple recently released three new computers that are powered by the revolutionary new Apple M1 processor that has ever... [2939 chars]",https://bgr.com/2020/12/11/apple-m1-mac-mini-discount-at-amazon/,https://bgr.com/wp-content/uploads/2020/12/Apple-M1-chip.jpg?quality=70&strip=all,"{'name': 'BGR', 'url': 'https://bgr.com'}"
2020-12-11 21:26:04+00:00,Apple Pay Not Coming to Mexico Until 2021,Apple this week updated its Apple Pay page in Mexico to make it clear that the payment service will not be launching in the country until 2021. The...,"Apple this week updated its Apple Pay page in Mexico to make it clear that the payment service will not be launching in the country until 2021. The website now says ""Disponible en el 2021,"" which means available in 2021.
Signs of Apple Pay in Mexico ... [1187 chars]",https://www.macrumors.com/2020/12/11/apple-pay-mexico-2021/,https://images.macrumors.com/t/GZ5Kz7DONbhzhBGhRhqMuSAEfNM=/2000x/https://images.macrumors.com/article-new/2020/12/apple-pay-mexico-2021.jpg,"{'name': 'MacRumors', 'url': 'https://www.macrumors.com'}"
2020-12-11 21:24:00+00:00,Apple’s Chip Dreams Haunt Its Suppliers,Shares of Qualcomm and other chip makers dropped Friday after an Apple executive was reported to have told employees that the device maker is working on its own modem chips.,"Chip makers supplying Apple AAPL -0.51% should have learned by now to always consider that business temporary. That doesn’t mean it’s worthless.
Intel is only the most recent example, finally losing its place in some of the Mac computer lineup to in-... [2729 chars]",https://www.wsj.com/articles/apples-chip-dreams-haunt-its-suppliers-11607708876,https://images.wsj.net/im-272136/social,"{'name': 'The Wall Street Journal', 'url': 'https://www.wsj.com'}"
2020-12-11 21:02:08+00:00,Qualcomm president says that Apple's M1 chip 'validates our belief',"On the most recent episode of The Vergecast, Qualcomm president Cristiano Amon had some nice things to say about Apple silicon.","This week's Vergecast featured an interview with Qualcomm president Cristiano Amon, and the executive had some positive things to say about Apple's new M1 processor for the Mac.
During the interview, Dieter Bohn, The Verge's Executive Editor, asked A... [1647 chars]",https://www.imore.com/qualcomm-president-says-apples-m1-chip-validates-our-belief,https://www.imore.com/sites/imore.com/files/styles/large/public/field/image/2020/11/apple_new-m1-chip-graphic_11102020.jpg,"{'name': 'iMore', 'url': 'https://www.imore.com'}"
2020-12-11 21:00:00+00:00,"Have You Ever Heard of This App by Apple? Well, It's Dying","While Google launches and discontinues products at a rate that no one can keep up with, Apple’s modern track record for sticking with its bets","Have You Ever Heard of This App by Apple? Well, It’s Dying
While Google launches and discontinues products at a rate that no one can keep up with, Apple’s modern track record for sticking with its bets is virtually unparalleled among its peers. But n... [1433 chars]",https://www.gizmodo.com.au/2020/12/have-you-ever-heard-of-this-app-by-apple-well-its-dying/,https://imgix.gizmodo.com.au/content/uploads/sites/2/2020/12/12/xpjeliz1euqiedykvm7g-scaled.jpg?ar=16%3A9&auto=format&fit=crop&q=65&w=1280,"{'name': 'Gizmodo Australia', 'url': 'https://www.gizmodo.com.au'}"
2020-12-11 21:00:00+00:00,Apple Shutting Down Its Music Memos App,"While Google launches and discontinues products at a rate that no one can keep up with, Apple’s modern track record for sticking with its bets is virtually unparalleled. But nothing lasts forever. This week brought the beginning of the end for Music Memos.","Photo : Josh Edelson ( Getty Images )
While Google launches and discontinues products at a rate that no one can keep up with, Apple’s modern track record for sticking with its bets is virtually unparalleled among its peers. But nothing lasts forever,... [1443 chars]",https://gizmodo.com/have-you-ever-heard-of-this-app-by-apple-well-it-s-dy-1845863817,"https://i.kinja-img.com/gawker-media/image/upload/c_fill,f_auto,fl_progressive,g_center,h_675,pg_1,q_80,w_1200/xpjeliz1euqiedykvm7g.jpg","{'name': 'Gizmodo', 'url': 'https://gizmodo.com'}"
2020-12-11 20:56:47+00:00,Apple is full-steam ahead on replacing Qualcomm modems with its own,SVP Johny Srouji told Apple employees that development kicked off this year.,"As rumored many months ago, Apple's silicon ambitions don't end with replacing Intel CPUs with its own in Macs—it plans to ditch Qualcomm modems in favor of its own custom-designed chips for iPhones, according to Apple hardware tech lead Johny Srouji... [2529 chars]",https://arstechnica.com/gadgets/2020/12/apple-is-full-steam-ahead-on-replacing-qualcomm-modems-with-its-own/,https://cdn.arstechnica.net/wp-content/uploads/2020/10/iPhone-12-side-760x380.jpg,"{'name': 'Ars Technica', 'url': 'https://arstechnica.com'}"
2020-12-11 20:23:48+00:00,Apple reportedly relied on robots and augmented reality to build the new iPhone from afar during the early days of coronavirus lockdowns,"The new iPhone 12, left, and iPhone 12 Pro. Don Arnold/WireImage/Getty Images The pandemic posed a 'huge challenge' to Apple's hardware design...","The new iPhone 12, left, and iPhone 12 Pro. Don Arnold/WireImage/Getty Images
The pandemic posed a ""huge challenge"" to Apple's hardware design process and resulted in major adjustments to the manufacturing process, hardware chief Dan Riccio told empl... [2408 chars]",https://markets.businessinsider.com/news/stocks/apple-iphone-apple-watch-manufacturing-changes-coronavirus-2020-12-1029886209,https://images2.markets.businessinsider.com/5fd381f5e00bce00188babe3?format=jpeg,"{'name': 'Business Insider', 'url': 'https://markets.businessinsider.com'}"
2020-12-11 20:15:54+00:00,"Apple’s app store is an illegal monopoly, rival Cydia claims in suit",Apple argues the iPhone and its app store are part of the same product.,"The company behind Cydia, an iPhone app store that launched before Apple's own App Store, has sued Apple arguing that Apple has monopolized the market for iOS app stores, violating antitrust law in the process.
When the iPhone was introduced in 2007,... [3411 chars]",https://arstechnica.com/tech-policy/2020/12/apples-app-store-is-an-illegal-monopoly-rival-cydia-claims-in-suit/,https://cdn.arstechnica.net/wp-content/uploads/2012/06/iphone_homescreen1-499x215.jpg,"{'name': 'Ars Technica', 'url': 'https://arstechnica.com'}"
2020-12-10 23:59:50+00:00,Apple Music adds album animations in the latest iOS and macOS beta,"The feature, which is currently only available to developers and beta testers, is only turned on for a small selection of albums.","Reported by 9to5Mac, animated album artwork is making its way to Apple Music with the iOS 14.3 and macOS Bir Sur 11.1 release. Some users who have been running the beta have noticed that some albums fill the entire upper screen and show off a looping... [1379 chars]",https://www.imore.com/apple-music-adds-album-animations-latest-ios-and-macos-beta,https://www.imore.com/sites/imore.com/files/styles/large/public/field/image/2020/12/apple-music-animated-albums_0.jpg,"{'name': 'iMore', 'url': 'https://www.imore.com'}"
2020-12-10 23:48:40+00:00,Julia Roberts heads to Apple TV+ in thriller 'The Last Thing He Told Me',"Julia Roberts is the latest star headed for Apple TV+. She’ll reportedly take the lead in the mystery-thriller ""The Last Thing He Told Me.""","Julia Roberts is the latest star putting in an appearance on Apple TV+. She’ll reportedly take the lead in an adaptation of the mystery-thriller The Last Thing He Told Me.
The novel is by Laura Dave, and is set to be published by Simon & Schuster in ... [1425 chars]",https://www.cultofmac.com/730094/julia-roberts-the-last-thing-he-told-me-apple-tv-plus/,https://cdn.cultofmac.com/wp-content/uploads/2020/12/99ED552A-6FF2-4E7B-BC86-BC6F15191DC5.jpeg,"{'name': 'Cult of Mac', 'url': 'https://www.cultofmac.com'}"
2020-12-10 23:45:28+00:00,Apple believes Fitness+ can make exercise more approachable for everyone,Apple's Jay Blahnik sat down with Fast Company to talk about how beginners will especially find Fitness+ helpful to get and stay motivated.,"In an interview with Fast Company, Jay Blahnik, Apple's head of fitness technology, says that the upcoming Apple Fitness+ workout subscription service is an evolution of the Apple Watch.
""We feel like this is an iteration of the things we've been doi... [682 chars]",https://www.imore.com/apple-believes-fitness-can-make-exercise-more-approachable-everyone,https://www.imore.com/sites/imore.com/files/styles/large/public/field/image/2020/12/jay-blahnik-fitness-plus-announcement.jpg,"{'name': 'iMore', 'url': 'https://www.imore.com'}"
2020-12-10 23:28:44+00:00,Julia Roberts to star in 'The Last Thing He Told Me' on Apple TV+,"The series, which follows the story of a woman who is searching for her missing husband, will also be executive produced by Roberts.","Reported by Deadline, Oscar winner Julia Roberts is returning to television to star in a new series on Apple TV+. The series, titled The Last Thing He Told Me, will be executive produced by Roberts and comes from Reese Witherspoon's Hello Sunshine st... [1576 chars]",https://www.imore.com/julia-roberts-star-last-thing-he-told-me-apple-tv,https://www.imore.com/sites/imore.com/files/styles/large/public/field/image/2020/12/julia-roberts_0.jpg,"{'name': 'iMore', 'url': 'https://www.imore.com'}"
2020-12-10 23:24:29+00:00,Broadcom names Kirsten Spears as CFO in leadership shakeup,"Broadcom Inc on Thursday appointed its principal accounting officer, Kirsten Spears, as chief financial officer and forecast first-quarter revenue above estimates as key client Apple Inc doubles down on 5G devices, driving demand for its chips.","(Reuters) -Broadcom Inc on Thursday appointed its principal accounting officer, Kirsten Spears, as chief financial officer and forecast first-quarter revenue above estimates as key client Apple Inc doubles down on 5G devices, driving demand for its c... [1418 chars]",https://www.reuters.com/article/us-broadcom-results/broadcom-names-kirsten-spears-as-cfo-in-leadership-shakeup-idUSKBN28K36O,https://static.reuters.com/resources/r/?m=02&d=20201210&t=2&i=1544158199&r=LYNXMPEGB91R0&w=800,"{'name': 'Reuters', 'url': 'https://www.reuters.com'}"
2020-12-10 21:38:57+00:00,Google and Apple want to ban developers that use X-Mode software to track you,Google and Apple have moved quickly to ban applications that use X-Mode location tracking software. X-Mode has come under intense scrutiny by media and U.S. Senate investigations due to alleged improper use and handling of user location data.,"According to the Wall Street Journal, both Alphabet/Google and Apple have announced that they will no longer allow developers to use the location tracking information provided by X-Mode Social Inc. in apps running on their Android or iOS platforms.
X... [1795 chars]",https://www.androidcentral.com/google-and-apple-want-ban-developers-use-x-mode-software-track-you,https://www.androidcentral.com/sites/androidcentral.com/files/styles/large/public/article_images/2020/06/location-sharing-android-2.jpg,"{'name': 'Android Central', 'url': 'https://www.androidcentral.com'}"
2020-12-10 21:08:16+00:00,A cheaper entry-level iPad with an iPhone 11-era chipset could come in early 2021,"A new leak claims Apple is revamping its 10.5-inch iPad with an A13 Bionic chipset and Touch ID, and it may come out in early 2021.","Apple just announced a new 10.2-inch iPad in September, but another one might be coming our way early next year: a new leak suggests an entry-level iPad could arrive in Q1 2021 with a larger 10.5-inch display, upgraded specs with an A13 Bionic chipse... [1729 chars]",https://www.techradar.com/news/a-cheaper-entry-level-ipad-with-an-iphone-11-era-chipset-could-come-in-early-2021,https://cdn.mos.cms.futurecdn.net/wXtEZvfqRRPUTv66ivqNDg-1200-80.jpg,"{'name': 'TechRadar', 'url': 'https://www.techradar.com'}"
2020-12-10 21:00:21+00:00,The Last Thing He Told Me Will Star Julia Roberts,"Apple TV+ has given a straight-to-series order for The Last Thing He Told Me, starring Julia Roberts.","When Apple TV+ was announced and revealed its initial lineup, people mostly shrugged. Sure, they had big names, but nothing seemed particularly memorable. But the service has pressed on and built itself an interesting amount of programming including ... [2341 chars]",https://www.slashfilm.com/the-last-thing-he-told-me/,https://d13ezvd6yrslxm.cloudfront.net/wp/wp-content/images/The-Last-Thing-He-Told-Me.jpg,"{'name': '/FILM', 'url': 'https://www.slashfilm.com'}"
2020-12-10 21:00:04+00:00,Grab a pair of Apple AirPods Pro for $190 at Woot! for the holidays,"Did you miss the Black Friday deals on the Apple AirPods Pro? Well, Woot! is giving you another chance with $190 pairs now!","Woot! has a last-minute Apple AirPods Pro holiday sale for just $190
So the Apple AirPods Pro were on sale during Black Friday and Cyber Monday, but you might have been busy then. Like, say, safely enjoying the company of family and friends and celeb... [1526 chars]",https://www.xda-developers.com/apple-airpods-pro-woot-holiday-deal/,https://www.xda-developers.com/files/2020/10/top-tech-deals-airpods-pro-header.jpg,"{'name': 'XDA Developers', 'url': 'https://www.xda-developers.com'}"
2020-12-10 20:52:23+00:00,Ex-Apple employees say company ignored China labor-law violations,"A dispatch-worker law led to studies, debate within Apple—but not enough action.",A new report in The Information cites both former Apple employees and the company's internal presentations and data to make the case that Apple has failed to keep its manufacturing partners in China accountable after the Chinese government passed a n... [5464 chars],https://arstechnica.com/gadgets/2020/12/ex-apple-employees-say-company-ignored-china-labor-law-violations/,https://cdn.arstechnica.net/wp-content/uploads/2018/03/Apple_Pegatron_03072018-760x380.jpg,"{'name': 'Ars Technica', 'url': 'https://arstechnica.com'}"
2020-12-09 23:33:14+00:00,Apple to Ban Apps With X-Mode Tracker That Sells Data to U.S. Defense Contractors,"Both Apple and Google this week told developers that they need to remove X-Mode Social tracking software from all of their apps or risk a ban,...","Both Apple and Google this week told developers that they need to remove X-Mode Social tracking software from all of their apps or risk a ban, reports The Wall Street Journal. Apple and Google are aiming to prevent X-Mode Social from collecting locat... [2263 chars]",https://www.macrumors.com/2020/12/09/apple-bans-apps-x-mode-tracker/,https://images.macrumors.com/t/t4lx_KTSAEtmIvAO9hsZiHI6tDg=/1600x/https://images.macrumors.com/article-new/2020/09/apple-developer-banner.jpeg,"{'name': 'MacRumors', 'url': 'https://www.macrumors.com'}"
2020-12-09 23:03:57+00:00,"'Extrapolations,' a new series on climate change, is coming to Apple TV+","The series, which hails from Scott Z. Burns and Media Res, will explore how climate change will impact our lives going forward.","Reported by Variety, Apple TV+ has landed Extrapolations, an anthology series that will dive into the topic of climate change. The series will be written, directed, and executive produced by Scott Z. Burns.
The series will span ten episodes and focus... [1249 chars]",https://www.imore.com/extrapolations-new-series-climate-change-coming-apple-tv,https://www.imore.com/sites/imore.com/files/styles/large/public/field/image/2020/12/scott-z-burns-creative-impact.jpg,"{'name': 'iMore', 'url': 'https://www.imore.com'}"
2020-12-09 22:55:00+00:00,Why One Analyst Thinks Apple Stock Is Worth $160 a Share,"Apple stock will move higher thanks to higher sales of the iPhone 12, strength in China’s market, and potential customer phone upgrades, one analyst says.","Text size
Apple stock has pared back since its Sept. 1 closing high, but an analyst at Wedbush thinks the technology firm will ride a handful of tailwinds through the holiday season.
Wedbush analyst Dan Ives raised his price target on the stock to $1... [1505 chars]",https://www.barrons.com/articles/why-one-bullish-analyst-thinks-apple-stock-is-worth-160-a-share-51607554552,https://images.barrons.com/im-270718/social,"{'name': ""Barron's"", 'url': 'https://www.barrons.com'}"
2020-12-09 22:53:00+00:00,New Apple survey brings one good news and one bad news about iPhone 13,The company is wondering what you do with the few remaining items that adorn the iPhone 12 box.,"This is suggested by a new This is suggested by a new 9to5Mac report, which says Apple is currently surveying iPhone 12 owners, probably to prepare them for the changes that are coming next year.
One of the questions asks users if they are dissatisfi... [1684 chars]",https://www.phonearena.com/news/survey-suggests-iphone-13-will-have-touch-id-but-no-usb-cable_id128811,https://m-cdn.phonearena.com/images/article/128811-two_1200/New-Apple-survey-brings-one-good-news-and-one-bad-news-about-iPhone-13.jpg,"{'name': 'PhoneArena', 'url': 'https://www.phonearena.com'}"
2020-12-09 22:48:42+00:00,"Apple survey hints at Touch ID in the next iPhone, no USB cable in box",A new survey sent to iPhone 12 owners asks if they are satisfied with Face ID and if they use the USB cable in the box of the iPhone.,"Reported by 9to5Mac, Apple is surveying iPhone owners about their satisfaction with Face ID and if they use the USB cable that comes in the box with their phone. The survey, which seems to be targeted at customers who purchased one of the new iPhone ... [559 chars]",https://www.imore.com/apple-survey-hints-touch-id-next-iphone-no-usb-cable-box,https://www.imore.com/sites/imore.com/files/styles/large/public/field/image/2020/10/iphone-12-box-press.jpg,"{'name': 'iMore', 'url': 'https://www.imore.com'}"
2020-12-09 22:42:00+00:00,Apple and Google to Stop X-Mode From Collecting Location Data From Users’ Phones,"After the data broker came under scrutiny for national-security work, tech giants tell app developers to remove trackers or lose access to their operating systems.",Apple Inc. and Alphabet Inc.’s Google will ban the data broker X-Mode Social Inc. from collecting any location information drawn from mobile devices running their operating systems in the wake of revelations about the company’s national-security work... [1012 chars],https://www.wsj.com/articles/apple-and-google-to-stop-x-mode-from-collecting-location-data-from-users-phones-11607549061,https://images.wsj.net/im-270597/social,"{'name': 'The Wall Street Journal', 'url': 'https://www.wsj.com'}"
2020-12-09 22:40:00+00:00,"Apple stock could surge 61% to $200, according to this analyst",Is he right?,"The Motley Fool Australia » International Stock News » Apple stock could surge 61% to $200, according to this analyst
This article was originally published on Fool.com. All figures quoted in US dollars unless otherwise stated.
Shares of Apple Inc (NA... [1935 chars]",https://www.fool.com.au/2020/12/10/apple-stock-could-surge-61-to-200-according-to-this-analyst-usfeed/,https://www.fool.com.au/wp-content/uploads/2020/12/apple-stock.jpg,"{'name': 'Motley Fool Australia', 'url': 'https://www.fool.com.au'}"
2020-12-09 22:36:50+00:00,Why I'm skipping the AirPods Max in favor of Apple's last-generation earbuds,"The AirPods Max look intriguing, but at least one early adopter is holding off in favor of Apple's slightly older Powerbeats Pro.","Sorry, Apple. You're not getting my money for the new AirPods Max headphones. I'm buying last year's Powerbeats Pro earbuds instead, so congrats... Apple?
Yes, the Cupertino-based company will be getting my money in the end, but not 3.6x as much as i... [5279 chars]",https://www.techradar.com/news/why-im-skipping-the-airpods-max-in-favor-of-apples-last-generation-earbuds,https://cdn.mos.cms.futurecdn.net/tZowRMCPeaq8WqT5CGnqmR-1200-80.jpg,"{'name': 'TechRadar', 'url': 'https://www.techradar.com'}"
2020-12-09 22:27:45+00:00,Apple will put privacy labels on its website but it won't satiate WhatsApp,Apple says it's going to share its own privacy labels for its own apps. But will anyone see them if they're on apple.com?,"Facebook-owned WhatsApp has been making noise today, complaining about the privacy labels that Apple is forcing apps to display in the App Store. WhatsApp's developers have already complied with the requirement, but nobody seems happy about it. The i... [1860 chars]",https://www.imore.com/apple-will-put-privacy-labels-its-website-it-wont-satiate-whatsapp,https://www.imore.com/sites/imore.com/files/styles/large/public/field/image/2016/03/app-store-iphone-se-ipad-pro-hero.jpg,"{'name': 'iMore', 'url': 'https://www.imore.com'}"
2020-12-09 22:27:17+00:00,Environmental Nutrition: All for apples!,The beloved apple is quite likely the world’s most famous fruit.,"Apples (Malus domestica) are members of the rose (Rosaceae) family, along with many fruits, including cherries, peaches and strawberries. More than 7,500 varieties of apples are grown around the world. Skin color ranges from pale to deep reds, yellow... [441 chars]",https://www.nydailynews.com/life-style/eats/sns-apples-folklore-findings-facts-20201209-6ryytk3kanfwriffppb3kfpilu-story.html,https://www.nydailynews.com/resizer/rVkAlttftALylkL9SFUCxRyNudY=/1200x0/top/cloudfront-us-east-1.images.arcpublishing.com/tronc/B6XSHGDEC5B25NX2URV6FXZUJM.jpg,"{'name': 'New York Daily News', 'url': 'https://www.nydailynews.com'}"
