publishedAt,title,description,content,url,image,source
2021-04-15 21:36:00+00:00,These iPhone 13/Pro concept renders give us our best look yet at Apple's next iPhones,These iPhone 13 and iPhone 13 Pro concept renders give us our best look yet at Apple's 2021 iPhone series. The iPhone 13 models are expected to debut in September 2021.,"To avoid increasing the overall size of the iPhone 13’s camera bump and ensure backward compatibility with iPhone 12 cases and accessories, perhaps Apple is switching to a diagonal layout to create more room for each sensor.
As for the front of the i... [2788 chars]",https://www.phonearena.com/news/apple-iphone-13-pro-new-design-concept-renders_id131473,https://m-cdn.phonearena.com/images/article/131473-wide-two_1200/These-iPhone-13Pro-concept-renders-give-us-our-best-look-yet-at-Apples-next-iPhones.jpg,"{'name': 'PhoneArena', 'url': 'https://www.phonearena.com'}"
2021-04-14 23:41:19+00:00,Apple Pay launches its latest campaign in celebration of Earth Day,Apple has launched its latest Apple Pay promotion in which the company will donate money to Conservation International.,"Apple is back at it with the company's latest Apple Pay promotion, and this time it is all about Earth Day.
Between today and April 22, Apple says that it will donate $1 (up to $1 million total) to Conservation International for every transaction mad... [1415 chars]",https://www.imore.com/apple-pay-launches-fundraising-campaign-celebrate-earth-day,https://www.imore.com/sites/imore.com/files/styles/large/public/field/image/2021/04/apple-pay-earth-day-2021.jpg,"{'name': 'iMore', 'url': 'https://www.imore.com'}"
2021-04-14 23:29:26+00:00,How the FBI tapped an Australian firm to unlock a terrorist’s iPhone,Publicity-shy Azimuth Security came to Apple’s rescue by ending a case that could have led to a court-ordered back door to the iPhone.,"Five years ago, Apple and the FBI both cast the struggle over the iPhone as a moral battle. The FBI believed Apple should help it obtain information to investigate the terrorist attack. Apple believed that creating a back door into the phone would we... [2331 chars]",https://www.afr.com/technology/the-fbi-tapped-an-australian-firm-to-unlock-a-terrorist-s-iphone-20210415-p57jdb,https://static.ffx.io/images/$zoom_0.8034%2C$multiply_0.7554%2C$ratio_1.776846%2C$width_1059%2C$x_474%2C$y_330/t_crop_custom/e_sharpen:25%2Cq_85%2Cf_jpg/t_afr_no_label_no_age_social_wm/33672e3e1eea2d11813cdcf957ea64fe0e07dbf7,"{'name': 'The Australian Financial Review', 'url': 'https://www.afr.com'}"
2021-04-14 23:20:35+00:00,The true story of how the FBI cracked the San Bernardino shooter’s iPhone,"Apple and the FBI were engaged in a massive fight over encryption in the early part of 2016, following the December 2015 mass shooting in San Bernardino. A husband and wife shot and killed more than a dozen people, and then they died in the ensuing fight with the police.","Apple and the FBI were engaged in a massive fight over encryption in the early part of 2016, following the December 2015 mass shooting in San Bernardino. A husband and wife shot and killed more than a dozen people, and then they died in the ensuing f... [5289 chars]",https://bgr.com/tech/san-bernardino-iphone-hack-how-azimuth-broke-encryption-5919480/,https://bgr.com/wp-content/uploads/2021/03/rsz_adobestock_207766680.jpg?quality=70&strip=all,"{'name': 'BGR', 'url': 'https://bgr.com'}"
2021-04-14 23:00:00+00:00,"Has Apple lost the innovation edge? After seven years on the market, Apple has decided Bluetooth tracking is an excellent idea",Apple ready to launch their own take on Bluetooth tracker.,"life-style, life,
When it comes to business product development, is it better to be the first to market or to be the best on the market? If you believe the marketing from one particular potato chip company, the best outcome is to be both - ""the origi... [3488 chars]",https://www.canberratimes.com.au/story/7209466/apple-wasnt-first-to-market-with-bluetooth-trackers-but-they-could-be-best-in-the-business/,https://www.canberratimes.com.au/images/transform/v1/crop/frm/jess.wallace/63bfb90f-15f1-42c8-a50f-ff4ecd834a36.jpg/r0_323_6000_3713_w1200_h678_fmax.jpg,"{'name': 'The Canberra Times', 'url': 'https://www.canberratimes.com.au'}"
2021-04-14 22:49:09+00:00,The latest Apple AR headset leak might be the craziest one yet,"Apple leaks have become a daily occurrence, but it's not often that we get as much information in one day as we got from KGI Securities analyst Ming-Chi Kuo on Wednesday.","Apple leaks have become a daily occurrence, but it’s not often that we get as much information in one day as we got from KGI Securities analyst Ming-Chi Kuo on Wednesday. In what was his most comprehensive reports to date, Kuo dropped multiple bombsh... [3325 chars]",https://bgr.com/tech/apple-headset-ar-vr-cameras-leak-report-5919535/,https://bgr.com/wp-content/uploads/2020/10/apple-iphone-12-event-101.jpg?quality=70&strip=all,"{'name': 'BGR', 'url': 'https://bgr.com'}"
2021-04-14 22:18:00+00:00,The Falcon and the Winter Soldier Teases Some Potentially Big Cameos,"The Black Adam cast continues to grow, as does Netflix’s Midnight Club adaptation. Get a look at Apple’s adaptation of Stephen King’s Lisey’s","The Falcon and the Winter Soldier Teases Some Potentially Big Cameos
The Black Adam cast continues to grow, as does Netflix’s Midnight Club adaptation. Get a look at Apple’s adaptation of Stephen King’s Lisey’s Story. Plus, what’s to come on The Flas... [3803 chars]",https://www.gizmodo.com.au/2021/04/the-falcon-and-the-winter-soldier-teases-some-potentially-big-cameos/,https://imgix.gizmodo.com.au/content/uploads/sites/2/2021/04/14/mr0wnacgydaxrir5iiov.png?ar=16%3A9&auto=format&fit=crop&q=80&w=1280&nrs=30,"{'name': 'Gizmodo Australia', 'url': 'https://www.gizmodo.com.au'}"
2021-04-14 21:38:44+00:00,Most US stocks rise after strong start to earnings season,"Most U.S. stocks rose Wednesday following an encouraging start to whats expected to be a thunderous earnings reporting season, but major indexes still ended mixed as drops in several tech heavyweights including Apple and Facebook weighed them down.","Most U.S. stocks rose Wednesday following an encouraging start to what's expected to be a thunderous earnings reporting season, but major indexes still ended mixed as drops in several tech heavyweights including Apple and Facebook weighed them down. ... [503 chars]",https://www.devdiscourse.com/article/headlines/1534853-most-us-stocks-rise-after-strong-start-to-earnings-season,https://www.devdiscourse.com/remote.axd?https://devdiscourse.blob.core.windows.net/imagegallery/28_10_2020_12_58_13_6307289.jpg?width=920&format=jpeg,"{'name': 'Devdiscourse', 'url': 'https://www.devdiscourse.com'}"
2021-04-14 21:35:39+00:00,What to expect from Apple’s “Spring Loaded” event on April 20,"This event is mysterious, but we're confident iPads will figure prominently.","It might have taken longer than expected (the event has historically taken place in March), but Apple announced its spring product unveiling event this week. Executives from the company will take to the stage in a livestream from Apple's Cupertino he... [6200 chars]",https://arstechnica.com/gadgets/2021/04/what-to-expect-from-apples-spring-loaded-event-on-april-20/,https://cdn.arstechnica.net/wp-content/uploads/2021/04/apple-spring-loaded-crystal-ball-760x380.jpg,"{'name': 'Ars Technica', 'url': 'https://arstechnica.com'}"
2021-04-14 21:29:00+00:00,"2022 iPhones said to include 48-megapixel camera, 8K video capture, and no ""mini"" model","A new report from analyst Ming-Chi Kuo indicates that Apple may drop the 5.4-inch iPhone from its 2022 lineup, and instead will only offer two mainstream and...","Rumor mill: The iPhone 13 is still months away, but we're already getting hints on what the generation coming after it is going to look like. The camera module will see a big upgrade, but if you're a fan of the ""mini"" size iPhone 12, that probably wo... [2068 chars]",https://www.techspot.com/news/89310-2022-iphones-include-48-megapixel-camera-8k-video.html,https://static.techspot.com/images2/news/bigimage/2021/04/2021-04-14-image-18.jpg,"{'name': 'TechSpot', 'url': 'https://www.techspot.com'}"
2021-04-14 21:16:44+00:00,"If you get this message from Apple, don’t open it, because it’s a scam","Every so often, I'll get a call from a family member or friend asking about a strange and concerning warning that popped up on their Mac. The messages are typically ominous and warn that the machine in question may have been infected with a virus.","Every so often, I’ll get a call from a family member or friend asking about a strange and concerning warning that popped up on their Mac. The messages are typically ominous and warn that the machine in question may have been infected with a virus. Ot... [3118 chars]",https://bgr.com/tech/apple-warning-scam-customer-support-fake-ignore-5919483/,https://bgr.com/wp-content/uploads/2020/11/Apple-One-More-Thing-November.jpg?quality=70&strip=all,"{'name': 'BGR', 'url': 'https://bgr.com'}"
2021-04-13 23:35:58+00:00,Scorsese's Killers Of The Flower Moon Adds Four Cast Members,Casting continues on Martin Scorsese's upcoming Apple Studios film.,"Martin Scorsese might have a lot to say about streaming, but he knows a green light when he sees one, and so the director is working on his next film, Killers of the Flower Moon, for Apple Studios. Now, Scorsese has added four new members to the film... [858 chars]",https://www.gamespot.com/articles/scorseses-killers-of-the-flower-moon-adds-four-cast-members/1100-6490102/,https://gamespot1.cbsistatic.com/uploads/screen_kubrick/1603/16030002/3796513-scorsese.jpg,"{'name': 'GameSpot', 'url': 'https://www.gamespot.com'}"
2021-04-13 23:35:42+00:00,Siri's A Snitch,Siri has just spilled the beans on when Apple's April event is. Apparently the assistant hasn't heard that snitches get stitches.,"Siri’s A Snitch
Siri just spilled the beans on when Apple’s April event is. Apparently the assistant hasn’t heard that snitches get stitches.
Dammit, Siri
Asking when Apple’s next event ism Siri replies by saying “The special event is on Tuesday, Apr... [1749 chars]",https://www.gizmodo.com.au/2021/04/apple-april-event-siri-snitch/,https://imgix.gizmodo.com.au/content/uploads/sites/2/2021/04/14/apple-spring-loaded.jpg?ar=16%3A9&auto=format&fit=crop&q=65&w=1280,"{'name': 'Gizmodo Australia', 'url': 'https://www.gizmodo.com.au'}"
2021-04-13 23:10:32+00:00,Six new cast members join upcoming Apple TV+ comedy series 'Acapulco',"Jessica Collins, Chord Overstreet, Vanessa Bauche, Rafael Cebrián, Fernando Carsa, and Regina Reynoso have all signed on for roles.","Six more cast members have signed on to star in the upcoming bilingual comedy Acapulco on Apple TV+.
As reported by Deadline, Jessica Collins, Chord Overstreet, Vanessa Bauche, Rafael Cebrián, Fernando Carsa, and Regina Reynoso have all signed on for... [2235 chars]",https://www.imore.com/six-new-cast-members-join-upcoming-appletv-comedy-series-acapulco,https://www.imore.com/sites/imore.com/files/styles/large/public/field/image/2020/12/apple-tv-plus-acapulco-key-art.jpg,"{'name': 'iMore', 'url': 'https://www.imore.com'}"
2021-04-13 23:00:00+00:00,What product are you most excited to see at Apple April Event?,Apple announced its first event of the year on April 20. There are a lot of products Apple could reveal as well as iOS 14.5.,"Apple has announced its first event of the year on April 20. With the tagline of ‘Spring Loaded’, there are a number of products Apple could reveal during the event as well as the relase date for iOS 14.5 What are you most excited to see?
The most li... [2072 chars]",https://9to5mac.com/2021/04/13/poll-apple-april-event/,https://i1.wp.com/9to5mac.com/wp-content/uploads/sites/6/2021/04/how-to-watch-apples-april-event.jpg?resize=1200%2C628&quality=82&strip=all&ssl=1,"{'name': '9to5Mac', 'url': 'https://9to5mac.com'}"
2021-04-13 23:00:00+00:00,LG And Magna On Deck As Latest Rumored Apple Car Partners,"Obviously, there’s nothing official at this point, though a South Korean publication claims LG and Magna are close to signing a deal with the tech giant.","Yes, folks - it’s happening again. A new report speculates Apple could be in talks with a potential partner to help it build its first car. Obviously, there’s nothing official at this point, though a South Korean publication claims LG and Magna are c... [1605 chars]",https://www.motor1.com/news/500870/lg-magna-apple-car-partners/,https://cdn.motor1.com/images/mgl/bRRw6/s1/2020-new-models-guide.jpg,"{'name': 'Motor1 ', 'url': 'https://www.motor1.com'}"
2021-04-13 22:58:37+00:00,Apple TV+ announces 'Watch the Sound with Mark Ronson' docuseries,The six-part documentary series will pit Grammy award-winning artist and producer Mark Ronson on a quest to understand the technology behind the music we love.,"Mark Ronson, the famed artist and producer, is coming to Apple TV+ with a new docuseries about the technology that has shaped the music industry.
The company has announced that Watch the Sound with Mark Ronson, a new six-part documentary series, will... [2018 chars]",https://www.imore.com/apple-tv-announces-watch-sound-mark-ronson-docuseries,https://www.imore.com/sites/imore.com/files/styles/large/public/field/image/2019/03/apple-introduces-apple-tv-plus-03252019.jpg,"{'name': 'iMore', 'url': 'https://www.imore.com'}"
2021-04-13 22:50:05+00:00,Why you need to delete the Facebook Messenger app on your Apple iPhone or Google Android phone,There are three key reasons a cybersecurity expert is calling for the 1.3 billion users of Messenger to drop the instant messaging platform.,"A cybersecurity expert is leading calls for Facebook users to dump its Messenger app after the tech giant confirmed significant delays to to enhancements its own executives have labelled as “essential”.
Zak Doffman, who has previously warned users to... [3564 chars]",https://7news.com.au/technology/why-this-cybersecurity-expert-is-calling-for-you-to-delete-the-facebook-messenger-app-c-2588330,https://images.7news.com.au/publication/C-2588330/380ccc967c9c38a6f6402f284bf7c7696ef8484a-16x9-x0y376w4220h2374.jpg?imwidth=1024,"{'name': '7NEWS.com.au', 'url': 'https://7news.com.au'}"
2021-04-13 22:44:52+00:00,"Apple to hold ‘Spring Loaded’, its first product unveiling of the year on April 20, featuring new iPad Pro, security features","The technology giant dubbed the event ‘Spring Loaded’ in a media invitation after its devices’ personal assistant, Siri, confirmed the event to those who asked.","Los Angeles | Apple’s first product unveiling of this year will take place on April 20, the company said on Tuesday, US time.
The Cupertino, California-based technology giant dubbed the event “Spring Loaded” in a media invitation, after Siri confirme... [1221 chars]",https://www.afr.com/world/north-america/apple-to-hold-first-product-unveiling-of-the-year-on-april-20-20210414-p57j16,https://static.ffx.io/images/$zoom_0.5533%2C$multiply_0.7554%2C$ratio_1.776846%2C$width_1059%2C$x_388%2C$y_55/t_crop_custom/e_sharpen:25%2Cq_85%2Cf_jpg/t_afr_no_label_no_age_social_wm/0f8bca365efa6d2831d6d0dcf06c8b57e0b9bbb2,"{'name': 'The Australian Financial Review', 'url': 'https://www.afr.com'}"
2021-04-13 22:38:44+00:00,You can now get a reminder when the Apple Event goes live on YouTube,"Apple has posted a placeholder video for its upcoming event on YouTube, and you can ask to be reminded when they go live.","You can now set up YouTube to remind you when the Apple Event goes live on April 20th.
Earlier today, Apple officially announced that it will hold a virtual event on April 20th at 10:00 AM PDT. In addition to being able to watch the event on the Appl... [256 chars]",https://www.imore.com/you-can-now-get-reminder-when-apple-event-goes-live-youtube,https://www.imore.com/sites/imore.com/files/styles/large/public/field/image/2021/04/apple-event-april-2021-youtube-reminder.jpg,"{'name': 'iMore', 'url': 'https://www.imore.com'}"
2021-04-13 22:21:16+00:00,The #AppleEvent hashflag has gone live on Twitter,"Ahead of the upcoming Apple event, the #AppleEvent hashtag has gotten its own hashflag.","The Apple Event, which was originally expected to occur in March, was actually leaked by Siri early this morning. While Apple is keeping its cards close to the chest as per usual, a new report from Bloomberg predicts that the company will announce an... [892 chars]",https://www.imore.com/appleevent-hashflag-has-gone-live-twitter,https://www.imore.com/sites/imore.com/files/styles/large/public/field/image/2021/04/apple-event-april-2021-logo.jpg,"{'name': 'iMore', 'url': 'https://www.imore.com'}"
2021-04-12 23:57:00+00:00,LG USA customers will flock to Samsung and Motorola handsets after its exit: report,Samsung and Motorola are in a better position to benefit from LG's exit than Apple because they target various price segments.,"After 23 straight loss-making quarters, LG has decided to bow out of the smartphone business . Although the company's global market share is insignificant, it was the third-largest vendor in North America last year with 10 percent of the pie, per dat... [2100 chars]",https://www.phonearena.com/news/lg-market-share-will-be-grabbed-by-samsung-motorola_id131388,https://m-cdn.phonearena.com/images/article/131388-wide-two_1200/LG-USA-customers-will-flock-to-Samsung-and-Motorola-handsets-after-its-exit-report.jpg,"{'name': 'PhoneArena', 'url': 'https://www.phonearena.com'}"
2021-04-12 23:42:44+00:00,Tim Cook says App Store will become a 'flea market' if Epic wins lawsuit,"In an interview with the Toronto Star, Apple CEO Tim Cook had some thoughts about the upcoming Epic Games trial.","Tim Cook thinks that, if Epic Games had its way, the App Store would become a cesspool of sleazy salesmen and door-to-door charlatans.
In an interview with the Toronto Star, the CEO talked about the effect that the App Store has had in Canada. He war... [1438 chars]",https://www.imore.com/tim-cook-claims-app-store-will-become-flea-market-if-epic-wins-lawsuit,https://www.imore.com/sites/imore.com/files/styles/large/public/field/image/2021/03/tim-cook-people_0.jpg,"{'name': 'iMore', 'url': 'https://www.imore.com'}"
2021-04-12 23:01:14+00:00,Champaign Police search for suspects accused of stealing Apple products from Campustown Target,"CHAMPAIGN, Ill. (WCIA) — Champaign Police need help identifying two theft suspects. They said two men walked into the Target in Campustown and stole Apple products. One suspect was 5’8″ and weighed around 200 pounds. He was wearing a gray hat and blue shirt. The other suspect was 5’11” and weighed about 160 pounds. He […]","CHAMPAIGN, Ill. (WCIA) — Champaign Police need help identifying two theft suspects.
They said two men walked into the Target in Campustown and stole Apple products. One suspect was 5’8″ and weighed around 200 pounds. He was wearing a gray hat and blu... [492 chars]",https://www.wcia.com/news/champaign-police-search-for-suspects-accused-of-stealing-apple-products-from-campustown-target/,https://www.wcia.com/wp-content/uploads/sites/44/2021/04/Target-Theft-Suspects-04122021.png?w=1280,"{'name': 'wcia.com', 'url': 'https://www.wcia.com'}"
2021-04-12 23:00:00+00:00,Apple confirms ‘special event’ for April 20th,A spring event had been widely rumoured to be in the works,"Apple has confirmed it will hold a virtual event next week, and is expected to reveal several new products.
The event on Tuesday April 20th will be the company’s first of 2021 and will again take place online as part of the response to the Covid-19 p... [969 chars]",https://www.breakingnews.ie/business/apple-confirms-special-event-for-april-20-1111021.html,https://img.resized.co/breaking-news/eyJkYXRhIjoie1widXJsXCI6XCJodHRwczpcXFwvXFxcL2ltYWdlcy5icmVha2luZ25ld3MuaWVcXFwvcHJvZFxcXC91cGxvYWRzXFxcLzIwMjFcXFwvMDRcXFwvMTMyMTMwNDZcXFwvNGM0ZmExMGEtNmNjYy00ZmI3LTllMjEtNTZlMDE3ZTgyOTYwLnBuZ1wiLFwid2lkdGhcIjoxMjAwLFwiaGVpZ2h0XCI6NjI3LFwiZGVmYXVsdFwiOlwiaHR0cHM6XFxcL1xcXC93d3cuYnJlYWtpbmduZXdzLmllXFxcL2ltYWdlc1xcXC9uby1pbWFnZS5wbmdcIixcIm9wdGlvbnNcIjpbXX0iLCJoYXNoIjoiNWY3NmJmZjlhZDA4NThhNWFjMGUwZDgxMmUzNDI5MjRhNzA4ODI3MSJ9/apple-confirms-special-event-for-april-20th.png,"{'name': 'BreakingNews.ie', 'url': 'https://www.breakingnews.ie'}"
2021-04-12 23:00:00+00:00,Apple's decision to give the 5G iPhone 13 Pro line a variable refresh rate will mean changes ahead,"The Apple iPhone 13 Pro series is expected to be equipped with a variable 120Hz ProMotion display using LTPO technology. This will help LTPO surpass LTPS tech by 2023.,","This year, the Apple iPhone 13 Pro models are expected to feature the 120Hz ProMotion rapid refresh display. Scrolling becomes buttery smooth as does mobile game animation. But the problem with updating the screen 120 times a second is that it drains... [2250 chars]",https://www.phonearena.com/news/ltpo-to-top-ltps-by-2023-thanks-to-5g-iphone-13-pro_id131385,https://m-cdn.phonearena.com/images/article/131385-wide-two_1200/Apples-decision-to-give-the-5G-iPhone-13-Pro-line-a-variable-refresh-rate-will-mean-changes-ahead.jpg,"{'name': 'PhoneArena', 'url': 'https://www.phonearena.com'}"
2021-04-12 23:00:00+00:00,Epic Games gets $28.7bn valuation in latest funding,"Epic Games, which is in the middle of a legal battle with Apple, has raised $1 billion in a funding round that valued the ""Fortnite"" maker at $28.7 billion.","Epic Games, which is in the middle of a legal battle with Apple, has raised $1 billion in a funding round that valued the ""Fortnite"" maker at $28.7 billion.
People staying at home during the Covid-19 pandemic have turned to games for entertainment, h... [1526 chars]",https://www.rte.ie/news/business/2021/0413/1209694-epic-games-gets-28-7bn-valuation-in-latest-funding/,https://img.rasset.ie/00150cd8-1600.jpg,"{'name': 'RTE.ie', 'url': 'https://www.rte.ie'}"
2021-04-12 22:51:09+00:00,The Epic Games Store is projected to lose $139 million in 2021,"According to new court documents filed by Apple, the Epic Games Store appears to still be far away from reaching profitability.","The Epic Games Store is not a source of revenue for Epic Games, and the company does not seem to care.
As reported by Ars Technica, Apple recently submitted court documents that detail the earnings, or lack thereof, of the Epic Games Store. According... [2112 chars]",https://www.imore.com/epic-games-store-projected-lose-139-million-2021,https://www.imore.com/sites/imore.com/files/styles/large/public/field/image/2019/07/epic-games-warning-fortnite-ios.jpg,"{'name': 'iMore', 'url': 'https://www.imore.com'}"
2021-04-12 22:22:43+00:00,Report: Apple plans Apple TV/HomePod and iPad/HomePod hybrid products,Also: Mini LED display supply might make the new iPad Pro hard to find.,"Apple is working on multiple new products to replace the recently discontinued HomePod and to bring Siri and Apple services into living rooms, according to a new report from Bloomberg's Debby Wu and Mark Gurman.
One of those products would be a devic... [3670 chars]",https://arstechnica.com/gadgets/2021/04/report-apple-plans-apple-tv-homepod-and-ipad-homepod-hybrid-products/,https://cdn.arstechnica.net/wp-content/uploads/2021/04/HomePod9-1-1440x960-760x380.jpg,"{'name': 'Ars Technica', 'url': 'https://arstechnica.com'}"
2021-04-12 22:00:00+00:00,Google and Apple top Singapore’s Best Employers list,"Singapore News - Employers' overall management of the Covid-19 crisis in Singapore was generally seen positively by employees, although some did better than others, according to the results of a survey published today. The ranking of the top 200 Singapore's Best Employers 2021, among... Read more at www.tnp.sg","Google came in first in the ranking of top 200 Singapore's Best Employers 2021.
Employers' overall management of the Covid-19 crisis in Singapore was generally seen positively by employees, although some did better than others, according to the resul... [2234 chars]",https://www.tnp.sg/news/singapore/google-and-apple-top-singapores-best-employers-list,https://www.tnp.sg/sites/default/files/styles/rl680/public/articles/2021/04/13/NP_20210413_JSBEST13_6464804.jpg?itok=cw7JqNHt,"{'name': 'The New Paper', 'url': 'https://www.tnp.sg'}"
2021-04-12 21:48:04+00:00,Apple's next Apple TV will reportedly feature built-in speaker and camera,A new report claims Apple is working on an all-in-one Apple TV that will feature a built-in camera and FaceTime camera.,"Apple’s next Apple TV will reportedly feature built-in speaker and camera
Apple hasn’t introduced a new Apple TV since 2017, but a new report claims that’s set to change. However, the device won’t be a simple set-top box; Apple is aiming to introduce... [1914 chars]",https://www.xda-developers.com/apple-tv-built-in-homepod-speaker-facetime-camera/,https://www.xda-developers.com/files/2021/04/Apple-TV-1.jpg,"{'name': 'XDA Developers', 'url': 'https://www.xda-developers.com'}"
2021-04-11 22:43:32+00:00,Apple agrees to testify before U.S. Senate on app store antitrust concerns,"A senior Apple Inc executive has agreed to testify before the U.S. Senate on competition issues related to mobile app stores, days after panel leaders criticized the company for refusing to appear.","FILE PHOTO: A man talks on his iPhone at a mobile phone store in New Delhi, India, July 27, 2016. REUTERS/Adnan Abidi/File Photo
WASHINGTON (Reuters) - A senior Apple Inc executive has agreed to testify before the U.S. Senate on competition issues re... [932 chars]",https://www.reuters.com/article/us-tech-antitrust-apple/apple-agrees-to-testify-before-u-s-senate-on-app-store-antitrust-concerns-idUSKBN2BY0T8,https://static.reuters.com/resources/r/?m=02&d=20210411&t=2&i=1558065731&r=LYNXMPEH3A0HM&w=800,"{'name': 'Reuters', 'url': 'https://www.reuters.com'}"
