publishedAt,title,description,content,url,image,source
2020-11-19 23:32:54+00:00,For All Mankind’s action-packed season 2 blasts off in February,"Apple TV+ revealed an overview of the upcoming season of its alternate-history sci-if drama ""For All Mankind,"" and a launch date","Apple TV+ revealed an overview of the upcoming season of its alternate-history sci-if drama For All Mankind on Thursday. The show will relaunch in February with a focus on a struggle between the U.S. and the Soviet Union over the moon.
Countdown to F... [2232 chars]",https://www.cultofmac.com/728408/for-all-mankind-season-2-launch-date-release/,https://cdn.cultofmac.com/wp-content/uploads/2020/07/For-All-Mankind-season-2.jpg,"{'name': 'Cult of Mac', 'url': 'https://www.cultofmac.com'}"
2020-11-19 23:26:24+00:00,Season two of 'For All Mankind' to premiere on Apple TV+ on February 19,"Not many details are known about the upcoming season of Apple's space race drama, but an official trailer is already out.","Apple's space race drama For All Mankind has announced that the second season of the exciting series will premiere globally on Apple TV+ on February 19, 2021. The series made the announcement on Twitter earlier today.
Prepare for the next era. #ForAl... [1103 chars]",https://www.imore.com/season-two-all-mankind-will-premiere-february-19-2021,https://www.imore.com/sites/imore.com/files/styles/large/public/field/image/2019/11/for-all-mankind-episode-1.jpg,"{'name': 'iMore', 'url': 'https://www.imore.com'}"
2020-11-19 23:24:28+00:00,"Kmart, ALDI, Samsung, Apple named best brands for appliances and technology in Finder Retail Awards","From air fryers and slow cookers to the best mobile phone and TVs, the best retail and technology brands have been named.","Australia’s best retail products have been revealed, with popular Aldi and Kmart appliances topping the list in some categories.
The Finder Retail Awards were announced following a survey of more than 3000 Australians, which quizzed them about recent... [3312 chars]",https://7news.com.au/lifestyle/australias-top-home-appliances-and-tech-products-revealed-after-nationwide-finder-survey--c-1615787,https://images.s.7news.com.au/publication/C-1615787/e7fb6f410d8447950df771b60642016c8c4e3b5c-16x9-x0y0w1920h1080.jpg?imwidth=1024,"{'name': '7NEWS.com.au', 'url': 'https://7news.com.au'}"
2020-11-19 23:23:54+00:00,Watch Apple's M1 MacBook Pro Obliterate 2020 Intel MacBook Pro in Speed Tests,"Apple's first M1 Macs have defied expectations and are more powerful than anyone expected, handily beating out many other Intel Macs that Apple...","Apple's first M1 Macs have defied expectations and are more powerful than anyone expected, handily beating out many other Intel Macs that Apple is continuing to sell. We've seen endless speed tests, but we thought we'd pit the ‌M1‌ 13-inch MacBook Pr... [3885 chars]",https://www.macrumors.com/guide/m1-macbook-pro-vs-intel-macbook-pro/,https://images.macrumors.com/t/KSiZj3Zkpz4ra2q2CPHSoFNT6qM=/1600x/https://images.macrumors.com/article-new/2020/11/m1-v-intel-thumb-lit-crop-shocked.jpg,"{'name': 'MacRumors', 'url': 'https://www.macrumors.com'}"
2020-11-19 23:12:34+00:00,Best Holiday Gifts For Grandparents 2020,"Best Holiday Gifts For Grandparents 2020 - DealTown, US - From Samsonite luggage and Apple iPads to luxe candles and massage chairs, these are the holiday gifts Grandma and Grandpa are sure to love.",Chances are your grandparents are your favorite pair of people — and the holidays are the perfect opportunity to show them just how much they mean to you. That's why we've rounded up some thoughtful gifts that will spoil Grandma and Grandpa this holi... [1338 chars],https://patch.com/us/dealtown/best-holiday-gifts-grandparents-2020,https://patch.com/img/cdn20/users/23995873/20201217/052220/styles/patch_image/public/grandparents___17172210721.jpg,"{'name': 'Joliet, IL Patch', 'url': 'https://patch.com'}"
2020-11-19 23:11:06+00:00,Neo-air thriller 'Losing Alice' will premiere on Apple TV+ on January 22,"The series will follow the story of Alice, a 48-year-old film director who becomes obsessed with a 24-year-old screenwriter.","Apple has announced that its upcoming neo-air thriller Losing Alice will premiere on Apple TV+ on January 22. The company posted the announcement on Twitter today.
A new psychological thriller from writer / director Sigal Avin, #LosingAlice premieres... [1721 chars]",https://www.imore.com/neo-air-thriller-losing-alice-will-premiere-apple-tv-january-22,https://www.imore.com/sites/imore.com/files/styles/large/public/field/image/2020/06/losing-alice-apple-tv-.jpg,"{'name': 'iMore', 'url': 'https://www.imore.com'}"
2020-11-19 23:00:40+00:00,Apple has released a revised version of macOS 11.0.1 Big Sur,"It is unclear why Apple has released the revised version, but it is available to those who have not yet updated to the latest macOS.","Reported by MacRumors, Apple has released a revised version of macOS Big Sur for users that have not yet updated to the latest operating system. It is not clear what is different in macOS Big Sur version 11.0.1, but it is now currently available to u... [908 chars]",https://www.imore.com/apple-has-released-revised-version-macos-1101-big-sur,https://www.imore.com/sites/imore.com/files/styles/large/public/field/image/2020/06/macos-big-sur-8umc.jpg,"{'name': 'iMore', 'url': 'https://www.imore.com'}"
2020-11-18 23:41:00+00:00,"Black Friday 2020 Apple deals: $350 Apple Watch Series 6, $190 AirPods Pro, $850 Intel MacBook Air and more",Black Friday deals on Apple products are already underway. Here are the best ones we've found so far.,"Deal Savings Price
Show more (1 item)
Holiday Gift Guide 2020
While Black Friday officially falls on Nov. 27, plenty of stores are getting a head start and offering up savings long before you even think about popping the turkey in the oven. That mean... [3001 chars]",https://www.cnet.com/news/black-friday-2020-apple-deals-350-apple-watch-series-6-190-airpods-pro-850-intel-macbook-air-and-more/,https://cnet2.cbsistatic.com/img/_cE80nWrRO9G2JTFijp7y89I1AM=/1200x630/2019/10/29/ae208398-0a3c-4f38-a14b-f5683e8f9a41/27-apple-airpods-pro.jpg,"{'name': 'CNET', 'url': 'https://www.cnet.com'}"
2020-11-18 23:35:35+00:00,"Relax, Apple plans software fix for iPhone 12 green screen problem",Apple is reportedly working on a software fix for the iPhone 12 screens that take on a greenish tint. Hardware replacement won‘t be required.,"Apple is reportedly working on a software fix for the iPhone 12 screens that take on a greenish tint. Hardware replacement won‘t be required.
A similar glitch cropped up with the iPhone 11 earlier in 2020 and was taken care of with an iOS update.
iPh... [837 chars]",https://www.cultofmac.com/728322/apple-iphone-12-green-screen-problem-fix/,https://cdn.cultofmac.com/wp-content/uploads/2020/11/07A9ADC6-721F-472E-BC8E-440F6578A29D.jpeg,"{'name': 'Cult of Mac', 'url': 'https://www.cultofmac.com'}"
2020-11-18 23:35:32+00:00,Apple agrees to settle iPhone throttling lawsuit for $113M,"Apple agreed to pay $113 million to settle a lawsuit brought by 33 states and Washington, D.C., accusing the company of intentionally slowing down speeds on older iPhones in order to increase sales of newer models.","A woman explores an iPhone 6 at Apple's flagship store in Beijing on January 4, 2015. Apple was accused of throttling iPhone 6 devices after the battery began causing the devices to unexpectedly shut down. File Photo by Stephen Shaver/UPI | License P... [1668 chars]",https://www.upi.com/Top_News/US/2020/11/18/Apple-agrees-to-settle-iPhone-throttling-lawsuit-for-113M/1561605736279/,https://cdnph.upi.com/sv/ph/og/upi/1561605736279/2020/1/acd1302d36c8197353bb3b2907c96062/v1.5/Apple-agrees-to-settle-iPhone-throttling-lawsuit-for-113M.jpg,"{'name': 'UPI News', 'url': 'https://www.upi.com'}"
2020-11-18 23:31:33+00:00,Here’s how to run any iOS app you own on Apple’s new M1 Macs,"Although it’s not an officially approved method, you can run any iPhone or iPad app you’ve purchased or downloaded on an M1-based Mac. It’s buggy, but we’ve successfully run Instagram, Dark Sky, Spotify, Netflix, and Gmail on a MacBook Air.","Earlier today, MacRumors reported that it is possible to run any iOS app you have purchased on an M1-based Mac, provided you can get access to the right file. Sure enough, if you’ve purchased or downloaded an app for your iPhone or iPad, it is possib... [3750 chars]",https://www.theverge.com/2020/11/18/21574207/how-to-install-run-any-iphone-ipad-app-m1-mac,https://cdn.vox-cdn.com/thumbor/Kz12D6uqOORwgn6qstdl6P6iClE=/0x171:3360x1930/fit-in/1200x630/cdn.vox-cdn.com/uploads/chorus_asset/file/22051518/Screen_Shot_2020_11_18_at_2.50.53_PM.png,"{'name': 'The Verge', 'url': 'https://www.theverge.com'}"
2020-11-18 23:31:07+00:00,"'Peanuts' holiday specials will air on broadcast TV, after all",Apple will also offer the programs on its streaming service,"Happiness is a warm “Peanuts” special, widely available across the airwaves.
In a deal that will bring Charlie Brown, Lucy and Snoopy to more viewers during the holidays, Apple announced on Wednesday that the “Peanuts” programming it now controls wil... [1563 chars]",https://www.mercurynews.com/2020/11/18/peanuts-holiday-specials-will-air-on-broadcast-tv-after-all/,https://www.mercurynews.com/wp-content/uploads/2020/11/charlie.png?w=1024&h=667,"{'name': 'The Mercury News', 'url': 'https://www.mercurynews.com'}"
2020-11-18 23:27:39+00:00,Apple to air upcoming Peanuts holiday specials on PBS,"Following the backlash from only streaming ""It's the Great Pumpkin, Charlie Brown"" on Apple TV+, Apple will air upcoming Peanuts specials on PBS.","""Peanuts"" fans will have even more ways to watch Charlie Brown, Snoopy and the gang on their holiday adventures as Apple and PBS team up for special ad-free broadcasts of ""A Charlie Brown Thanksgiving"" and ""A Charlie Brown Christmas."" To complement t... [1594 chars]",https://www.imore.com/apple-air-upcoming-peanuts-holiday-specials-pbs,https://www.imore.com/sites/imore.com/files/styles/large/public/field/image/2020/11/charlie-brown-christmas.jpg,"{'name': 'iMore', 'url': 'https://www.imore.com'}"
2020-11-18 23:24:37+00:00,Apple cuts fee for small app makers; keeps it high for big boys,An Apple press release a day keeps the regulators away.,"The group has made some legal traction, with European regulators investigating Apple over anti-trust violations, the BBC reported. The U.S. Supreme Court ruled in March 2019 that Apple could be sued over its App Store structure, but has not handed do... [41 chars]",https://www.nydailynews.com/news/national/ny-apple-app-store-fee-commission-cut-spotify-epic-20201118-t36hx4wamrfv5oniqeuec22ww4-story.html,https://www.nydailynews.com/resizer/834g5p9Rug4u0UG9Yk-7hCt7HOw=/1200x0/top/cloudfront-us-east-1.images.arcpublishing.com/tronc/DRR7H3ZFOJHYAMKV55V32VPKB4.aspx,"{'name': 'New York Daily News', 'url': 'https://www.nydailynews.com'}"
2020-11-18 23:18:45+00:00,"Apple Is Aware of iPhone 12 Display Issues Such as Flickering, Greenish Tint but Isn’t Planning on Servicing Affected Models",Apple is reportedly aware of the various iPhone 12 display problems users are reporting about but isn’t intending on replacing the defected models,"Since the inception of the iPhone 12 lineup, users have been complaining about various display issues. This will include iPhone 12 and iPhone 12 Pro owners reporting about a yellow tint problem, while various iPhone 12 mini users have complained abou... [1776 chars]",https://wccftech.com/apple-aware-iphone-12-display-issues-no-servicing-plans/,https://cdn.wccftech.com/wp-content/uploads/2020/11/iPhone-12-mini-1.jpg,"{'name': 'Wccftech', 'url': 'https://wccftech.com'}"
2020-11-18 23:15:26+00:00,‘Dance Monkey’ is the ‘Most-Shazamed’ song of all time,"Tones and I’s “Dance Monkey,” which went viral on TikTok earlier this year, is atop the Apple-owned mobile app’s list of the songs users discovered playing around them or on their device via pioneering technology in music identification.","“Shazam has been a huge platform for me in terms of reaching people,” Tones and I (whose real name is Toni Elizabeth Watson) said in a statement. “I didn’t have a following when I released ‘Dance monkey,’ but it gave me the opportunity to reach more ... [198 chars]",https://www.nydailynews.com/snyde/ny-tone-and-i-dance-monkey-most-shazamed-song-shazam-20201118-quu5melaabchlclyvl2vpu4dfe-story.html,https://www.nydailynews.com/resizer/LytZsdfmGpxFK-HdzsJDHm-N1mg=/1200x0/top/cloudfront-us-east-1.images.arcpublishing.com/tronc/LFEAMUDCIVEMJKISA56Z6POXTQ.jpg,"{'name': 'New York Daily News', 'url': 'https://www.nydailynews.com'}"
2020-11-18 23:07:45+00:00,"Foldable Apple iPhone testing underway, possibly debut in 2022","Since 2019, World's leading mobile maker, Samsung has already introduced three Galaxy Fold series phones to the market. Except for a few reports of work underway on folding design patents, there was no concrete evidence to show Apple seriously working on a foldable iPhone.  Now, news from Taiwan is coming that Apple may have formally joined the race to bring its own foldable","Since 2019, World's leading mobile maker, Samsung has already introduced three Galaxy Fold series phones to the market. Except for a few reports of work underway on folding design patents, there was no concrete evidence to show Apple seriously workin... [2063 chars]",https://www.deccanherald.com/specials/foldable-apple-iphone-testing-underway-possibly-debut-in-2022-917282.html,https://www.deccanherald.com/sites/dh/files/articleimages/2020/11/18/aiphone12-cvs-sel-7-917282-1605721132.jpg,"{'name': 'Deccan Herald', 'url': 'https://www.deccanherald.com'}"
2020-11-17 23:39:03+00:00,Should you buy an Apple Pencil on Black Friday?,"Black Friday is approaching, and it would be the best time to buy a new Apple Pencil for your iPad.","Yes, you should pick up an Apple Pencil on Black Friday. It's one of the best times of the year to get one thanks to the Black Friday Apple Pencil deals that you're bound to find in the coming days. The first-generation Apple Pencil works with iPad P... [1661 chars]",https://www.imore.com/should-you-buy-apple-pencil-black-friday,https://www.imore.com/sites/imore.com/files/styles/large/public/field/image/2019/04/apple-pencil-1-and-2-hero2.jpeg,"{'name': 'iMore', 'url': 'https://www.imore.com'}"
2020-11-17 23:37:28+00:00,Upcoming Apple TV+ series 'Stillwater' drops its official trailer,"The series, which follows the friendship of a group of siblings and their panda neighbor, will premiere on Apple TV+ on December 4.","Apple TV+ has released its official trailer for Stillwater, a new animated preschool series based on Jon J Muth's Zen Shorts. The series will premiere globally on Friday, December 4 with the first six episodes being available at debut.
Stillwater fol... [1293 chars]",https://www.imore.com/upcoming-apple-tv-series-stillwater-drops-its-official-trailer,https://www.imore.com/sites/imore.com/files/styles/large/public/field/image/2020/09/091720_new_series_doug_unplugs_stillwater_big_image_02.jpg,"{'name': 'iMore', 'url': 'https://www.imore.com'}"
2020-11-17 23:10:00+00:00,Brits Upset Apple Cart,Police in central England are asking for help catching a pack of thieves who made off with an estimated $6.6 million in Apple gadgets last Tuesday night.,"Photo : Carsten Koall ( Getty Images )
Police in central England are asking for help catching thieves who made off with an estimated $6.6 million in Apple gadgets last Tuesday night.
Advertisement
Between 7:45 p. m. and 8 p. m. local time on Nov. 10,... [1832 chars]",https://gizmodo.com/brits-upset-apple-cart-1845701881,"https://i.kinja-img.com/gawker-media/image/upload/c_fill,f_auto,fl_progressive,g_center,h_675,pg_1,q_80,w_1200/p7l6qfzscaap8ejr9vqs.jpg","{'name': 'Gizmodo', 'url': 'https://gizmodo.com'}"
2020-11-17 22:59:27+00:00,NYC's COVID-19 Test and Trace program can't pinpoint 80% of cases,"The Big Apple's heavily touted coronavirus tracing program is having trouble tracking down sources of at least 80 percent of the COVID-19 infections in New York City, Mayor Bill de Blasio acknowledged Tuesday.","Sign up for our special edition newsletter to get a daily update on the coronavirus pandemic.
The Big Apple’s heavily touted coronavirus tracing program is having trouble tracking down sources of at least 80 percent of the COVID-19 infections in New ... [1998 chars]",https://nypost.com/2020/11/17/nycs-covid-19-test-and-trace-program-cant-pinpoint-80-of-cases/,https://nypost.com/wp-content/uploads/sites/2/2020/11/Bill-de-Blasio-6.jpg?quality=90&strip=all&w=1200,"{'name': 'New York Post', 'url': 'https://nypost.com'}"
2020-11-17 22:59:24+00:00,Google releases Apple Silicon version of Chrome for Mac,"Following today's launch of M1-powered Macs today, Google has quietly released a Mac version of Chrome optimized for Apple Silicon...","Following today’s launch of M1-powered Macs, Google has quietly released a Mac version of Chrome that is optimized for Apple Silicon.
To download, visit google.com/chrome and click the blue “Download” button. If you’re using an M1 computer, you shoul... [1697 chars]",https://9to5google.com/2020/11/17/chrome-mac-apple-silicon/,https://9to5google.com/wp-content/uploads/sites/4/2020/11/google-chrome-download-cover.png,"{'name': '9to5Google', 'url': 'https://9to5google.com'}"
2020-11-17 22:57:16+00:00,Epic Games is Now Suing Apple in Australia,"After months of legal back and forths in the US, Epic Games is now suing Apple in Australia over its 30% App Store charges.","Epic Games is Now Suing Apple in Australia
After already suing Apple in the US, Epic Games has now began legal proceedings against the tech giant in Australia as well.
Apple vs Epic Games: Australian Edition
Epic is claiming that Apple’s refusal to a... [4943 chars]",https://www.kotaku.com.au/2020/11/epic-games-is-now-suing-apple-in-australia/,https://imgix.kotaku.com.au/content/uploads/sites/3/2020/11/18/fortnite-3.jpg?ar=16%3A9&auto=format&fit=crop&q=80&w=1280&nrs=40,"{'name': 'Kotaku Australia', 'url': 'https://www.kotaku.com.au'}"
2020-11-17 22:55:15+00:00,Apple M1 Silicon Is Just as Fast as 2019 Mac Pro in Code Compiling - Thrashes Intel-Based MacBook Models Too,"In code compilation, the Apple M1 chip will blow you away in completion time, as it equals the 2019 Mac Pro in a variety of tests","We’re not sure how much more Apple’s M1 chip will stop impressing us, but if you wanted to see the custom silicon equal to the 2019 iMac Pro in code compilation, here are some interesting results. What’s astonishing about these results is that the M1... [1872 chars]",https://wccftech.com/apple-m1-code-compile-results-as-fast-2019-mac-pro/,https://cdn.wccftech.com/wp-content/uploads/2020/11/Apple-M1-chip-for-ARM-Macs-1.jpeg,"{'name': 'Wccftech', 'url': 'https://wccftech.com'}"
2020-11-17 22:49:31+00:00,"Nomad launches the Sport Strap, a sleek rubber band for Apple Watch","The new strap, which is made out of FKM fluoroelastomer rubber, is 100% waterproof and designed to look good while working out and working.","Nomad, the maker of a number of premium accessories for the iPhone, Apple Watch, and more, has released a new Sport Strap developed for the Apple Watch.
Designed to give your Apple Watch a modern and sleek athletic look for intense workouts and every... [892 chars]",https://www.imore.com/nomad-launches-sport-strap-sleek-rubber-band-apple-watch,https://www.imore.com/sites/imore.com/files/styles/large/public/field/image/2020/11/nomad-sport-strap-black-water.jpg,"{'name': 'iMore', 'url': 'https://www.imore.com'}"
2020-11-17 22:35:58+00:00,1Password updated for Big Sur with Apple Watch unlock support,"1Password has gotten updated for macOS Big Sur, with better Safari support, Apple Watch unlocking, and a new icon to match the new design of the operating system.","1Password, one of the most popular password management services, has been updated for macOS Big Sur today, adding several new features that take advantage of the new capabilities of the operating system.
Chief among those is the option to use your Ap... [1097 chars]",https://www.theverge.com/2020/11/17/21572169/1password-big-sur-update-apple-watch-unlock-icon-support,https://cdn.vox-cdn.com/thumbor/yowSLJIgyj2ytCxehc6rIgRXWB0=/0x102:2000x1149/fit-in/1200x630/cdn.vox-cdn.com/uploads/chorus_asset/file/22049091/item_details_view.png,"{'name': 'The Verge', 'url': 'https://www.theverge.com'}"
2020-11-17 22:32:04+00:00,Apple Releases Second Betas of iOS 14.3 and iPadOS 14.3 to Developers and Public Beta Testers,"Apple today seeded the second betas of upcoming iOS 14.3 and iPadOS 14.3 updates to developers and public beta testers for testing purposes, one week...","Apple today seeded the second betas of upcoming iOS 14.3 and iPadOS 14.3 updates to developers and public beta testers for testing purposes, one week after releasing the first betas and two weeks after the launch of iOS and iPadOS 14.2.
iOS and iPadO... [2201 chars]",https://www.macrumors.com/2020/11/17/apple-seeds-ios-14-3-beta-2-to-developers/,https://images.macrumors.com/t/u3Ovu5QUfDap4UOx3GMGQE-RXt0=/1920x/https://images.macrumors.com/article-new/2020/11/iOS-14.3-dev-beta-2-feature.jpg,"{'name': 'MacRumors', 'url': 'https://www.macrumors.com'}"
2020-11-16 23:55:02+00:00,Apple reportedly testing foldable iPhone prototype for September 2022 release,Apple may be testing multiple foldable prototypes with either OLED or Micro-LED screens at its Taiwanese factory,"Apple's plans for a foldable iPhone, or iPhone Flip, are an open secret thanks to an influx of rumors and patent filings in recent weeks. Yet the latest leak suggests that Apple has progressed beyond the planning stage and is actively working on its ... [2403 chars]",https://www.techradar.com/news/apple-reportedly-testing-foldable-iphone-prototype-for-september-2022-release,https://cdn.mos.cms.futurecdn.net/qdctMbN785JCMyeKLuu8wT-1200-80.jpg,"{'name': 'TechRadar', 'url': 'https://www.techradar.com'}"
2020-11-16 23:45:32+00:00,Foldable iPhone reportedly in testing as release timeframe leaks,A fresh iPhone rumor claims that Apple may release a foldable iPhone 14 model in 2022. Apple reportedly ordered several samples from a manufacturing partner so it can test the durability of its hinge design.,"A fresh iPhone rumor claims that Apple may release a foldable iPhone 14 model in 2022.
Apple reportedly ordered several samples from a manufacturing partner so it can test the durability of its hinge design.
One prototype Apple is reportedly working ... [3294 chars]",https://bgr.com/2020/11/16/foldable-iphone-release-date-2022-design-prototype/,https://bgr.com/wp-content/uploads/2019/03/foldable-iphone-x.jpg?quality=70&strip=all,"{'name': 'BGR', 'url': 'https://bgr.com'}"
2020-11-16 23:42:00+00:00,European privacy advocates file complaint against Apple's ad-tracking system,"Apple is under fire by privacy advocates in the EU who previously targeted Facebook for not abiding the European Union's General Data Privacy Regulation, all while lamenting...","In brief: In the EU, privacy advocates are accusing Apple of violating European privacy law through the implicit use of a tracking code on users' iPhones without their consent. The company naturally disagrees and promises to offer regulators all the ... [2535 chars]",https://www.techspot.com/news/87622-european-privacy-advocates-file-complaint-against-apple-ad.html,https://static.techspot.com/images2/news/bigimage/2020/11/2020-11-16-image-36.jpg,"{'name': 'TechSpot', 'url': 'https://www.techspot.com'}"
2020-11-16 23:26:22+00:00,Phone Comparisons: Google Pixel 4a vs Apple iPhone 12 Mini,"In this article, we’ll compare the Google Pixel 4a vs Apple iPhone 12 Mini. These two smartphones are amongst the most compelling compact smartphones in","In this article, we’ll compare the Google Pixel 4a vs Apple iPhone 12 Mini. These two smartphones are amongst the most compelling compact smartphones in the market at the moment. Truth be said, the two phones are quite different in comparison, which ... [9304 chars]",https://www.androidheadlines.com/phone-comparisons-google-pixel-4a-vs-iphone-12-mini.html.html,https://www.androidheadlines.com/wp-content/uploads/2020/11/AH-Google-Pixel-4a-vs-Apple-iPhone-12-Mini-comparison.jpg,"{'name': 'Android Headlines', 'url': 'https://www.androidheadlines.com'}"
2020-11-16 23:25:43+00:00,Customers are starting to receive their M1 Apple silicon Macs,"Despite its official release date of November 17, some customers are starting to receive their new M1-powered Macs.","Reported by MacRumors, some customers are beginning to receive their M1-powered Macs a day early. While the official release date of the new MacBook Air, 13-inch MacBook Pro, and Mac mini is November 17, some customers are finding the new computer be... [874 chars]",https://www.imore.com/customers-are-starting-receive-their-m1-apple-silicon-macs,https://www.imore.com/sites/imore.com/files/styles/large/public/field/image/2020/11/apple_new-m1-chip-graphic_11102020.jpg,"{'name': 'iMore', 'url': 'https://www.imore.com'}"
