publishedAt,title,description,content,url,image,source
2021-01-29 23:24:00+00:00,"As GameStop and the Little Guys Soar, Big Tech Gets Forgotten","Earnings from Apple and Microsoft confirmed the companies’ dominance. Still, market reaction suggests some concern about the stocks.","Text size
It’s not often that Big Tech gets to slip under the radar, but nothing was normal this past week. As the investing world obsessed over small stocks, the country’s two largest companies reported their earnings. The results were tremendous, a... [5131 chars]",https://www.barrons.com/articles/as-gamestop-and-the-little-guys-soar-big-tech-gets-forgotten-51611962651,https://images.barrons.com/im-292625/social,"{'name': ""Barron's"", 'url': 'https://www.barrons.com'}"
2021-01-29 23:20:00+00:00,Hyundai Execs Reportedly Questioning the Value of Partnership to Produce the Apple Car,"The fact that Apple is developing its own electric car just be one of the worst-kept secrets in tech. But after Hyundai recently spilled the beans on a potential partnership to produce the car with Apple, a new report suggests Hyundai execs are hesitant to move forward with a deal.","Photo : Justin Sullivan/Getty Images ( Getty Images )
The fact that Apple is developin g its own electric car just be one of the worst- kept secrets in tech. But after Hyundai recently spilled the beans on a potential partnership to produce the car w... [2743 chars]",https://gizmodo.com/hyundai-execs-are-reportedly-worried-about-working-with-1846162687,"https://i.kinja-img.com/gawker-media/image/upload/c_fill,f_auto,fl_progressive,g_center,h_675,pg_1,q_80,w_1200/wjjt7jrdbzzou4uxhvax.jpg","{'name': 'Gizmodo', 'url': 'https://gizmodo.com'}"
2021-01-29 23:09:08+00:00,iPhone 13 might feature the Touch ID upgrade fans have demanded,"Apple is working on in-display fingerprint technology to bring Touch ID to the iPhone 13. Sources tell The Wall Street Journal that Apple is working with optical sensors to bring an in-display scanner to the next iPhone, and that it will have to meet the security standards of Touch ID.","Apple is working on in-display fingerprint technology to bring Touch ID to the iPhone 13.
Sources tell The Wall Street Journal that Apple is working with optical sensors to bring an in-display scanner to the next iPhone, and that it will have to meet... [2746 chars]",https://bgr.com/2021/01/29/iphone-13-in-display-fingerprint-sensor-touch-id/,https://bgr.com/wp-content/uploads/2021/01/Apple-iPhone-Touch-ID.png,"{'name': 'BGR', 'url': 'https://bgr.com'}"
2021-01-29 23:06:28+00:00,"NYC could get 10 inches of snow over 3 days, forecasters say","The Big Apple could be walloped by up to 10 inches of snow following a weekend of more as bitterly cold temperatures, forecasters said Friday.","The Big Apple could be walloped by up to 10 inches of snow following a weekend of bitterly cold temperatures, forecasters said Friday.
A storm blowing in from the west will strike Sunday night and potentially leave a large pile of powder on the city ... [1237 chars]",https://nypost.com/2021/01/29/nyc-could-get-10-inches-of-snow-over-3-days-forecasters-say/,https://nypost.com/wp-content/uploads/sites/2/2021/01/NYC-snow.jpg?quality=90&strip=all&w=1200,"{'name': 'New York Post', 'url': 'https://nypost.com'}"
2021-01-29 23:00:00+00:00,And GameStop's Stock Is Still Going,"A week after its logic-defying surge began, GameStop stock is still holding strong, despite more shenanigans and goofy twists, closing at $325 today. That’s higher than Facebook, Apple, and Microsoft. The bubble seems destined to burst any day now, but boosters on the WallStreetBets subreddit are continuing to hype the meme stock anyway.","Photo : Michael M. Santiago ( Getty Images )
A week after its logic-defying surge began, GameStop stock is still holding strong, despite more shenanigans and goofy twists, closing at $325 today. That’s higher than Facebook, Apple, and Microsoft. The ... [950 chars]",https://kotaku.com/and-gamestops-stock-is-still-going-1846163001,"https://i.kinja-img.com/gawker-media/image/upload/c_fill,f_auto,fl_progressive,g_center,h_675,pg_1,q_80,w_1200/a49fmtd3wp8txxwxhdxb.jpg","{'name': 'Kotaku', 'url': 'https://kotaku.com'}"
2021-01-29 22:43:00+00:00,Apple doesn't seem too impressed with Galaxy S21's new and improved in-display fingerprint reader,"Per a new report, the iPhone 12S (13) will feature an optical in-display fingerprint scanner.","Per the outlet, Apple is considering optical in-display fingerprint readers, which were earlier thought to be inferior to the ultrasonic variety that Samsung uses. In practice, they have proven to be Per the outlet, Apple is considering optical in-di... [2000 chars]",https://www.phonearena.com/news/iphone-12s-13-optical-touch-id_id129821,https://m-cdn.phonearena.com/images/article/129821-two_1200/Apple-doesnt-seem-too-impressed-with-Galaxy-S21s-new-and-improved-in-display-fingerprint-reader.jpg,"{'name': 'PhoneArena', 'url': 'https://www.phonearena.com'}"
2021-01-29 22:41:02+00:00,Jared Leto and Anne Hathaway will help Apple re-create the WeWork disaster for TV,"Anne Hathaway and Jared Leto will play Rebekah and Adam Neumann in Apple’s adaptation of the WeWork drama, The Hollywood Reporter writes. The show, called WeCrashed, has no set release date, but it will chart the rise and fall of the company that looked a lot more like a soap opera.","Apple’s television adaptation of the podcast adaptation of the real-life soap opera that was WeWork now has some major talent attached. Jared Leto, the soon-to-be leading vampire of Morbius, and Anne Hathaway, are joining the Apple TV Plus series WeC... [1463 chars]",https://www.theverge.com/2021/1/29/22256691/jared-leto-anne-hathaway-wework-wecrashed-apple-tv-plus,https://cdn.vox-cdn.com/thumbor/yEsXRwcGaizLmriGpdZMzyB2TEA=/0x130:1920x1135/fit-in/1200x630/cdn.vox-cdn.com/uploads/chorus_asset/file/22268964/Studio_Project.jpeg,"{'name': 'The Verge', 'url': 'https://www.theverge.com'}"
2021-01-29 22:08:00+00:00,Developers Are Already Caught Lying To Users With Apple's App Privacy Labels,Apple needs to have one stance and one policy so loopholes and lying developers cannot sneak through the rules.,"When Apple introduced privacy labels, it seemed to be a solid way to provide transparency for users to know what data is collected on their devices. This system relies on honesty from the app developers, but some developers crossed their fingers behi... [1966 chars]",https://hothardware.com/news/apps-sneaking-through-apple-privacy-policy-rules,https://images.hothardware.com/contentimages/newsitem/54131/content/hero-apple-developers-lying-on-privacy-policy.jpg,"{'name': 'Hot Hardware', 'url': 'https://hothardware.com'}"
2021-01-29 21:45:28+00:00,"Wall St slides, S&P 500 turns negative for the year","Tesla, Apple and other mega techs fell, while GameStop and AMC Entertainment rallied capping a volatile few trading sessions.","In a series of tweets, Jim Bianco said the only fundamental that matters is that there are 62 million GameStop shares shorted and the public float is 50 million, adding it is physically impossible to cover this short.
“This squeeze does not stop unti... [2795 chars]",https://www.afr.com/markets/equity-markets/wall-st-slides-s-and-p-500-turns-negative-for-the-year-20210130-p56y0p,https://static.ffx.io/images/$zoom_0.5298%2C$multiply_0.7554%2C$ratio_1.777778%2C$width_1059%2C$x_0%2C$y_95/t_crop_custom/e_sharpen:25%2Cq_85%2Cf_jpg/t_afr_no_label_no_age_social_wm/dca427f3972ad9900aa31477f50da1d7e4234572,"{'name': 'The Australian Financial Review', 'url': 'https://www.afr.com'}"
2021-01-29 21:20:16+00:00,52 dogs rescued from China meat trade arrive in NYC,Dozens of pups saved from potentially ending up in the Chinese dog meat trade have arrived in the Big Apple en route to their forever families.,"Dozens of pups saved from potentially ending up in the Chinese dog meat trade have arrived in the Big Apple en route to their forever families.
Fifty-two rescue dogs landed from Beijing on a plane Friday morning at JFK Airport, where some of their ne... [367 chars]",https://nypost.com/2021/01/29/52-dogs-rescued-from-china-meat-trade-arrive-in-nyc/,https://nypost.com/wp-content/uploads/sites/2/2021/01/jamie-and-vincent-gesuele-with-meadow.jpg?quality=90&strip=all&w=1200,"{'name': 'New York Post', 'url': 'https://nypost.com'}"
2021-01-28 23:59:00+00:00,5G Apple iPhone 13 Pro might be able to satisfy those who save large amounts of data,"The ""Pro"" variants of the Apple iPhone 13 could be the first iPhone models to be offered with 1TB of internal storage. These same models could sport a panel with a 120Hz refresh rate.","The tipster said today on his YouTube channel that Apple is currently testing prototypes for this year's iPhone 13 models and while some of these units feature as much as 1TB of storage, it is still far too early for Apple to make such decisions fina... [1720 chars]",https://www.phonearena.com/news/5g-iPhone-13-pro-models-could-be-offered-with-1tb-of-storage_id129809,https://m-cdn.phonearena.com/images/article/129809-two_1200/5G-Apple-iPhone-13-Pro-might-be-able-to-satisfy-those-who-save-large-amounts-of-data.jpg,"{'name': 'PhoneArena', 'url': 'https://www.phonearena.com'}"
2021-01-28 23:56:27+00:00,"Apple Takes a Shot at Facebook, Details How Companies Can Track You Through Apps and Website","Apple has shared a new privacy document ""A Day in the Life of Your Data"" detailing how third-party companies can collect your data.","Apple has shared a new ""A Day in the Life of Your Data"" privacy document in which the company has detailed how third-party companies can potentially track your data through apps and websites. The iPhone-maker has highlighted and shared details that w... [2552 chars]",https://wccftech.com/apple-takes-a-shot-at-facebook-details-how-companies-can-track-you-through-apps-and-website/,https://cdn.wccftech.com/wp-content/uploads/2021/01/Apple-Privacy-Apps-Facebook.jpg,"{'name': 'Wccftech', 'url': 'https://wccftech.com'}"
2021-01-28 23:35:17+00:00,Every crazy thing that happened in Apple and Facebook’s privacy feud today,Apple CEO Tim Cook claims Facebook’s model leads to polarization and violence.,"Today, Apple announced plans to finally roll out its previously delayed change in policy on apps' use of IDFA (ID for Advertisers) to track users for targeted advertising. The feature will be in the next beta release of iOS 14 (the company just rolle... [10916 chars]",https://arstechnica.com/gadgets/2021/01/why-facebook-and-apple-are-going-to-war-over-privacy/,https://cdn.arstechnica.net/wp-content/uploads/2021/01/Screen-Shot-2021-01-28-at-4.51.02-PM-760x380.png,"{'name': 'Ars Technica', 'url': 'https://arstechnica.com'}"
2021-01-28 23:34:00+00:00,Facebook Stock Falls as Zuckerberg Calls Out Apple,Facebook CEO Mark Zuckerberg says Apple's upcoming changes to its ad tracking technology is in its own self interest.,"Text size
Trouble is brewing between Apple and Facebook.
In Wednesday’s conference call after Facebook (ticker: FB) reported earnings, CEO Mark Zuckerberg took Apple (AAPL) to task, saying Apple’s upcoming changes to its ad tracking technology is in ... [3153 chars]",https://www.barrons.com/articles/facebook-stock-falls-as-zuckerberg-calls-out-apple-51611876866,https://images.barrons.com/im-292100/social,"{'name': ""Barron's"", 'url': 'https://www.barrons.com'}"
2021-01-28 23:30:25+00:00,"The Top 11 True Crime Podcasts, According to Apple iTunes",A look at the highest-ranked podcasts on Apple for fans of grisly crime stories.,"True crime stories have fascinated people for as long as there have been stories. (After all, The Epic of Gilgamesh, Beowulf and even the earliest religious texts are all full of an assortment of violent crimes that may or may not have happened.) The... [7129 chars]",https://www.newsweek.com/best-true-crime-podcasts-1565242,https://d.newsweek.com/en/full/1719790/apology-line.jpg,"{'name': 'Newsweek', 'url': 'https://www.newsweek.com'}"
2021-01-28 22:54:26+00:00,Apple TV+ partners with Calm on new meditation sessions for kids,"The ""Children’s Guided Meditations"" feature three seven-minute meditations designed to ""help kids manage emotions, find stillness, and inspire kindness.""","What you need to know Apple TV+ and Calm partnered together on new meditations.
The meditations feature characters from the Stillwater series.
Apple has partnered with Calm to offer a new collection of meditations based on the Apple TV+ children seri... [1475 chars]",https://www.imore.com/apple-tv-partners-calm-new-meditation-sessions-kids,https://www.imore.com/sites/imore.com/files/styles/large/public/field/image/2021/01/stillwater-calm.jpg,"{'name': 'iMore', 'url': 'https://www.imore.com'}"
2021-01-28 22:33:07+00:00,"Apple's Tim Cook criticises social media practices, intensifying Facebook conflict",Cook criticised social media practices that he said undermine public trust in vaccines and encourage users to join extremist groups.. Read more at straitstimes.com.,"NEW YORK (REUTERS) - Apple Inc Chief Executive Officer Tim Cook on Thursday (Jan 28) criticised polarisation and misinformation on social media, intensifying a conflict between the iPhone maker and Facebook Inc.
In remarks delivered at the Computers,... [1710 chars]",https://www.straitstimes.com/world/united-states/apples-tim-cook-criticises-social-media-practices-intensifying-facebook-conflict,https://static.straitstimes.com.sg/s3fs-public/styles/x_large/public/articles/2021/01/29/nz_timcook_290126.jpg?itok=pCnlIoxl,"{'name': 'The Straits Times', 'url': 'https://www.straitstimes.com'}"
2021-01-28 22:31:00+00:00,Tim Cook calls Facebook's business model violent and says that it leads to divisiveness,"Tim Cook, Apple's CEO, spoke about privacy today at the European Computers, Privacy & Data Protection (CPDP) conference. Speaking about Facebook without mentioning it by name, Cook called its business model ""violent.""","Earlier this morning, we told you that Facebook was reportedly planning to attack Apple-in court . The social media network is believed to be ready to accuse Apple of violating antitrust laws by using the iPhone's popularity to force a major change o... [2328 chars]",https://www.phonearena.com/news/facebooks-business-model-is-violent-says-tim-cook_id129808,https://m-cdn.phonearena.com/images/article/129808-two_1200/Tim-Cook-calls-Facebooks-business-model-violent-and-says-that-it-leads-to-divisiveness.jpg,"{'name': 'PhoneArena', 'url': 'https://www.phonearena.com'}"
2021-01-28 22:17:00+00:00,"Apple leads way to smartphone growth in 4Q, Huawei and China market take big hit","Global smartphone shipments have returned to positive growth in the final quarter of 2020, led by Apple, with its iPhone 12 helping the company to shi...","Global smartphone shipments have returned to positive growth in the final quarter of 2020, led by Apple, with its iPhone 12 helping the company to ship a record 395.9 million units and take top spot for the three-month period, according to technology... [4290 chars]","https://www.itwire.com/mobility/apple-leads-way-to-smartphone-growth-in-4q,-huawei-and-china-market-take-big-hit.html",https://www.itwire.com/media/k2/items/cache/d234a0469db4fcd6413dc2236d089edb_XS.jpg,"{'name': 'iTWire', 'url': 'https://www.itwire.com'}"
2021-01-28 22:15:31+00:00,Here’s why you should download iOS 14.5 as soon as it’s available,"Apple released a report about data privacy called ""A Day in the Life of Your Data"" on Thursday in commemoration of Data Privacy Day, which takes place on January 28th.","Apple released a report about data privacy called “A Day in the Life of Your Data” on Thursday in commemoration of Data Privacy Day, which takes place on January 28th.
The report reveals that the next beta update will include App Tracking Transparenc... [2702 chars]",https://bgr.com/2021/01/28/ios-14-5-privacy-feature-app-tracking-transparency/,https://bgr.com/wp-content/uploads/2021/01/Apple-Privacy.jpg?quality=70&strip=all,"{'name': 'BGR', 'url': 'https://bgr.com'}"
2021-01-27 23:47:46+00:00,"Apple sees revenue growth accelerating after setting record for iPhone sales, China strength","Apple Inc on Wednesday reported holiday quarter sales and profits that beat Wall Street expectations, as new 5G iPhones helped push handset revenue to a new record and sparked a 57% rise in China sales.","Apple Inc on Wednesday reported holiday quarter sales and profits that beat Wall Street expectations, as new 5G iPhones helped push handset revenue to a new record and sparked a 57% rise in China sales. Apple shipped its iPhone 12 lineup several week... [3734 chars]",https://www.devdiscourse.com/article/business/1424645-apple-sees-revenue-growth-accelerating-after-setting-record-for-iphone-sales-china-strength,https://www.devdiscourse.com/remote.axd?https://devdiscourse.blob.core.windows.net/imagegallery/29_02_2020_19_19_03_7965895.jpg?width=920&format=jpeg,"{'name': 'Devdiscourse', 'url': 'https://www.devdiscourse.com'}"
2021-01-27 23:39:26+00:00,Facebook CEO Mark Zuckerberg Says Apple's Privacy Changes are Self-Serving and Anti-Competitive,"Facebook today shared its earnings for the fourth quarter of 2020, and Facebook CEO Mark Zuckerberg's opening remarks were focused on Apple's...","Facebook today shared its earnings for the fourth quarter of 2020, and Facebook CEO Mark Zuckerberg's opening remarks were focused on Apple's upcoming anti-tracking privacy changes that will impact the advertising industry and companies like Facebook... [2324 chars]",https://www.macrumors.com/2021/01/27/apple-privacy-changes-anti-competitive-facebook/,https://images.macrumors.com/t/1Xks65IFS3AlpZ9Soage-a6YQdQ=/2500x/article-new/2020/12/Apple-vs-Facebook-feature.jpg,"{'name': 'MacRumors', 'url': 'https://www.macrumors.com'}"
2021-01-27 23:39:02+00:00,"Wall Street plunge, Apple Asia suppliers, currencies and oil","Overnight on Wall Street, the S&P 500 wiped out its 2021 gains and dropped into negative territory for the year.","SINGAPORE — Shares in Japan were set to dip at the Thursday open following an overnight plunge on Wall Street that wiped out the S&P 500's 2021 gains and left it in negative territory for the year.
Futures pointed to a lower open for Japanese stocks.... [1105 chars]",https://www.cnbc.com/2021/01/28/asia-markets-wall-street-plunge-apple-asia-suppliers-currencies-and-oil.html,https://image.cnbcfm.com/api/v1/image/106814724-1608594276238-gettyimages-1229866197-JAPAN_JPX.jpeg?v=1611185686,"{'name': 'CNBC', 'url': 'https://www.cnbc.com'}"
2021-01-27 23:34:00+00:00,Facebook sees earnings grow but warns Apple iOS changes could hurt business,The social network says upcoming privacy changes to iOS could weigh on its ad business.,"Image by Pixabay/Illustration by CNET
Facebook saw revenue jump 33% in the fourth quarter as businesses relied on social networks to attract customers stuck at home because of the coronavirus pandemic. The company warned, however, that privacy change... [5335 chars]",https://www.cnet.com/news/facebook-sees-earnings-grow-but-warns-apple-ios-changes-could-hurt-business/,https://cnet3.cbsistatic.com/img/wojYRrrF2IqoY7RPyM53HLIght8=/1200x630/2020/03/26/98ef685b-402f-40c2-92fe-e51328e89b6b/coronavirus-facebook-9725.jpg,"{'name': 'CNET', 'url': 'https://www.cnet.com'}"
2021-01-27 23:33:00+00:00,Apple Had a Better Holiday Than Literally Anyone Else,"We’re well into the second decade of iPhone sales, and with the covid-19 pandemic devastating economies worldwide, some wondered: Would 2020 be","Apple Had a Better Holiday Than Literally Anyone Else
We’re well into the second decade of iPhone sales, and with the covid-19 pandemic devastating economies worldwide, some wondered: Would 2020 be the year that Apple’s runaway revenue train finally ... [3196 chars]",https://www.gizmodo.com.au/2021/01/apple-had-a-better-holiday-than-literally-anyone-else/,https://imgix.gizmodo.com.au/content/uploads/sites/2/2021/01/28/wv2bxvbehwopuila9psz-scaled.jpg?ar=16%3A9&auto=format&fit=crop&q=65&w=1280,"{'name': 'Gizmodo Australia', 'url': 'https://www.gizmodo.com.au'}"
2021-01-27 23:33:00+00:00,Apple’s Blockbuster Results Play to a Tough Crowd,Record-breaking quarter comes as stock has already reached a record high valuation.,"$100 billion should feel better than this.
Apple Inc. AAPL -0.77% crossed that milestone by generating $111.4 billion in revenue during its fiscal first quarter ended Dec. 26. That is not only a record for the tech giant, it was nearly 8% above Wall ... [1930 chars]",https://www.wsj.com/articles/apples-blockbuster-results-play-to-a-tough-crowd-11611790402,https://images.wsj.net/im-291192/social,"{'name': 'The Wall Street Journal', 'url': 'https://www.wsj.com'}"
2021-01-27 23:33:00+00:00,Apple's Q1 2021 Revenue Was Absolutely Bananas,The first 5G iPhones sold like hotcakes over the holidays—and so did every other Apple product.,"Apple’s iPhone 12 lineup. Photo : Caitlin McGarry/Gizmodo
We’re well into the second decade of iPhone sales, and with the covid-19 pandemic devastating economies worldwide, some wondered: Would 2020 be the year that Apple’s runaway revenue train fina... [3209 chars]",https://gizmodo.com/apple-had-a-better-holiday-than-literally-anyone-else-1846146076,"https://i.kinja-img.com/gawker-media/image/upload/c_fill,f_auto,fl_progressive,g_center,h_675,pg_1,q_80,w_1200/wv2bxvbehwopuila9psz.jpg","{'name': 'Gizmodo', 'url': 'https://gizmodo.com'}"
2021-01-27 23:31:56+00:00,Volunteers try to fix NYC's broken COVID-19 appointment system,"The Big Apple’s online appointment system for the COVID-19 vaccine is so bad, a team of volunteers has created their own website to help guide New Yorkers to the coveted slots.","The Big Apple’s online appointment system for the COVID-19 vaccine is so bad, a team of volunteers have created their own website to help guide New Yorkers to the coveted slots.
The NYC Vaccine List, which launched on Jan. 13, pulls together in one p... [3694 chars]",https://nypost.com/2021/01/27/volunteers-try-to-fix-nycs-broken-covid-19-appointment-system/,https://nypost.com/wp-content/uploads/sites/2/2021/01/ny-covid-vaccine.jpg?quality=90&strip=all&w=1200,"{'name': 'New York Post', 'url': 'https://nypost.com'}"
2021-01-27 23:21:00+00:00,Apple's iPhone 12 led to largest revenue and profit in company history,"The tech giant says its fiscal first-quarter iPhone sales grew by more than 17% from the previous year, marking a strong start for the iPhone 12.","Angela Lang/CNET
Apple's iPhone sales surged to their highest point ever, as eager fans snatched up the company's new iPhone 12 during the holiday shopping season, despite the continued spread of the coronavirus.
The three months of Apple's fiscal fi... [5602 chars]",https://www.cnet.com/news/apples-iphone-12-led-to-largest-revenue-and-profit-in-company-history/,https://cnet4.cbsistatic.com/img/NFOwOjIAfvFfiQQkVQ8j2j_9BoU=/1200x630/right/top/2020/10/28/b92bd88a-81c0-4f43-baaf-6d23649a8388/apple-iphone-12-9980.jpg,"{'name': 'CNET', 'url': 'https://www.cnet.com'}"
2021-01-27 23:15:00+00:00,Apple said the Pro models of the iPhone 12 sold the best last quarter as a record number of people upgraded their devices,"Apple said the iPhone 12 Pro and iPhone 12 Pro Max sold the best during its most recent quarter. Apple reported $65.6 billion in iPhone revenue in Q1, surpassing","Apple said the iPhone 12 Pro and iPhone 12 Pro Max sold the best during its most recent quarter.
said the and sold the best during its most recent quarter. Apple reported $65.6 billion in iPhone revenue in Q1, surpassing analyst estimates of $60.3 bi... [1767 chars]",https://www.businessinsider.in/tech/news/apple-said-the-pro-models-of-the-iphone-12-sold-the-best-last-quarter-as-a-record-number-of-people-upgraded-their-devices/articleshow/80490454.cms,https://www.businessinsider.in/photo/80490454/apple-said-the-pro-models-of-the-iphone-12-sold-the-best-last-quarter-as-a-record-number-of-people-upgraded-their-devices.jpg?imgsize=270045,"{'name': 'Business Insider India', 'url': 'https://www.businessinsider.in'}"
2021-01-26 23:37:00+00:00,"Apple releases iOS 14.4, iPadOS 14.4, watchOS 7.3 and tvOS 14.4","Apple has released system software updates for iPhone, iPad, Apple TV and Apple Watch. iOS 14.4 delivers multiple changes relating to the camera. The...","iOS 14.4 delivers multiple changes relating to the camera.
The Camera app is now able to recognise smaller QR codes, there's a fix for the image artefacts that could appear in HDR shots taken with an iPhone 12 Pro, and a warning is displayed ""when th... [1897 chars]","https://www.itwire.com/mobility/apple-releases-ios-14-4,-ipados-14-4,-watchos-7-3-and-tvos-14-4.html",https://www.itwire.com/media/k2/items/cache/bf2cbf99df8bfea074e13ab5942d9c91_XS.jpg,"{'name': 'iTWire', 'url': 'https://www.itwire.com'}"
2021-01-26 23:27:25+00:00,"LG Display reports stronger profit on iPhone demand, rising panel prices","South Korea's LG Display Co Ltd reported its highest quarterly profit in over three years on Wednesday, returning to the black for a second quarter in a row with help from increased shipments of Apple Inc's new iPhones.","FILE PHOTO: An LG Electronics' logo is pictured on a TV displayed at a shop in Seoul, South Korea, April 26, 2016. REUTERS/Kim Hong-Ji/File Photo
SEOUL (Reuters) - South Korea’s LG Display Co Ltd reported its highest quarterly profit in over three ye... [1459 chars]",https://www.reuters.com/article/us-lg-display-results/lg-display-reports-stronger-profit-on-iphone-demand-rising-panel-prices-idUSKBN29V2PC,https://static.reuters.com/resources/r/?m=02&d=20210126&t=2&i=1549167433&r=LYNXMPEH0P1L7&w=800,"{'name': 'Reuters', 'url': 'https://www.reuters.com'}"
