publishedAt,title,description,content,url,image,source
2021-02-25 23:32:15+00:00,Final Fantasy VII Remake’s amazing soundtrack hits Spotify and Apple Music tomorrow,"Final Fantasy VII Remake’s soundtrack will be available to stream on Spotify, Apple Music, Amazon Music Unlimited, and other music subscription services on February 26th.","Final Fantasy VII Remake’s soundtrack will be available to stream on Spotify, Apple Music, Amazon Music Unlimited, and other music subscription services tomorrow, February 26th, Square Enix announced on Thursday. It will have an eye-popping (ear-popp... [1331 chars]",https://www.theverge.com/2021/2/25/22301968/final-fantasy-vii-remake-soundtrack-spotify-apple-music-streaming-services,https://cdn.vox-cdn.com/thumbor/SMAM1Dp3tmdVVc6rT5wJkOqXZ88=/0x59:3000x1630/fit-in/1200x630/cdn.vox-cdn.com/uploads/chorus_asset/file/22329540/EvG150UXEAME2j6.jpeg,"{'name': 'The Verge', 'url': 'https://www.theverge.com'}"
2021-02-25 23:25:55+00:00,Kindergarten teacher among finalists for Golden Apple Award,"CHAMPAIGN, Ill. (WCIA) — Kindergarten teacher Dominique McCotter is a finalist for the Golden Apple Teaching Award. The Golden Apple Awards for Excellence in Teaching “honor outstanding teachers for having lasting, positive effects on students’ lives and school communities. Teacher finalists demonstrate — in their teaching and results — significant, positive impact on their students’ […]","CHAMPAIGN, Ill. (WCIA) — Kindergarten teacher Dominique McCotter is a finalist for the Golden Apple Teaching Award.
The Golden Apple Awards for Excellence in Teaching “honor outstanding teachers for having lasting, positive effects on students’ lives... [1740 chars]",https://www.wcia.com/news/kindergarten-teacher-among-finalists-for-golden-apple-award/,https://www.wcia.com/wp-content/uploads/sites/44/2021/02/Dominique-Mccotter.jpg?w=1280,"{'name': 'wcia.com', 'url': 'https://www.wcia.com'}"
2021-02-25 23:00:22+00:00,Kohlrabi sheds its fancy image in this humble salad,"Typically made with celery root, the French rémoulade slaw is made here with julienned kohlrabi and apple and dressed in yogurt.","Kohlrabi suffers from a highfalutin image in the U.S. Popular with high-end restaurant chefs, it’s become synonymous with farmers markets and a particular world of food snobbishness that many believe exists there — although anyone who actually goes t... [2343 chars]",https://www.latimes.com/food/story/2021-02-25/kohlrabi-sheds-its-fancy-image-in-this-humble-salad,https://ca-times.brightspotcdn.com/dims4/default/0b99937/2147483647/strip/true/crop/4032x2117+0+454/resize/1200x630!/quality/90/?url=https%3A%2F%2Fcalifornia-times-brightspot.s3.amazonaws.com%2Fd9%2F81%2F60b4e6914d3284981a0e3e763f9e%2Fla-photos-1staff-718221-la-fo-kohlrabi-salad-007.JPG,"{'name': 'Los Angeles Times', 'url': 'https://www.latimes.com'}"
2021-02-25 22:37:19+00:00,Apple investors shouldn't ignore these 3 weaknesses,The Apple Inc (NASDAQ:AAPL) stock price has more than tripled over the past 3 years but investors shouldn't overlook these threats.,"This article was originally published on Fool.com. All figures quoted in US dollars unless otherwise stated.
Apple Inc (NASDAQ: AAPL)’s stock price has more than tripled over the past three years, silencing the bears who claimed its best days were ov... [4768 chars]",https://www.fool.com.au/2021/02/26/apple-investors-shouldnt-ignore-these-3-weaknesses-usfeed/,https://www.fool.com.au/wp-content/uploads/2021/02/apple-stock.jpg,"{'name': 'Motley Fool Australia', 'url': 'https://www.fool.com.au'}"
2021-02-25 22:17:00+00:00,District court judge orders Valve to hand over Steam sales data to Apple,"This is unfortunate news for Valve. As the company explained in its original position statement, since it's a private firm, it is not obligated to store and...","In context: Earlier this week, we reported on some new developments in the Epic v. Apple legal battle. To recap, Apple recently asked Valve to provide it with sales data on 436 Steam games, to help it understand the markets Epic competes in. Valve in... [1928 chars]",https://www.techspot.com/news/88753-district-court-judge-orders-valve-hand-over-steam.html,https://static.techspot.com/images2/news/bigimage/2021/02/2021-02-25-image-22.jpg,"{'name': 'TechSpot', 'url': 'https://www.techspot.com'}"
2021-02-25 22:16:35+00:00,Apple fans will love this news from Target,"Target is bringing an expanded Apple Store experience to Target stores, which includes doubling Apple's space and adding new products and aesthetics. Target says it worked with Apple on the design of the new Apple experience inside Target, which also extends to the Target website as well as the...","Target is bringing an expanded Apple Store experience to Target stores, which includes doubling Apple’s space and adding new products and aesthetics.
Target says it worked with Apple on the design of the new Apple experience inside Target, which also... [3850 chars]",https://bgr.com/2021/02/25/apple-stores-in-target-more-space-new-product-experience-coming-soon/,https://bgr.com/wp-content/uploads/2021/02/Apple-Experience-at-Target_rendering.jpg?quality=70&strip=all,"{'name': 'BGR', 'url': 'https://bgr.com'}"
2021-02-25 22:11:05+00:00,Apple products get double the space in Target stores,"Many Target stores will become better places to buy Macs, iPhones and other Apple products. In a deal announced Thursday, there’ll be twice as much space","Many Target stores will become better places to buy Macs, iPhones and other Apple products. In a deal announced Thursday, there’ll be twice as much space dedicated to the devices in these locations, and Target employees will get additional training o... [769 chars]",https://www.cultofmac.com/736211/apple-products-get-double-the-space-in-target-stores/,https://cdn.cultofmac.com/wp-content/uploads/2018/11/13954818501_e311adbe7b_k.jpg,"{'name': 'Cult of Mac', 'url': 'https://www.cultofmac.com'}"
2021-02-25 21:56:26+00:00,Apple bringing back the rainbow iMacs would signal the return of the whimsy,The latest rumors have Apple offering an upcoming iMac refresh in five different colors.,"Apple offering the iPad Air in multiple colors was another example of this and long may it continue.
Will I buy an iMac in Rose Gold? No, I won't. Green? Nope. If I was to buy a new iMac it'd be Space Gray at best, but likely the same Silver color Ap... [1492 chars]",https://www.imore.com/apple-bringing-back-rainbow-imacs-would-signal-return-whimsy,https://www.imore.com/sites/imore.com/files/styles/large/public/field/image/2021/02/jon-prosser-imac-2021colors.jpg,"{'name': 'iMore', 'url': 'https://www.imore.com'}"
2021-02-25 21:52:28+00:00,Dutch competition regulators nearing draft decision in Apple investigation,"Dutch competition authorities are nearing a draft decision in a years-long investigation into Apple Inc over rules requiring software developers to use its in-app payment system, according to a letter sent this month to some of the developers involved in the case.","FILE PHOTO: The Apple logo is seen at an Apple Store in Brooklyn, New York, U.S. October 23, 2020. REUTERS/Brendan McDermid
(Reuters) - Dutch competition authorities are nearing a draft decision in a years-long investigation into Apple Inc over rules... [1629 chars]",https://www.reuters.com/article/us-netherlands-apple-antitrust/dutch-competition-regulators-nearing-draft-decision-in-apple-investigation-idUSKBN2AP2YG,https://static.reuters.com/resources/r/?m=02&d=20210225&t=2&i=1552945398&r=LYNXMPEH1O1OU&w=800,"{'name': 'Reuters', 'url': 'https://www.reuters.com'}"
2021-02-24 23:25:45+00:00,How I used feral apples to make my own drink for Cider Day,That apple core tossed from a passing car might one day yield the perfect alcoholic beverage.,"A lot of feral apples aren’t nice. Most taste pretty bland. Some taste downright rough. Chewy, woody, sour. Not appealing to most roadside foragers.
But they are very appealing to cider makers: tart acidity and mouth-puckering tannin might not be ple... [5909 chars]",https://www.afr.com/life-and-luxury/food-and-wine/how-i-used-feral-apples-to-make-my-own-drink-for-cider-day-20210217-p573d4,https://static.ffx.io/images/$zoom_0.9623%2C$multiply_0.7554%2C$ratio_1.776846%2C$width_1059%2C$x_163%2C$y_125/t_crop_custom/e_sharpen:25%2Cq_85%2Cf_jpg/t_afr_no_label_no_age_social_wm/836f993698eb5636819c99fcfe7eb46271e40b68,"{'name': 'The Australian Financial Review', 'url': 'https://www.afr.com'}"
2021-02-24 23:02:11+00:00,"This was Apple’s biggest mistake over the past decade, one analyst says","Apple TV+ is a little over a year old at this point, and it's built up a small, curated library of a few dozen original TV series and movies. One analyst thinks Apple's biggest mistake over the last 10 years or so relates to Apple TV+.","Apple TV+ is a little over a year old at this point, and it’s built up a small, curated library of a few dozen original TV series and movies.
One analyst thinks Apple’s biggest mistake over the last 10 years or so relates to Apple TV+.
Wedbush analys... [3798 chars]",https://bgr.com/2021/02/24/apple-tv-plus-vs-netflix-apple-made-a-huge-mistake-analyst-comments/,https://bgr.com/wp-content/uploads/2020/11/bgrpic-copy-1.jpg?quality=70&strip=all,"{'name': 'BGR', 'url': 'https://bgr.com'}"
2021-02-24 21:38:36+00:00,"2021 16-inch MacBook Pro Might Use Apple’s M1 Chip, Along With Same Appearance as Intel Version","One tipster points out that the 2021 16-inch MacBook Pro will be fueled by the M1 chip, and sport the same design as the Intel model","Apple’s 16-inch MacBook Pro has ample size and the necessary thickness to cool a beefier Apple Silicon. The only problem is, a tipster believes that it will sport the same 5nm M1 chip as the current-generation models released. With this revelation, i... [2302 chars]",https://wccftech.com/2021-16-inch-macbook-pro-specs-m1-chip-same-design/,https://cdn.wccftech.com/wp-content/uploads/2021/02/16-inch-MacBook-Pro-11.jpg,"{'name': 'Wccftech', 'url': 'https://wccftech.com'}"
2021-02-24 21:06:14+00:00,The 2021 iMac might have a huge surprise that no one expected,A leaker says Apple is working on a huge iMac surprise for fans of the all-in-one desktop. Jon Prosser shared renders showing the new iMac design complete with various color options aside from just silver. The 2021 iMac could ship in the same colors available on the latest iPad Air models.,"A leaker says Apple is working on a huge iMac surprise for fans of the all-in-one desktop.
Jon Prosser shared renders showing the new iMac design complete with various color options aside from just silver.
The 2021 iMac could ship in the same colors ... [3270 chars]",https://bgr.com/2021/02/24/imac-2021-rumors-redesign-color-options/,https://bgr.com/wp-content/uploads/2020/09/iPad-Air-4-Colors.jpg?quality=70&strip=all,"{'name': 'BGR', 'url': 'https://bgr.com'}"
2021-02-24 21:00:53+00:00,Apple Watch stuck in Power Reserve? Here's how to get a free repair.,Is your Apple Watch stuck in Power Reserve mode following Apple's recent watchOS updates? Here's how to check if it's eligible for repair.,"Is your Apple Watch stuck in Power Reserve mode following Apple’s recent watchOS 7.2 and 7.3 updates? You might be able to get it repaired for free. Here’s how to find out if you’re eligible.
Apple says “a very small number of customers” with Apple W... [1314 chars]",https://www.cultofmac.com/736040/apple-watch-stuck-power-reserve/,https://cdn.cultofmac.com/wp-content/uploads/2021/02/Apple-Watch-power-howto.jpg,"{'name': 'Cult of Mac', 'url': 'https://www.cultofmac.com'}"
2021-02-24 20:47:33+00:00,This clever iPhone 12 MagSafe battery just beat Apple to the punch,Anker has launched its new MagSafe battery pack that stays attached to your phone at all times and is a unique alternative to a charging case.,Anker has released a new MagSafe portable charger that keeps your phone topped up without the need of a charge case. The Anker PowerCore Magnetic 5K Wireless Power Bank actually beats Apple to market as the company is also reportedly working on a sim... [1456 chars],https://www.tomsguide.com/news/this-clever-iphone-12-magsafe-battery-just-beat-apple-to-the-punch,https://cdn.mos.cms.futurecdn.net/dgjvXYMpQSe8P3rRGzi8HA-1200-80.jpg,"{'name': ""Tom's Guide"", 'url': 'https://www.tomsguide.com'}"
2021-02-24 20:44:29+00:00,"Wiz Khalifa Puts ""Behind The Cam"" Doc On YouTube",Wiz Khalifa's 2019 Apple Music documentary 'Behind The Cam' officially comes to YouTube and Facebook. Wiz Khalifa has officially widened the accessibility of...,"Wiz Khalifa has officially widened the accessibility of his five-part docuseries Wiz Khalifa: Behind The Cam, bringing it over to both YouTube and Facebook. While die-hard Wiz fans have likely seen the documentary already, being that it was originall... [1254 chars]",https://www.hotnewhiphop.com/wiz-khalifa-puts-behind-the-cam-doc-on-youtube-news.127282.html,https://www.hotnewhiphop.com/image/740x416/cover/1614198267_47552d1c0bef4f7aa85ad18de883fc95.jpg/cb1f712c2e2dd316e653eb9ae2d77f35/1614198267_43b2dbb082214b79596af0df67766c8b.jpg,"{'name': 'HotNewHipHop', 'url': 'https://www.hotnewhiphop.com'}"
2021-02-24 20:34:55+00:00,Welcome to iPhone 13 Pro (maybe),Apple is likely to announce a new round of iPhones later this year – will one look like this?,"The main feature addition I am absolutely here for is Touch ID . Apple could build it into the sleep/wake button or the screen, with the latter being exactly what this concept imagines.
Apple is very likely to announce the iPhone 13 later this year a... [1143 chars]",https://www.imore.com/welcome-iphone-13-pro-maybe,https://www.imore.com/sites/imore.com/files/styles/large/public/field/image/2020/11/iphone-12-pro-pacific-blue-iphone-11-midnight-green-blue-02.jpg,"{'name': 'iMore', 'url': 'https://www.imore.com'}"
2021-02-24 20:24:33+00:00,"Vaccines up, closures down ahead of NYC middle school reopening",Coronavirus-related public school closures in the Big Apple have plunged to low single digits with middle schools set to partially reopen Thursday -- while nearly a quarter of the education department's staffers have now been vaccinated against the virus.,"Sign up for our special edition newsletter to get a daily update on the coronavirus pandemic.
Coronavirus-related public school closures in the Big Apple have plunged to low single digits with middle schools set to partially reopen Thursday — while n... [3135 chars]",https://nypost.com/2021/02/24/vaccines-up-closures-down-ahead-of-nyc-middle-school-reopening/,https://nypost.com/wp-content/uploads/sites/2/2021/02/new-york-teacher-vaccine.jpg?quality=90&strip=all&w=1200,"{'name': 'New York Post', 'url': 'https://nypost.com'}"
2021-02-24 19:50:59+00:00,Apple starts selling refurbished M1 MacBooks at big discounts,Apple began selling refurbished M1 MacBooks at well below their original prices. There are MacBook Air and MacBook Pro units in stock.,"Apple began selling refurbished M1 MacBooks at well below their original prices. As they’re as much as $500 below the regular price, these are outstanding options for anyone who wants a laptop with Apple’s speedy M-series processor but don’t have the... [2933 chars]",https://www.cultofmac.com/736056/apple-starts-selling-refurbished-m1-macbook-pros-at-big-discounts/,https://cdn.cultofmac.com/wp-content/uploads/2020/11/MacBook_Air_M1_front_2.jpeg,"{'name': 'Cult of Mac', 'url': 'https://www.cultofmac.com'}"
2021-02-23 23:56:00+00:00,Apple issues warning after cardiologist 'stunned' to find iPhone 12 can control cardiac devices,"A Michigan cardiologist became suspicious of Apple’s new magnetic charging technology, so he passed an iPhone 12 over the chest of a patient with an implantable defibrillator — and was stunned to find it tripped the magnetic switch.","Apple has issued a warning about the iPhone 12 and MagSafe accessories after a Michigan cardiologist discovered the technology’s magnet is strong enough to interfere with medical devices.
Apple is advising those with an implanted pacemakers or defibr... [2338 chars]",https://www.fox4news.com/news/apple-issues-warning-after-cardiologist-stunned-to-find-iphone-12-can-control-cardiac-devices,https://images.foxtv.com/static.fox4news.com/www.fox4news.com/content/uploads/2021/02/1280/720/GettyImages-1229607602.jpg?ve=1&tl=1,"{'name': 'FOX 4 News', 'url': 'https://www.fox4news.com'}"
2021-02-23 23:55:23+00:00,"Apple plans to increase dividend, approves executive compensation - CNBC","Apple Inc is planning to increase dividend according to Chief Executive Tim Cook, CNBC reported on Tuesday, citing the shareholder meeting.","FILE PHOTO: The Apple logo is seen at an Apple Store in Brooklyn, New York, U.S. October 23, 2020. REUTERS/Brendan McDermid
(Reuters) - Apple Inc is planning to increase dividend according to Chief Executive Tim Cook, CNBC reported on Tuesday, citing... [914 chars]",https://www.reuters.com/article/us-apple-dividend/apple-plans-to-increase-dividend-approves-executive-compensation-cnbc-idUSKBN2AN24Z,https://static.reuters.com/resources/r/?m=02&d=20210223&t=2&i=1552634109&r=LYNXMPEH1M1AA&w=800,"{'name': 'Reuters', 'url': 'https://www.reuters.com'}"
2021-02-23 23:53:11+00:00,"UPDATE 1-Apple plans to increase dividend, approves executive compensation - CNBC","(https://cnb.cx/2ZIjRcj) Shareholders will not vote until next year's annual meeting on Cook's September grant of 333,987 restricted stock units, his first major stock package since 2011, which took effect at the start of Apple's fiscal 2021. It grants him stock units with a possibility to earn as many as 667,974 more if he hits performance targets.","Apple Inc is planning to increase dividend according to Chief Executive Tim Cook, CNBC reported on Tuesday, citing the shareholder meeting.
The company's shareholders also approved compensation for Apple executives for fiscal 2020, the report said. (... [803 chars]",https://www.devdiscourse.com/article/business/1470848-update-1-apple-plans-to-increase-dividend-approves-executive-compensation---cnbc,https://www.devdiscourse.com/remote.axd?https://devdiscourse.blob.core.windows.net/imagegallery/29_02_2020_19_18_04_5779125.jpg?width=920&format=jpeg,"{'name': 'Devdiscourse', 'url': 'https://www.devdiscourse.com'}"
2021-02-23 23:41:54+00:00,Future AirPods Models Could Detect if Users Are Wearing the Earbuds Properly,"You might not care if your AirPods are fitted properly, but future iterations from Apple might alert you to position them properly","Where technology has allowed the transition of bulky headphones to miniature earbuds, there’s always something that a company like Apple would be looking to improve. For example, with the AirPods Pro, the company introduced silicone replaceable earti... [1851 chars]",https://wccftech.com/future-airpods-detect-users-wearing-them-properly/,https://cdn.wccftech.com/wp-content/uploads/2021/02/AirPods-Pro-4.jpg,"{'name': 'Wccftech', 'url': 'https://wccftech.com'}"
2021-02-23 23:33:00+00:00,"Apple MacBook Pro to get HDMI, SD card reader back to meet fan demand","People have been complaining about a lack of connectivity ports on Apple’s computers ever since the company first adopted a new connection in 2015, but a rumoured backflip is coming with Apple expected to restore some important connections.","With the release of the iPhone 12 range, here are the main things you need to know before purchasing.
With the release of the iPhone 12 range, here are the main things you need to know before purchasing....
People have been complaining about a lack o... [2337 chars]",https://www.news.com.au/technology/home-entertainment/computers/apple-macbook-pro-to-get-hdmi-sd-card-reader-back-to-meet-fan-demand/news-story/66fac11817544b6b513b2ff38175f19c,https://cdn.newsapi.com.au/image/v1/5de525c5a4a88b280106e537148c92dc?width=1280,"{'name': 'NEWS.com.au', 'url': 'https://www.news.com.au'}"
2021-02-23 23:28:00+00:00,Sign In with Apple reportedly under federal scrutiny,"Investigators looking at whether the security feature makes it difficult to switch to another platform, The Information reports.","James Martin/CNET
The US Justice Department is investigating Apple's Sign In with Apple feature as part of an antitrust probe into the iPhone maker, according to a report in The Information on Tuesday. Investigators are examining whether the security... [1557 chars]",https://www.cnet.com/news/sign-in-with-apple-reportedly-under-federal-scrutiny/,https://cnet1.cbsistatic.com/img/OScl0M7fYK4SWMa2bQHGHBhbkCc=/1200x630/2019/06/04/5964bd13-ba07-43b1-b3cd-89bf4a764522/apple-wwdc-2019-sign-in-with-apple-2819.jpg,"{'name': 'CNET', 'url': 'https://www.cnet.com'}"
2021-02-23 22:58:19+00:00,Kindergarten teacher named a finalist in Golden Apple Awards,"CHAMPAIGN, Ill. (WCIA) — A Champaign Schools kindergarten teacher is a finalist for the 2021 Golden Apple Award for Excellence in Teaching. Dominique McCotter works at Dr. Howard Elementary. She’s one of 32 Pre-K-3 grade finalists. The Golden Apple Awards honor outstanding teachers for having lasting, positive effects on students’ lives and school communities. 708 […]","CHAMPAIGN, Ill. (WCIA) — A Champaign Schools kindergarten teacher is a finalist for the 2021 Golden Apple Award for Excellence in Teaching.
Dominique McCotter works at Dr. Howard Elementary. She’s one of 32 Pre-K-3 grade finalists.
The Golden Apple A... [378 chars]",https://www.wcia.com/news/local-news/kindergarten-teacher-named-a-finalist-in-golden-apple-awards/,https://www.wcia.com/wp-content/uploads/sites/44/2021/02/golden-apple-finalist-web.jpg?w=1280,"{'name': 'wcia.com', 'url': 'https://www.wcia.com'}"
2021-02-23 22:50:44+00:00,Apple Offers Developers Clarification on Some App Privacy Data Reporting Requirements,"Apple today informed developers that it has introduced additional guidance for App Store privacy labels, a feature that Apple has been requiring for...","Apple today informed developers that it has introduced additional guidance for App Store privacy labels, a feature that Apple has been requiring for all apps since December.
Apple says that rules surrounding data types like email, text messages, and ... [1498 chars]",https://www.macrumors.com/2021/02/23/app-privacy-labels-developer-info/,https://images.macrumors.com/t/z1XZ47iXDipqVpWX96_YScwq3v8=/1600x/https://images.macrumors.com/article-new/2021/01/app-store-privacy-labels-iphone-12.jpg,"{'name': 'MacRumors', 'url': 'https://www.macrumors.com'}"
2021-02-23 22:31:00+00:00,"Another state tries to pass a bill that ""could destroy iPhone as we know it""","Like North Dakota tried to do but failed, Arizona is trying to push a bill through the Arizona House of Representatives that seeks to stop Apple and Google from forcing developers to use their in-app payment platforms.","Earlier this month, a bill in the North Dakota state senate failed to pass by a vote of 11 to 26 . Had the bill passed and eventually signed by the Governor of the state, it would have forced Apple and Google to make some changes to the App Store and... [3618 chars]",https://www.phonearena.com/news/arizona-bill-seeks-to-stop-apple-google-from-forcing-developers-to-use-their-in-app-payment-platforms_id130313,https://m-cdn.phonearena.com/images/article/130313-two_1200/Another-state-tries-to-pass-a-bill-that-could-destroy-iPhone-as-we-know-it.jpg,"{'name': 'PhoneArena', 'url': 'https://www.phonearena.com'}"
2021-02-23 22:30:25+00:00,Anker beats Apple with first MagSafe iPhone 12 power bank,Anker will apparently launch the first power bank that uses the MagSafe system to magnetically attach to an iPhone 12 series model.,"Anker will apparently launch the first power bank that uses the MagSafe system to magnetically attach to an iPhone 12 series model. The PowerCore Magnetic 5K will be able to transmit 5000mAh to Apple’s latest handsets through inductive charging.
Howe... [1756 chars]",https://www.cultofmac.com/735971/anker-beats-apple-with-first-magsafe-iphone-12-power-bank/,https://cdn.cultofmac.com/wp-content/uploads/2021/02/8E45B937-B01F-45FA-B8B2-69005202048E.jpeg,"{'name': 'Cult of Mac', 'url': 'https://www.cultofmac.com'}"
2021-02-22 23:54:20+00:00,Vacant stores next door make businesses burglary targets,"Crooks are making good use of the Big Apple's empty storefronts -- breaking through walls to get into businesses that are still up and running next door, The Post has found.","Crooks are making good use of the Big Apple’s empty storefronts — breaking through walls to get into businesses that are still up and running next door, a review by The Post has found.
With nearly half of small businesses closed citywide due to the c... [2743 chars]",https://nypost.com/2021/02/22/vacant-stores-next-door-make-businesses-burglary-targets/,https://nypost.com/wp-content/uploads/sites/2/2021/02/davidoff.jpg?quality=90&strip=all&w=1200,"{'name': 'New York Post', 'url': 'https://nypost.com'}"
2021-02-22 23:49:46+00:00,Billie Eilish to perform live ahead Apple TV's film launch,"While Apple is promoting Billie Eilish’s new documentary, Spotify is using the artist to advertise their HiFi tier announced today.","Billie Eilish and Apple have been collaborating for a few years now, and the company announced today the artist is going to perform live on Thursday, February 25 in the Apple Music app, the Apple TV app, and on YouTube. This comes before the premiere... [2932 chars]",https://9to5mac.com/2021/02/22/billie-eilish-perform-live-event-apple-tv-documentary-launch/,https://9to5mac.com/favicon.ico,"{'name': '9to5Mac', 'url': 'https://9to5mac.com'}"
