publishedAt,title,description,content,url,image,source
2021-05-09 23:02:22+00:00,Leaked Apple Watch 7 feature would help millions of diabetics in Australia,It’s rumoured there could be an updated Apple Watch with the new health monitoring feature that would be a game-changer.,"Apple has been steadily adding health features to its undisputed smartwatch champion, and if the latest leaked information is anything to go by then the next upgrade will be a game-changer.
A rumoured feature of the upcoming refreshed Apple Watch wou... [1111 chars]",https://7news.com.au/technology/leaked-apple-watch-7-feature-would-help-millions-of-diabetics-in-australia-c-2800728,https://images.7news.com.au/publication/C-2800728/0de67e61050e97188f1ef802e9e3f3a4e4d8dc34-16x9-x0y184w1960h1103.jpg?imwidth=1024,"{'name': '7NEWS.com.au', 'url': 'https://7news.com.au'}"
2021-05-09 23:02:00+00:00,Some factories churning out the Apple iPhone in India are infected with COVID-19,Apple iPhone manufacturers Foxconn and Wistron were both hit by an outbreak of COVID-19 in India; 10 Foxconn engineers came down with the virus while 3 Wistron managers also became infected.,"Apple has been manufacturing certain iPhone models in India for a few years now. One reason to do so is to eliminate the import tax that India imposes on iPhone handsets shipped into the country. In addition, having the phone made in India allows it ... [1426 chars]",https://www.phonearena.com/news/iphone-manufacturers-in-india-hit-by-COVID-19-outbreak_id131989,https://m-cdn.phonearena.com/images/article/131989-wide-two_1200/Some-factories-churning-out-the-Apple-iPhone-in-India-are-infected-with-COVID-19.jpg,"{'name': 'PhoneArena', 'url': 'https://www.phonearena.com'}"
2021-05-09 23:00:00+00:00,‘Not being able to say his name was like he never existed’ - mother relieved law change allows murdered son Brooklyn Colbert to be named,"Brooklyn Colbert was the apple of his parents’ eyes, but their whole world crumbled when the 11-year-old was stabbed and beaten to death by his half uncle, in 2019.","Brooklyn Colbert (11), who was beaten and stabbed to death by his half uncle Patrick Dillon in 2019. Photo David Raleigh
Brooklyn Colbert was the apple of his parents’ eyes, but their whole world crumbled when the 11-year-old was stabbed and beaten t... [6003 chars]",https://www.independent.ie/news/not-being-able-to-say-his-name-was-like-he-never-existed-mother-relieved-law-change-allows-murdered-son-brooklyn-colbert-to-be-named-40407455.html,https://www.independent.ie/news/44db7/40407453.ece/AUTOCROP/w1240h700/IMG_9219.jpg,"{'name': 'Independent.ie', 'url': 'https://www.independent.ie'}"
2021-05-09 23:00:00+00:00,The Best Alternative Apps To Install Instead Of Your Phone's Defaults,"Your phone comes with a stack of apps to get you started""and they're fine, up to a point. But if you stick with the apps Apple and Google have given","The Best Alternative Apps To Install Instead Of Your Phone’s Defaults
Your phone comes with a stack of apps to get you started”and they’re fine, up to a point. But if you stick with the apps Apple and Google have given you, then you’re missing out on... [9079 chars]",https://www.gizmodo.com.au/2021/05/the-best-alternative-apps-to-install-instead-of-your-phones-defaults/,https://imgix.gizmodo.com.au/content/uploads/sites/2/2019/04/09/hvxcbhuubmynzojtdia7.jpg?ar=16%3A9&auto=format&fit=crop&q=80&w=1280&nr=20,"{'name': 'Gizmodo Australia', 'url': 'https://www.gizmodo.com.au'}"
2021-05-09 20:51:14+00:00,iPhone 13 release date rumors: We think we know when Apple will unveil it,All signs look good for a September Apple event and iPhone 13 unveiling. Here's everything we've heard.,"EverythingApplePro
It's been more than six months since the iPhone 12 went on sale, and Apple is setting its sights on its next flagship smartphone, the iPhone 13 (or whatever it ends up being called). We're expecting to see four versions of the new ... [2409 chars]",https://www.cnet.com/news/iphone-13-release-date-rumors-we-think-know-when-apple-will-unveil/,https://www.cnet.com/a/img/HtG0TZhY3th6Dx11__bZ_zqrTnc=/1200x630/2021/04/10/c2058c11-c776-4eda-8e31-2333c67f9727/iphone-13-rendering-2.png,"{'name': 'CNET', 'url': 'https://www.cnet.com'}"
2021-05-09 20:15:00+00:00,Is Epic Games' showdown with Apple turning into a mismatch?,"If Epic Games hopes to dismantle the fortress surrounding Apple's iPhone and its app store, the video game maker probably will need to roll out some heavier artillery heading into the second week of a trial threatening Apple's $2 trillion empire.","Michael Liedtke, The Associated Press
SAN RAMON, Calif. - If Epic Games hopes to dismantle the fortress surrounding Apple's iPhone and its app store, the video game maker probably will need to roll out some heavier artillery heading into the second w... [5055 chars]",https://www.cp24.com/world/is-epic-games-showdown-with-apple-turning-into-a-mismatch-1.5420567,https://www.cp24.com/polopoly_fs/1.5420569.1620591292!/httpImage/image.jpg_gen/derivatives/landscape_620/image.jpg,"{'name': 'CP24 Toronto', 'url': 'https://www.cp24.com'}"
2021-05-09 20:12:00+00:00,Is Epic Games' showdown with Apple turning into a mismatch?,"SAN RAMON, Calif. (AP) — If Epic Games hopes to dismantle the fortress surrounding...","SAN RAMON, Calif. (AP) — If Epic Games hopes to dismantle the fortress surrounding Apple's iPhone and its app store, the video game maker probably will need to roll out some heavier artillery heading into the second week of a trial threatening Apple'... [5022 chars]",https://www.bigrapidsnews.com/business/article/Is-Epic-Games-showdown-with-Apple-turning-into-a-16163796.php,https://s.hdnux.com/photos/01/17/77/16/20968362/3/rawImage.jpg,"{'name': 'The Pioneer', 'url': 'https://www.bigrapidsnews.com'}"
2021-05-09 20:10:47+00:00,Is Epic Games' showdown with Apple turning into a mismatch?,"If Epic Games hopes to dismantle the fortress surrounding Apple’s iPhone and its app store, the video game maker probably will need to roll out some heavier artillery heading into the second week of a trial threatening Apple’s $2 trillion empire.","FILE - In this Saturday, March 14, 2020 file photo, an Apple logo adorns the facade of the downtown Brooklyn Apple store in New York. If Epic Games hopes to dismantle the fortress surrounding Apple's iPhone and its app store, the video game maker pro... [5441 chars]",https://www.clickondetroit.com/business/2021/05/09/is-epic-games-showdown-with-apple-turning-into-a-mismatch/,https://www.clickondetroit.com/resizer/zJmOhz4RgtmR4HOm1cKwxY8trOQ=/800x533/smart/filters:format(jpeg):strip_exif(true):strip_icc(true):no_upscale(true):quality(65)/cloudfront-us-east-1.images.arcpublishing.com/gmg/DKIXH722S5AVRMC7USTAVUE6D4.jpg,"{'name': 'WDIV ClickOnDetroit', 'url': 'https://www.clickondetroit.com'}"
2021-05-09 19:08:14+00:00,This incredible new feature might come to the Apple Watch Series 7,"Apple will launch the new Apple Watch Series 7 later this year alongside its upcoming iPhone 13 handsets. Apple has been upgrading the Watch’s health monitoring capabilities with each generation, and the Apple Watch Series 7 will be no different.","Apple will launch the new Apple Watch Series 7 later this year alongside its upcoming iPhone 13 handsets. Apple has been upgrading the Watch’s health monitoring capabilities with each generation, and the Apple Watch Series 7 will be no different. The... [3495 chars]",https://bgr.com/tech/apple-watch-series-7-rumors-blood-glucose-sensor-5924407/,https://bgr.com/wp-content/uploads/2020/09/Apple-Watch-Series-6.jpg?quality=70&strip=all,"{'name': 'BGR', 'url': 'https://bgr.com'}"
2021-05-09 18:00:04+00:00,AirTags: How to pair and set up Apple's new trackers,You can now buy Apple AirTags. Here's how to get the trackers set up once they arrive.,"Patrick Holland/CNET
You can finally get your hands on one of Apple's new AirTags tracking devices. The beacon-style devices work similarly to Tile and Samsung's SmartTag Bluetooth trackers and can help you find lost items like your keys, backpack an... [2437 chars]",https://www.cnet.com/how-to/airtags-how-to-pair-and-set-up-apples-new-trackers/,https://www.cnet.com/a/img/AJ1NhxflVdOp9sy02h9cid7JvYs=/1200x630/2021/04/23/8db23bcc-98ef-4d8f-b6c9-a68bdcac3860/p1005671.jpg,"{'name': 'CNET', 'url': 'https://www.cnet.com'}"
2021-05-08 23:23:45+00:00,Always busy and can't get organised? Here's how to maximise your phone's free apps,Both Apple and Google have useful free task-reminder apps on your phone that can keep you and your projects on track.,"Both Apple and Google have useful free task-reminder apps on your phone that can keep you and your projects on track.
Getting organized is serious business, judging by the number of checklist and chore-tracker programs available. If you are new to mo... [4322 chars]",https://www.channelnewsasia.com/news/lifestyle/apple-google-free-apps-task-reminders-mobile-phone-14750860,"https://cna-sg-res.cloudinary.com/image/upload/q_auto,f_auto/image/14772678/16x9/991/557/3fce0ec22582a3d1f4403be29f7849a3/FP/nyt-apple-google-free-task-reminder-apps.jpg","{'name': 'CNA', 'url': 'https://www.channelnewsasia.com'}"
2021-05-08 21:40:44+00:00,"Grab the Epic AirPods Pro with Active Noise Cancelling for Just $197 this Mother's Day, Save $52 Instantly",Apple is offering the AirPods Pro with active noise cancelling and H1 chip for a low price of just $197 this Mother's Day weekend.,"Apple is offering the AirPods Pro with active noise cancelling and H1 chip for a low price of just $197 this Mother's Day weekend.
Mother's Day Deal Discounts the AirPods Pro to a Low Price of $197
Just for this Mother's Day weekend, Apple is everyon... [985 chars]",https://wccftech.com/grab-the-epic-airpods-pro-with-active-noise-cancelling-for-just-197-this-mothers-day-save-52-instantly/,https://cdn.wccftech.com/wp-content/uploads/2021/05/Mothers-Day-Deal-AirPods-Pro-1.jpg,"{'name': 'Wccftech', 'url': 'https://wccftech.com'}"
2021-05-08 19:00:49+00:00,Can I use Apple's Magic Keyboard with Touch ID with other computers?,"Apple's new 24-inch iMac with an M1 processor comes with a Magic Keyboard with Touch ID, so you may want to use it with other devices.","XDA Basics: Can I use Apple’s Magic Keyboard with Touch ID with other computers?
Apple’s new M1-powered 24-inch iMac is here. It comes with an all-new Magic Keyboard with Touch ID, which actually isn’t sold separately, at least for now. If you picked... [1444 chars]",https://www.xda-developers.com/use-apple-magic-keyboard-touch-id-other-computers/,https://www.xda-developers.com/files/2021/04/apple-new-imac-2021-magic-keyboard.jpg,"{'name': 'XDA Developers', 'url': 'https://www.xda-developers.com'}"
2021-05-08 18:29:00+00:00,Latest Data Suggests Apple Has Crushed Facebook’s Data Mining Of iOS Users,Apple's latest privacy updates in iOS 14.5 have severely limited Facebook's ability to monitor user data.,"The recent feud between Apple and Facebook has been well documented. The companies have been at odd for years, but tensions between the two came to a head most recently when Apple detailed its newest privacy guidelines at WWDC 2020. Those guidelines ... [1499 chars]",https://hothardware.com/news/latest-data-suggests-apple-has-crushed-facebooks-data-mining-of-ios-users,https://images.hothardware.com/contentimages/newsitem/55040/content/apple-facebook-eff-iphone.jpg,"{'name': 'Hot Hardware', 'url': 'https://hothardware.com'}"
2021-05-08 17:00:02+00:00,Best Cell Plans for Apple Watch Family Setup,"If you want to take advantage of the Family Setup feature for Apple Watch, you'll need to get a cellular plan for the watch. Here are the best cell plans for Apple Watch Family Setup.","Truphone offers a special deal for Family Setup specifically, including unlimited data, call, and text, and a U.S. phone number, all for $10 a month. There's no lock-in contract, making it easy to cancel whenever you need, and there's even a 7-day fr... [2573 chars]",https://www.imore.com/best-cell-plans-apple-watch-family-setup,https://www.imore.com/sites/imore.com/files/styles/large/public/field/image/2015/08/rene-apple-watch-apple-pay-hero.jpg,"{'name': 'iMore', 'url': 'https://www.imore.com'}"
2021-05-08 16:29:06+00:00,Mj Rodriguez Joins the Cast of Maya Rudolph Comedy Series,Pose star Mj Rodriguez will star opposite Maya Rudolph in an upcoming Apple TV+ comedy with the working title ‘Loot.’,"Mj Rodriguez will play opposite Maya Rudolph after Pose Season 3 ends. Photo: Getty Images
When TV closes a door, it opens a window. And if you’re lucky, that window has Maya Rudolph in it. It’s frankly a bummer that FX ballroom drama Pose will end a... [878 chars]",https://www.vulture.com/2021/05/mj-rodriguez-joins-the-cast-of-maya-rudolph-comedy-series.html,https://pyxis.nymag.com/v1/imgs/ece/718/265cdf26fe86f148fcc53d290c9d5d9745-GettyImages-1315271000.1x.rsocial.w1200.jpg,"{'name': 'Vulture', 'url': 'https://www.vulture.com'}"
2021-05-08 16:10:41+00:00,"Apple brass discussed disclosing 128-million iPhone hack, then decided not to",Emails entered into Epic Games lawsuit show execs contradicting Apple talking points.,"In September 2015, Apple managers had a dilemma on their hands: should, or should they not notify 128 million iPhone users of what remains the worst mass iOS compromise on record? Ultimately, all evidence shows, they chose to keep quiet.
128 million ... [5374 chars]",https://arstechnica.com/gadgets/2021/05/apple-brass-discussed-disclosing-128-million-iphone-hack-then-decided-not-to/,https://cdn.arstechnica.net/wp-content/uploads/2021/05/smartphone-760x380.jpeg,"{'name': 'Ars Technica', 'url': 'https://arstechnica.com'}"
2021-05-08 16:01:00+00:00,Comparison: How does Deezer compare to Apple Music in 2021?,Are you planning to switch from Apple Music to Deezer? Here's how the two music streaming services compare in 2021.,"When we talk about music streaming services, we usually highlight Apple Music and Spotify, but there are many other competitors in this market like Deezer, Pandora, YouTube Music, and Tidal. This time, I’d like to talk about how does Deezer compares ... [7136 chars]",https://9to5mac.com/2021/05/08/comparison-how-does-deezer-compare-to-apple-music-in-2021/,https://i2.wp.com/9to5mac.com/wp-content/uploads/sites/6/2021/05/apple-music-deezer-2.jpg?resize=1200%2C628&quality=82&strip=all&ssl=1,"{'name': '9to5Mac', 'url': 'https://9to5mac.com'}"
2021-05-08 16:00:14+00:00,AR is the future of fitness [Cult of Mac Magazine 400],"If you think Apple Watch makes workouts fun and efficient, wait till Apple’s mixed-reality glasses land on your face. Graham Bower outlines how and why","If you think Apple Watch makes workouts fun and efficient, wait till Apple’s mixed-reality glasses land on your face. Graham Bower outlines how and why augmented reality will take fitness to the next level in Cult of Mac Magazine‘s cover story this w... [464 chars]",https://www.cultofmac.com/741967/apple-ar-is-the-future-of-fitness-cult-of-mac-magazine-400/,https://cdn.cultofmac.com/wp-content/uploads/2021/05/COM-MAG-400_5.jpg,"{'name': 'Cult of Mac', 'url': 'https://www.cultofmac.com'}"
2021-05-08 15:26:05+00:00,Apple Mac Mini M1 deals reach lowest prices ever in the US and UK,Amazon's latest Apple Mac Mini M1 deals are offering up 512GB models for their lowest prices ever right now in both the US and UK.,"Apple deals hunters on both sides of the pond will be pleased to see the latest range of excellent price cuts on the new Apple Mac Mini M1 at Amazon this weekend.
Right now you can pick up this awesome little machine in its 512GB capacity variant for... [1920 chars]",https://www.techradar.com/news/apple-mac-mini-m1-deals-reach-lowest-prices-ever-in-the-us-and-uk,https://cdn.mos.cms.futurecdn.net/VWVLFAKvLrx2FNEam7krpG-1200-80.jpg,"{'name': 'TechRadar', 'url': 'https://www.techradar.com'}"
2021-05-07 23:03:53+00:00,AirPods 3 design revealed in video of shockingly accurate knockoffs,"Apple streamed its first big virtual event of 2021 on April 20th to unveil a host of new products, including a redesigned iMac, an M1-powered iPad Pro, an upgraded Apple TV, the purple iPhone 12, and the long-awaited AirTag.","Apple streamed its first big virtual event of 2021 on April 20th to unveil a host of new products, including a redesigned iMac, an M1-powered iPad Pro, an upgraded Apple TV, the purple iPhone 12, and the long-awaited AirTag. All things considered, it... [3042 chars]",https://bgr.com/tech/airpods-3-design-leak-video-clones-china-5924252/,https://bgr.com/wp-content/uploads/2021/05/AirPods-3-Clones.jpg?quality=70&strip=all,"{'name': 'BGR', 'url': 'https://bgr.com'}"
2021-05-07 22:40:00+00:00,Apple Tries Really Hard To Get Epic To Admit There's Porn On Its Store,"Is there porn on the Epic Games Store? Seems like a pretty easy “yes” or “no” question. Today, however, the ongoing, increasingly contentious Epic v. Apple court case showed us that actually it’s possible to have a nearly 10-minute argument about it.","Itch.io—not Epic’s—adult games section. Image : Itch.io
Is there porn on the Epic Games Store? Seems like a pretty easy “yes” or “no” question. Today, however, the ongoing, increasingly contentious Epic v. Apple court case showed us that actually it’... [4783 chars]",https://kotaku.com/apple-tries-really-hard-to-get-epic-to-admit-theres-por-1846849388,"https://i.kinja-img.com/gawker-media/image/upload/c_fill,f_auto,fl_progressive,g_center,h_675,pg_1,q_80,w_1200/da3b92d7153c02dd1b731ec60a5c50bf.jpg","{'name': 'Kotaku', 'url': 'https://kotaku.com'}"
2021-05-07 22:40:00+00:00,Apple Tries Really Hard To Get Epic To Admit There's Porn On Its Store,"Is there porn on the Epic Games Store? Seems like a pretty easy “yes” or “no” question. Today, however, the ongoing, increasingly contentious","Apple Tries Really Hard To Get Epic To Admit There’s Porn On Its Store
Is there porn on the Epic Games Store? Seems like a pretty easy “yes” or “no” question. Today, however, the ongoing, increasingly contentious Epic v. Apple court case showed us th... [4556 chars]",https://www.kotaku.com.au/2021/05/apple-tries-really-hard-to-get-epic-to-admit-theres-porn-on-its-store/,https://imgix.kotaku.com.au/content/uploads/sites/3/2021/05/08/da3b92d7153c02dd1b731ec60a5c50bf.jpg?ar=16%3A9&auto=format&fit=crop&q=80&w=1280&nr=20,"{'name': 'Kotaku Australia', 'url': 'https://www.kotaku.com.au'}"
2021-05-07 22:01:38+00:00,You finally got 5G on your iPhone - but here’s why you might want to disable it,"In stark contrast to many other tech companies, Apple has never had an overriding obsession with being the first company to bring a product or technology to market. On the contrary, a consistent tenet of Apple's product strategy has been to focus on being the best as opposed to the first.","In stark contrast to many other tech companies, Apple has never had an overriding obsession with being the first company to bring a product or technology to market. On the contrary, a consistent tenet of Apple’s product strategy has been to focus on ... [3239 chars]",https://bgr.com/tech/iphone-5g-how-to-turn-off-battery-life-5924346/,https://bgr.com/wp-content/uploads/2020/10/iphone-12-5g-mmwave.jpg?quality=70&strip=all,"{'name': 'BGR', 'url': 'https://bgr.com'}"
2021-05-07 21:53:40+00:00,Listen to what we’ve learned from Epic v. Apple this week,"This week on The Vergecast, Nilay and Dieter talk with Verge senior reporter Adi Robertson and senior editor Tom Warren about the first week of the Epic Games v. Apple trial.","Every Friday, The Verge publishes our flagship podcast, The Vergecast, where co-hosts Nilay Patel and Dieter Bohn discuss the week in tech news with the reporters and editors covering the biggest stories.
This week on The Vergecast, Nilay and Dieter ... [509 chars]",https://www.theverge.com/2021/5/7/22424947/apple-v-epic-trial-week-1-vergecast-podcast-451,https://cdn.vox-cdn.com/thumbor/A3W8qd3B3ujlB4JDGV7FElcz6F0=/0x146:2040x1214/fit-in/1200x630/cdn.vox-cdn.com/uploads/chorus_asset/file/21783860/acastro_20200818_1777_epicApple_0004.0.jpg,"{'name': 'The Verge', 'url': 'https://www.theverge.com'}"
2021-05-07 21:45:43+00:00,"Instead of Using Apple’s Find My, Tile is Partnering with Amazon to Improve its Own Network Coverage",Amazon has just announced a partnership with Tile where it will give the company access to its Sidewalk network.,"Amazon has just announced a partnership with Tile where it will give the company access to its Sidewalk network.
Tile is About to Get a Whole Lot Better with Amazon Sidewalk Integration, Should Apple be Worried? No
It is no secret at this point that ... [1953 chars]",https://wccftech.com/instead-of-using-apples-find-my-tile-is-partnering-with-amazon-to-improve-its-own-network-coverage/,https://cdn.wccftech.com/wp-content/uploads/2021/05/Tile-Amazon-Sidewalk.jpg,"{'name': 'Wccftech', 'url': 'https://wccftech.com'}"
2021-05-07 21:44:00+00:00,Apple Lawyer Points Out Epic Games Store Top 20 Has 25 Games,"During Apple’s cross-examination of Steven Allison, general manager of the Epic Games Store, Apple’s lawyer walked all assembled, piece by piece,","Apple Lawyer Points Out Epic Games Store Top 20 Has 25 Games
During Apple’s cross-examination of Steven Allison, general manager of the Epic Games Store, Apple’s lawyer walked all assembled, piece by piece, through the Epic Games Store. Alongside say... [454 chars]",https://www.kotaku.com.au/2021/05/apple-lawyer-points-out-epic-games-store-top-20-has-25-games/,https://imgix.kotaku.com.au/content/uploads/sites/3/2021/05/08/d3886d0b9089113d0ebd35dcbbb6ce10.png?ar=16%3A9&auto=format&fit=crop&q=65&w=1280,"{'name': 'Kotaku Australia', 'url': 'https://www.kotaku.com.au'}"
2021-05-07 21:44:00+00:00,Apple Lawyer Points Out Epic Games Store Top 20 Has 25 Games,"During Apple’s cross-examination of Steven Allison, general manager of the Epic Games Store, Apple’s lawyer walked all assembled, piece by piece, through the Epic Games Store. Alongside saying game titles like Warframe and Necromunda: Hired Gun like they’re normal human words, Apple’s lawyer also pointed out a glaring, perhaps even fatal, discrepancy on the store.","Screenshot : Epic / Kotaku
During Apple’s cross-examination of Steven Allison, general manager of the Epic Games Store, Apple’s lawyer walked all assembled, piece by piece, through the Epic Games Store. Alongside saying game titles like Warframe and ... [437 chars]",https://kotaku.com/apple-lawyer-points-out-epic-games-store-top-20-has-25-1846849332,"https://i.kinja-img.com/gawker-media/image/upload/c_fill,f_auto,fl_progressive,g_center,h_675,pg_1,q_80,w_1200/d3886d0b9089113d0ebd35dcbbb6ce10.png","{'name': 'Kotaku', 'url': 'https://kotaku.com'}"
2021-05-07 21:38:00+00:00,"Best Buy 3-day sale: Save on laptops, TVs, headphones, Apple Watch and more","Save $400 on Sony's 55-inch A8H OLED 4K TV, pick up an Apple MacBook Pro 13-inch for $1,600 or grab some Sony headphones for $72 off.","If there's one thing that Best Buy does well -- and often -- it's having large sales, and this weekend's is characteristically epic. There's an enormous variety of products on sale, including TVs, laptops, mobile gadgets, appliances, smart home gear ... [2064 chars]",https://www.cnet.com/news/best-buy-3-day-sale-save-on-laptops-tvs-headphones-apple-watch-and-more/,https://www.cnet.com/a/img/FDWPqBaEu_HpcfE--T-3ZeE9HOw=/1200x630/2021/05/07/62f2525b-1074-4fee-b069-72f7aa4eba59/apple-watch-6.jpg,"{'name': 'CNET', 'url': 'https://www.cnet.com'}"
2021-05-07 21:30:55+00:00,Apple finally makes crucial hire: communications chief,"Stella Low left Cisco to become Apple’s new VP of worldwide corporate communications, putting her in charge of public relations efforts.","Stella Low is stepping into a position at Apple that’s been empty for years. She’s been named vice president of worldwide corporate communications. That puts her in charge of Apple’s public relations efforts.
She left Cisco to take the job with Apple... [970 chars]",https://www.cultofmac.com/741955/apple-worldwide-corporate-communications-chief-position-filled-stella-low/,https://cdn.cultofmac.com/wp-content/uploads/2021/05/A3B50C81-69F5-42EC-A367-F5E9C313C51F.jpeg,"{'name': 'Cult of Mac', 'url': 'https://www.cultofmac.com'}"
2021-05-06 23:31:00+00:00,Apple just crushed earnings: 3 things investors need to know,"This big tech company delivered strong results, but that's only part of the story.","This article was originally published on Fool.com. All figures quoted in US dollars unless otherwise stated.
Apple (NASDAQ: AAPL) has been in the news a lot lately. The company announced second-quarter earnings last week, crushing Wall Street's expec... [4793 chars]",https://www.fool.com.au/2021/05/07/apple-just-crushed-earnings-3-things-investors-need-to-know-usfeed/,https://www.fool.com.au/wp-content/uploads/2021/05/iMac-16_9-1.jpg,"{'name': 'Motley Fool Australia', 'url': 'https://www.fool.com.au'}"
