publishedAt,title,description,content,url,image,source
2021-03-20 19:18:00+00:00,"Apple CEO Tim Cook, senior execs to testify at Epic Fortnite trial","The iPhone maker expects to call nearly a dozen people from its organization in the high profile trial, due to start May 3.","Angela Lang/CNET
Apple plans to call some of its highest profile executives to testify as part of its upcoming trial with Fortnite maker Epic Games. Apple said it plans to call its CEO, Tim Cook, software head Craig Federighi, and Apple fellow Phil S... [3628 chars]",https://www.cnet.com/news/apple-ceo-tim-cook-senior-execs-to-testify-at-epic-fortnite-trial/,https://cnet4.cbsistatic.com/img/Tvjoxc7sDBTuCHPldlehFMfAO-E=/1200x630/2020/08/29/6146e805-0638-42f3-812e-6137107d79ef/fortnite-logo-6399.jpg,"{'name': 'CNET', 'url': 'https://www.cnet.com'}"
2021-03-20 18:30:00+00:00,"Mark Zuckerberg Downplays Risk of Apple’s Privacy Policy Changes, Facebook Rallies","Facebook shares rallied on Friday, with the stock extending a recent advance after CEO Mark Zuckerberg downplayed the risk that the social-media company could see as a result of an upcoming change to Apple’s privacy policies.","Facebook shares rallied on Friday, with the stock extending a recent advance after Chief Executive Officer Mark Zuckerberg downplayed the risk that the social-media company could see as a result of an upcoming change to Apple's privacy policies.
“I'm... [2331 chars]",https://gadgets.ndtv.com/social-networking/news/mark-zuckerberg-apple-privacy-policy-change-facebook-ios-14-update-advertisers-user-track-2394987,https://i.gadgets360cdn.com/large/zuckerberg_facebook_meeting_stop_hate_for_profit_reuters_1594182726064.jpg,"{'name': 'Gadgets 360', 'url': 'https://gadgets.ndtv.com'}"
2021-03-20 18:30:00+00:00,"Apple, Epic Games CEOs on List of Witnesses in Fortnite Case","Apple CEO Tim Cook and Epic Games CEO Tim Sweeney are among the top executives from the companies to be on the witness list in the Fortnite case, court documents show. Apple and Epic Games, creator of the popular game Fortnite, have been in a legal battle since last year, when Epic Games tried to avoid a 30 percent App Store fee by launching its own in-app payment system.","Apple and Epic Games have listed their chief executive officers as potential witnesses in a case between the iPhone maker and the video game developer over the App Store payment system, court documents showed.
Apple and Epic Games, creator of the pop... [1721 chars]",https://gadgets.ndtv.com/games/news/apple-epic-games-ceo-tim-sweeney-cook-fortnite-case-witness-list-app-store-fee-2396077,https://i.gadgets360cdn.com/large/Fortnite_next_gen_improvements_1604380637457.jpg,"{'name': 'Gadgets 360', 'url': 'https://gadgets.ndtv.com'}"
2021-03-20 18:30:00+00:00,"iPhone Cameras Can Get Degraded by Motorcycle Vibrations, Apple Warns","iPhone cameras can be degraded with “high-amplitude vibrations” generated by motorcycle engines, Apple warned in a new support page. The iPhone 6 Plus, iPhone 6s Plus, iPhone 7, and later models including the iPhone SE (2020) are potentially affected.","iPhone cameras can be degraded by “high-amplitude vibrations” generated by “high-power” motorcycle engines, Apple warned through a new support page posted online. Most iPhone models nowadays carry optical image stabilisation (OIS) and closed loop aut... [3281 chars]",https://gadgets.ndtv.com/mobiles/news/iphone-cameras-degraded-high-amplitude-vibrations-motorcycle-apple-warning-2538918,https://i.gadgets360cdn.com/large/iphone_12_pro_max_review_compare_12_pro_camera_1606199694862.jpg,"{'name': 'Gadgets 360', 'url': 'https://gadgets.ndtv.com'}"
2021-03-20 17:54:19+00:00,"Apple, Epic Games CEOs on list of witnesses in Fortnite case","Apple Inc and Epic Games have listed their chief executive officers as potential witnesses in a case between the iPhone maker and the video game developer over the App Store payment system, court documents showed.","Slideshow ( 3 images )
(Reuters) - Apple Inc and Epic Games have listed their chief executive officers as potential witnesses in a case between the iPhone maker and the video game developer over the App Store payment system, court documents showed.
A... [1062 chars]",https://www.reuters.com/article/us-apple-epic-games/apple-epic-games-ceos-on-list-of-witnesses-in-fortnite-case-idUSKBN2BC07F,https://static.reuters.com/resources/r/?m=02&d=20210320&t=2&i=1555594050&r=LYNXMPEH2J0CU&w=800,"{'name': 'Reuters', 'url': 'https://www.reuters.com'}"
2021-03-20 17:44:59+00:00,Should You Avoid Tech Stocks?,"Warren Buffett reduced his stake in Apple, but it’s not a sign to avoid tech stocks. However, Berkshire’s investments in telco stocks indicate a bright outlook for the sector. For Canadians, Rogers Communications stock is an attractive option today.","iPhone-maker Apple remains Warren Buffett’s biggest single stock holding as of December 31, 2020 (42.2% of the total stock portfolio). However, market observers and Buffett’s loyal followers noticed that Berkshire Hathaway reduced its position in Q4 ... [3429 chars]",https://www.fool.ca/2021/03/20/warren-buffett-should-you-avoid-tech-stocks/,https://yw553ftvhw1iqegz29fycoyw-wpengine.netdna-ssl.com/wp-content/uploads/2020/10/tech.jpg,"{'name': 'The Motley Fool Canada', 'url': 'https://www.fool.ca'}"
2021-03-19 23:41:35+00:00,Tourists are finally returning to NYC,Tourists are finally starting to take a bite of the Big Apple again.,"Sign up for our special edition newsletter to get a daily update on the coronavirus pandemic.
Tourists are finally starting to take a bite of the Big Apple again.
After a year-long COVID-19 lockdown turned the city into a virtual ghost town, a steady... [3776 chars]",https://nypost.com/2021/03/19/tourists-coming-back-to-business-starved-nyc/,https://nypost.com/wp-content/uploads/sites/2/2021/03/new-york-tourism-1.jpg?quality=90&strip=all&w=1200,"{'name': 'New York Post', 'url': 'https://nypost.com'}"
2021-03-19 23:17:01+00:00,Here’s more evidence that the iPhone could get Touch ID back,"Apple replaced the Touch ID fingerprint sensor on the iPhone and iPad Pro with something much more secure. Face ID was the first 3D facial recognition system used on a mobile device, a feat that few Apple rivals attempted to replicate.","Apple replaced the Touch ID fingerprint sensor on the iPhone and iPad Pro with something much more secure. Face ID was the first 3D facial recognition system used on a mobile device, a feat that few Apple rivals attempted to replicate. Most Android r... [3581 chars]",https://bgr.com/2021/03/19/iphone-13-touch-id-rumors-new-apple-patent/,https://bgr.com/wp-content/uploads/2020/10/iphone-12-mini.jpg?quality=70&strip=all,"{'name': 'BGR', 'url': 'https://bgr.com'}"
2021-03-19 23:01:37+00:00,Forget Apple Glass: The next big thing is controlling AR with your brain,Facebook has plans for augmented reality that involve the power of thoughts,"Facebook is planning a neural interface which it will use as a way to control devices, like its own Facebook AR glasses. The system utilizes a system similar to that of prosthetics used by people with upper limb differences. Sensors in a wrist-worn b... [2445 chars]",https://www.tomsguide.com/news/forget-apple-glass-the-next-big-thing-is-controlling-ar-with-your-brain,https://cdn.mos.cms.futurecdn.net/dFGWgKwqMWNxAFNxPUXhW7-1200-80.png,"{'name': ""Tom's Guide"", 'url': 'https://www.tomsguide.com'}"
2021-03-19 22:30:40+00:00,Five Days At Memorial: Vera Farmiga Leads Apple TV+ Series,Vera Farmiga set to star in th Apple Original Hurricane Katrina limited series Five Days At Memorial from creators John Ridley and Carlton Cuse.,"Vera Farmiga is set to star in the new Apple TV+ Original, Five Days At Memorial, a limited series from Oscar winner John Ridley (12 Years a Slave) and Emmy winner Carlton Cuse (Lost) that chronicles the first five days at a New Orleans hospital afte... [2597 chars]",https://www.slashfilm.com/five-days-at-memorial-vera-farmiga-apple-tv/,https://d13ezvd6yrslxm.cloudfront.net/wp/wp-content/images/vera-farmiga-godzilla.jpeg,"{'name': '/FILM', 'url': 'https://www.slashfilm.com'}"
2021-03-19 22:15:40+00:00,"Hackers used multiple zero-day exploits to target iPhone, Android, and Windows users","Even though the security mechanisms implemented by Apple to protect iOS and keep hundreds of millions of devices secure have improved by leaps and bounds, hackers are still finding ways to skirt around Apple's protective measures.","Even though the security mechanisms implemented by Apple to protect iOS and keep hundreds of millions of devices secure have improved by leaps and bounds, hackers are still finding ways to skirt around Apple’s protective measures. By its very nature,... [3546 chars]",https://bgr.com/2021/03/19/iphone-security-zero-day-exploit-watering-hole-attack/,https://bgr.com/wp-content/uploads/2020/11/apple-silicon-macbook-event-1.jpg?quality=70&strip=all,"{'name': 'BGR', 'url': 'https://bgr.com'}"
2021-03-19 22:09:13+00:00,Intel’s version of a MacBook Pro looks even better than a real one,Intel’s new ad campaign comparing Intel-equipped PCs to MacBook Pros inexplicably features Apple laptops that look better than they do in real life.,"Intel launched a new ad campaign starring Justin Long, Apple’s “I’m a Mac” actor, but for this campaign, Long is singing the praises of PC laptops and comparing them to MacBooks. The thing is, for reasons that we can’t quite figure out, Intel actuall... [2506 chars]",https://www.theverge.com/2021/3/19/22340359/intel-apple-macbook-pro-ad-commercial-justin-long-all-screen,https://cdn.vox-cdn.com/thumbor/Ulf3dZ-JNqkFQDRNcBaSGd1IQCU=/0x75:1920x1080/fit-in/1200x630/cdn.vox-cdn.com/uploads/chorus_asset/file/22383639/Screen_Shot_2021_03_19_at_1.50.09_PM.png,"{'name': 'The Verge', 'url': 'https://www.theverge.com'}"
2021-03-19 21:31:48+00:00,Facebook stock surges as Zuckerberg downplays Apple privacy clampdown,Facebook shares jumped Friday after Mark Zuckerberg played down the risk that the social media giant faces in an upcoming change to Apple's privacy policies.,"Facebook shares jumped Friday after Mark Zuckerberg played down the risk that the social media giant faces in an upcoming change to Apple’s privacy policies.
“I’m confident that we’re gonna be able to manage through that situation,” he said in an int... [1484 chars]",https://nypost.com/2021/03/19/facebook-stock-surges-as-zuckerberg-downplays-apple-privacy-clampdown/,https://nypost.com/wp-content/uploads/sites/2/2021/03/facebook-up-on-zuckerberg.jpg?quality=90&strip=all&w=1200,"{'name': 'New York Post', 'url': 'https://nypost.com'}"
2021-03-19 21:13:42+00:00,Apple just patented this new tech for its most ambitious product ever,Apple this month was granted a patent for an intelligent interior lighting system that can adjust to the environment around it and various use-case scenarios.,"Apple this month was granted a patent for an intelligent interior lighting system that can adjust to the environment around it and various use-case scenarios. In effect, imagine something akin to a Philips Hue smart lighting setup in your car that dy... [4070 chars]",https://bgr.com/2021/03/19/apple-car-rumors-patent-smart-lighting-system/,https://bgr.com/wp-content/uploads/2020/11/apple-silicon-macbook-event-1.jpg?quality=70&strip=all,"{'name': 'BGR', 'url': 'https://bgr.com'}"
2021-03-19 21:02:36+00:00,"Apple Stops Signing iOS 14.4, Downgrade No Longer Possible - What it Means for Jailbreak?","Apple has stopped signing iOS 14.4, which means you can no longer downgrade from iOS 14.4.1 - everything you need to know related to jailbreak.","Today, Apple has seen fit to stop signing its iOS 14.4 after releasing iOS 14.4.1 to the public. What this means is that users can no longer downgrade from iOS 14.4.1 to the previous iOS 14.4 build. Apple usually stops signing the previous iOS build ... [2479 chars]",https://wccftech.com/apple-stops-signing-ios-14-4-downgrade-no-longer-possible-what-it-means-for-jailbreak/,https://cdn.wccftech.com/wp-content/uploads/2021/03/Apple-Stops-Signing-iOS-14.4-and-Unc0ver-Jailbreak-for-iOS-14.jpg,"{'name': 'Wccftech', 'url': 'https://wccftech.com'}"
2021-03-19 20:30:00+00:00,"SAS: Red Notice, Justice League, and 8 new movies you can now watch at home","The latest Netflix, Apple TV, Amazon Prime releases are here. This Week we spotlight the highly-anticipated release of Zack Snyder’s Justice League, SAS: Red Notice starring Sam Heughan and Ruby Rose, Jumbo starring Noémie Merlant (Portrait of a Lady on Fire), Happily starring Joel McHale and Kerry Bishé, and more; all available to stream starting today.","This week’s been pretty wild, what with the announcement of the 2021 Oscar nominees and the continued deluge of major feature releases across Netflix, Amazon, Disney Plus, and more. The MCU’s slate of streaming television shows continues with The Fal... [8348 chars]",https://www.polygon.com/streaming/2021/3/19/22335731/new-movies-watch-justice-league-sas-red-notice,https://cdn.vox-cdn.com/thumbor/C2y1dv6iiQYTKy7xRWnMpfJWnCc=/0x0:3500x1832/fit-in/1200x630/cdn.vox-cdn.com/uploads/chorus_asset/file/22377123/sas_sam_heughan_and_ruby_rose_01270_1615373343.jpg,"{'name': 'Polygon', 'url': 'https://www.polygon.com'}"
2021-03-18 23:44:08+00:00,Vera Farmiga to star in 'Five Days at Memorial' Katrina series on Apple TV+,The series will chronicle the first five days in a New Orleans hospital after Hurricane Katrina made landfall where Farmiga was on duty.,"The new Apple TV+ limited series Five Days at Memorial, which will chronicle the events in the immediate aftermath of Hurricane Katrina, has found its lead.
As reported by Deadline. Vera Farmiga has signed on to star in the new series from John Ridle... [1891 chars]",https://www.imore.com/vera-farmiga-star-five-days-memorial-katrina-series-apple-tv,https://www.imore.com/sites/imore.com/files/styles/large/public/field/image/2021/03/vera-farmiga_0.jpg,"{'name': 'iMore', 'url': 'https://www.imore.com'}"
2021-03-18 22:51:17+00:00,Zuckerberg Now Claims Apple's App Tracking Transparency Rules Could Benefit Facebook,"Despite campaigning heavily against Apple's upcoming anti-tracking rules, Facebook CEO Mark Zuckerberg today said that Facebook will ""be in a...","Despite campaigning heavily against Apple's upcoming anti-tracking rules, Facebook CEO Mark Zuckerberg today said that Facebook will ""be in a good position"" when Apple begins enforcing App Tracking Transparency and could even benefit from the changes... [2076 chars]",https://www.macrumors.com/2021/03/18/zuckerberg-anti-tracking-benefit-facebook/,https://images.macrumors.com/t/9CE4h8qOTWvPED6L4E8x2jiY5r8=/2250x/article-new/2021/03/Facebook-Feature.jpg,"{'name': 'MacRumors', 'url': 'https://www.macrumors.com'}"
2021-03-18 22:19:51+00:00,Apple TV+ orders new half-hour comedy series starring Maya Rudolph,"The series, starring Rudolph, is created by fellow Emmy Award winning writer/director/producer Alan Yang and Matt Hubbard.","Maya Rudolph is about to make her debut on Apple TV+.
In a press release, Apple has announced that it has made a straight-to-series order for a new half-hour comedy series that will star the Emmy Award winner. The series is created by fellow Emmy Awa... [1443 chars]",https://www.imore.com/apple-tv-orders-new-half-hour-comedy-series-starring-maya-rudolph,https://www.imore.com/sites/imore.com/files/styles/large/public/field/image/2021/03/maya-rudolph-apple-tv-plus.jpg,"{'name': 'iMore', 'url': 'https://www.imore.com'}"
2021-03-18 22:16:33+00:00,Apple iPhone upgrade program: Here's how it works,Get a new iPhone every year.,"Patrick Holland/CNET
Apple Event
If you are ready to plunk down for an iPhone 12 but are already tracking rumors about the iPhone 13, then you might be a good candidate for Apple's iPhone Upgrade Program. With it, you can upgrade your current phone f... [4632 chars]",https://www.cnet.com/how-to/apple-iphone-upgrade-program-heres-how-it-works-with-iphone-12/,https://cnet3.cbsistatic.com/img/A5J4oqqU_DlTc7dJFwwXk7vFo1g=/1200x630/2020/10/19/416fc014-20e0-4c4e-8fdd-2c8e6de91354/62-iphone-12-2020.jpg,"{'name': 'CNET', 'url': 'https://www.cnet.com'}"
2021-03-18 22:12:57+00:00,Facebook may be in stronger position after Apple iOS 14,Zuckerberg's comments are the most optimistic statements Facebook has made about Apple's iOS 14 privacy update.,"Facebook co-founder and CEO Mark Zuckerberg testifies before the House Financial Services Committee in the Rayburn House Office Building on Capitol Hill October 23, 2019 in Washington, DC. Zuckerberg testified about Facebook's proposed cryptocurrency... [2782 chars]",https://www.cnbc.com/2021/03/18/zuckerberg-facebook-may-be-in-stronger-position-after-apple-ios-14.html,https://image.cnbcfm.com/api/v1/image/106202554-1571960310657gettyimages-1182969985.jpeg?v=1576178873,"{'name': 'CNBC', 'url': 'https://www.cnbc.com'}"
2021-03-18 21:56:17+00:00,Bloomberg: iPad Pro with Thunderbolt connector and Mini-LED display coming in April,"For the past several weeks, rumors have been swirling about an Apple event taking place in March. There are many product lines that are due for a refresh and a few leaked devices that have yet to be officially unveiled, but earlier this week, a DigiTimes report claimed that Apple wouldn't launch a n...","For the past several weeks, rumors have been swirling about an Apple event taking place in March. There are many product lines that are due for a refresh and a few leaked devices that have yet to be officially unveiled, but earlier this week, a DigiT... [2866 chars]",https://bgr.com/2021/03/18/ipad-pro-2021-thunderbolt-mini-led-faster-processor-bloomberg/,https://bgr.com/wp-content/uploads/2020/03/apple_new-ipad-pro_03182020.jpg?quality=70&strip=all,"{'name': 'BGR', 'url': 'https://bgr.com'}"
2021-03-18 21:51:45+00:00,Apple Store Operations Begin Returning to Normal as Customers Again Able to Try on AirPods,There are signs that Apple's retail store operations are beginning to return to normal as some locations have once again started allowing U.S....,"There are signs that Apple's retail store operations are beginning to return to normal as some locations have once again started allowing U.S. customers to try on AirPods.
According to Bloomberg, Apple stores that are open for customer walk-ins are l... [551 chars]",https://www.macrumors.com/2021/03/18/apple-store-airpods-try-on-available/,https://images.macrumors.com/t/OAn7nPT1FuIwD147jwS_YX2xlBE=/1600x/http://images.macrumors.com/article-new/2019/11/airpodsproinear.jpg,"{'name': 'MacRumors', 'url': 'https://www.macrumors.com'}"
2021-03-18 21:40:20+00:00,Maya Rudolph Cast In New Apple Comedy Show,"Maya Rudolph will lead and executive produce a new Apple comedy series, marking her first live-action TV lead since Prime's Forever in 2018.","Maya Rudolph is set to lead a new comedy series for Apple. The Saturday Night Live alum has recently been racking up voiceover credits in the TV world, with stints on Netflix's Big Mouth and FOX's Bless the Harts. Her last live-action television role... [2699 chars]",https://screenrant.com/maya-rudolph-comedy-show-development-apple-tv-plus/,https://static2.srcdn.com/wordpress/wp-content/uploads/2021/03/maya-rudolph-judge-1.jpg,"{'name': 'Screen Rant', 'url': 'https://screenrant.com'}"
2021-03-18 20:42:00+00:00,Creator of former top paid iOS app sues Apple for exploiting small developers,The developer of the FlickType keyboard app for the Apple Watch and the iPhone is suing Apple for not treating the app the same as its competitors. Some of the rival apps were scams and didn't work at all.,"The FlickType app is available in the App Store and its claim to fame is that it can be used on your Apple Watch to give you a functioning QWERTY keyboard for the timepiece. The developer of the app, Kosta Eleftheriou, took to Twitter earlier this ye... [3560 chars]",https://www.phonearena.com/news/flicktype-developer-files-suit-against-apple_id130849,https://m-cdn.phonearena.com/images/article/130849-two_1200/Creator-of-former-top-paid-iOS-app-sues-Apple-for-exploiting-small-developers.jpg,"{'name': 'PhoneArena', 'url': 'https://www.phonearena.com'}"
2021-03-18 20:35:22+00:00,Apple Warns Chinese Tech Companies Not to Circumvent App Tracking Transparency Rules,"Apple is cracking down on Chinese tech companies that are working on ways to get around upcoming App Tracking Transparency rules, reports Financial...","Apple is cracking down on Chinese tech companies that are working on ways to get around upcoming App Tracking Transparency rules, reports Financial Times.
Starting in iOS 14.5, Apple plans to begin requiring app developers to obtain express user perm... [2683 chars]",https://www.macrumors.com/2021/03/18/app-tracking-transparency-chinese-tech-companies/,https://images.macrumors.com/t/oT2zo18n83UZzoZd302oAJU7UWg=/1600x/https://images.macrumors.com/article-new/2021/01/nba-tracking-prompt.jpg,"{'name': 'MacRumors', 'url': 'https://www.macrumors.com'}"
2021-03-17 23:01:01+00:00,‘Yet to Launch’ ARM-Based Apple Silicon iMac Spotted in Xcode Crash Log,"While there is no official word on the Apple Silicon iMac release timeline, a crash log has shown that the ‘all in one’ exists","Apple has not officially announced the ARM-based iMac and apart from the M1 Macs, we have yet to see the redesigned ‘all in one’ in action. However, evidence that the company is working on one can found in an Xcode crash log, thus generating more mom... [1900 chars]",https://wccftech.com/apple-silicon-imac-spotted-xcode-crash-log/,https://cdn.wccftech.com/wp-content/uploads/2021/03/Apple-Silicon-iMac.jpg,"{'name': 'Wccftech', 'url': 'https://wccftech.com'}"
2021-03-17 22:52:03+00:00,"New iPad Pros reportedly launching as soon as April, and the 12.9-inch model may have a Mini LED screen","Apple is reportedly planning a number of updates to its iPad line, including new iPad Pros, a new iPad mini with a larger screen, and a refresh of the base iPad, according to a new Bloomberg report.","Apple is reportedly planning a number of updates to its iPad line, including new iPad Pros launching as soon as April, a new iPad mini with a larger screen, and a refresh of the base iPad, according to Bloomberg.
The new iPad Pros are expected to hav... [1385 chars]",https://www.theverge.com/2021/3/17/22336917/apple-new-ipad-pros-mini-base-april,https://cdn.vox-cdn.com/thumbor/jIiTAzoQqJX6VeKmPjfrU-cfGoU=/0x173:2040x1241/fit-in/1200x630/cdn.vox-cdn.com/uploads/chorus_asset/file/19827375/bking_200321_3945_0008.jpg,"{'name': 'The Verge', 'url': 'https://www.theverge.com'}"
2021-03-17 22:46:34+00:00,Apple's AirPods Pro 'Jump' campaign is going viral on TikTok,"The campaign, which began as a new ad on YouTube, is taking TikTok by storm with the featured song and hashtag.","On Sunday, Apple debuted a new ad for AirPods Pro called ""Jump."" The ad featured someone running through the streets of their town, jumping rope, and dancing. The aim of the ad was to show you how to ""turn the world into your playground"" while also p... [1465 chars]",https://www.imore.com/apples-airpods-pro-jump-campaign-going-viral-tiktok,https://www.imore.com/sites/imore.com/files/styles/large/public/field/image/2021/03/airpods-pro-tiktok-ad.jpg,"{'name': 'iMore', 'url': 'https://www.imore.com'}"
2021-03-17 22:28:00+00:00,Apple's new iPad Pro leaks ahead of rumored event,A Thunderbolt port and an M1 chip have reportedly been added to the iPad Pro.,"Apple
Apple will be launching a series of new iPads in April, a report Wednesday said. The new iPad Pros will come with Apple's home-made M1 chips, a Thunderbolt port and better cameras and screens, according to Bloomberg. They will reportedly come i... [924 chars]",https://www.cnet.com/news/apples-new-ipad-pro-leaks-ahead-of-rumored-event/,https://cnet1.cbsistatic.com/img/G-Qi5gJSoqkgZuJVuFYkPVxifWw=/1200x630/2020/03/18/ce2c5311-e75f-49ff-8f3b-a4795f6ca799/apple-new-ipad-pro-03182020.jpg,"{'name': 'CNET', 'url': 'https://www.cnet.com'}"
2021-03-17 22:25:15+00:00,"Apple reportedly preparing high-end iPads, could launch by April",The report comes as Apple's iPad business has been boosted by people looking for computers to work and play from home during the Covid-19 pandemic.,"Apple could release new iPads as soon as April, according to a report in Bloomberg.
The new iPads will be part of Apple's high-end iPad Pro line and could feature improved cameras, a faster processor, and a new type of Mini-LED display on the largest... [957 chars]",https://www.cnbc.com/2021/03/17/apple-reportedly-preparing-high-end-ipads-could-launch-by-april.html,https://image.cnbcfm.com/api/v1/image/106502727-1587648671580ipad-magic-keyboard.png?v=1587648753,"{'name': 'CNBC', 'url': 'https://www.cnbc.com'}"
2021-03-17 22:20:10+00:00,"New iPad Pro may launch in April with M1 speed, mini-LED, and new cameras","According to a new report from Bloomberg, Apple may launch the next generation of its iPad Pro lineup as early as next month.","As reported by Bloomberg, Apple is planning on announcing new iPads as early as April. The company will reportedly be updating their 11-inch and 12.9-inch iPad Pro with a new processor as well as better cameras. The new iPads will apparently look ver... [534 chars]",https://www.imore.com/new-ipad-pro-may-launch-april-m1-speed-mini-led-and-new-cameras,https://www.imore.com/sites/imore.com/files/styles/large/public/field/image/2018/11/ipad-pro-hero-river.jpg,"{'name': 'iMore', 'url': 'https://www.imore.com'}"
