publishedAt,title,description,content,url,image,source
2021-01-04 21:18:22+00:00,"Apple Reportedly Adopting Smaller, More Power-Efficient GaN USB-C Chargers for Future Products",Apple could end up adopting smaller and power efficient GaN chargers supporting the USB-C protocol for a wide range of future products,"The advantage of using Gallium nitride, or GaN chargers, is that they are very compact power bricks. This makes them extremely pocket-friendly. There are other benefits too, which we’ll get to in a bit, but those highlights are likely the reason why ... [1956 chars]",https://wccftech.com/apple-reportedly-adopting-gan-usb-c-chargers/,https://cdn.wccftech.com/wp-content/uploads/2021/01/Apple-65W-GaN-fast-charger.jpg,"{'name': 'Wccftech', 'url': 'https://wccftech.com'}"
2021-01-03 22:26:38+00:00,Apple to keep Amphetamine app in its store after drug dispute,Developer William Gustafson said the tech titan reversed its ban after a phone call between the two parties over whether the application promoted narcotics.,"Apple will allow Amphetamine, an app that keeps Mac computers awake, to remain on its App Store, after a dispute with its developer over whether it promoted drug use.
On a call on Saturday between William Gustafson, the developer, and Apple, a compan... [769 chars]",https://www.afr.com/technology/apple-to-keep-amphetamine-app-in-its-store-after-drug-dispute-20210104-p56rjl,https://static.ffx.io/images/$zoom_0.5403%2C$multiply_0.7554%2C$ratio_1.777778%2C$width_1059%2C$x_0%2C$y_61/t_crop_custom/e_sharpen:25%2Cq_85%2Cf_auto/t_afr_no_label_no_age_social_wm/1756409676dcc21f3d47a796a9802eacc958e7ce,"{'name': 'The Australian Financial Review', 'url': 'https://www.afr.com'}"
2021-01-03 21:50:00+00:00,"MTA finishes rollout of OMNY, allows Apple Pay on all subways and buses","The year and a half rollout has reportedly completed, allowing riders to use contactless payments like Apple Pay in all six boroughs of NYC.","As reported by Engadget, New York City's MTA has finished rolling out its OMNY contactless payments system to every subway station and bus line across all five boroughs in the metropolitan area. The OMNY (One Metro New York) system allows riders of s... [1363 chars]",https://www.imore.com/mta-finishes-roll-out-omny-allows-apple-pay-all-subways-and-buses,https://www.imore.com/sites/imore.com/files/styles/large/public/field/image/2019/12/omny-readers-at-turnstiles.jpg,"{'name': 'iMore', 'url': 'https://www.imore.com'}"
2021-01-03 21:00:04+00:00,Best MacBook Air alternatives for 2021,"Here are the best non-Apple light and small laptops priced around $1,000 or less.","Apple's popular MacBook Air set the bar for years for what you could expect from a $1,000 laptop and gave you a great entry point into MacOS without having to shell out for an iMac or MacBook Pro. However, PC makers have caught up to the Apple laptop... [3166 chars]",https://www.cnet.com/news/best-alternatives-to-the-macbook-air-for-2021/,https://cnet3.cbsistatic.com/img/l29elqAR2r4hxYGyLECEzFtyF0s=/207x392:2812x1901/1200x630/2020/03/04/69b5a5a3-7a37-433a-9176-83c5ec823eb6/25-lenovo-yoga-c740.jpg,"{'name': 'CNET', 'url': 'https://www.cnet.com'}"
2021-01-03 20:56:08+00:00,"Upcoming Apple Silicon Mac Will Feature a 12-Core Chip, and Will Be Announced in March, Says Tipster","One tipster believes that the next Apple Silicon Mac will arrive in the month of March, and is expected to tout a 12-core ARM-based chip","In 2020, we were greeted by the 5nm 8-core M1 chip, which only means Apple is expected to up the core count for the new year. We’ve heard about a 12-core Apple Silicon Mac several times by various sources for several months, but such a product never ... [2185 chars]",https://wccftech.com/2021-apple-silicon-mac-12-cores-march-launch/,https://cdn.wccftech.com/wp-content/uploads/2021/01/M1-MacBook-Pro-2.jpg,"{'name': 'Wccftech', 'url': 'https://wccftech.com'}"
2021-01-03 19:37:39+00:00,"Apple backtracks, says macOS utility Amphetamine can remain on the App Store","The app Amphetamine is a simple but useful macOS utility which can be configured to keep a Mac awake, preventing the computer from going into sleep mode....","In context: Apple threatened to remove longtime macOS utility Amphetamine from the Mac App Store in late December for violating the App Store Guidelines due to the app's name. However, Apple has since changed its position after the app's developer su... [2092 chars]",https://www.techspot.com/news/88141-apple-backtracks-macos-utility-amphetamine-can-remain-app.html,https://static.techspot.com/images2/news/bigimage/2021/01/2021-01-03-image-9.jpg,"{'name': 'TechSpot', 'url': 'https://www.techspot.com'}"
2021-01-03 19:37:00+00:00,"The best after-Christmas deals you can get right now: Save $450 on a Lenovo Yoga C940 2-in-1, $60 on a Apple Watch Series 6 and more","All the big holiday sales are in the rear view, but here's what you can buy if there's a gift card burning a hole in your pocket.","Deal Savings Price
Show more (4 items)
The aftermath of Christmas and Boxing Day might not offer the best deals of the year, but make no mistake: It's still possible to find decent discounts -- which is handy since this is the time of year when we ty... [3094 chars]",https://www.cnet.com/news/best-after-christmas-deals-you-can-get-right-now-save-450-on-lenovo-yoga-c940-60-on-a-apple-watch-series-6-and-more/,https://cnet2.cbsistatic.com/img/iyviMt4kTnvEaCjc9saT5cxUA94=/1200x630/2019/10/29/d5303512-5dfe-4e10-a0a6-0ede53fa5105/roku.jpg,"{'name': 'CNET', 'url': 'https://www.cnet.com'}"
2021-01-03 19:04:00+00:00,Apple Reverses Nutty App Store Expulsion Threat Against Amphetamine macOS App,Overly aggressive enforcement of Apple's 'drug promotion' rules almost led to the ban of a useful power management app.,"Setting a schedule is one of many useful ways Amphetamine can keep a Mac awake
Apple has backpedaled on its ban, via William C Gustafson on Twitter
When you are an app developer in a walled garden, sometimes the walls start to close in. It doesn't ev... [3241 chars]",https://hothardware.com/news/apple-amphetamine-app-ban-reversal,https://images.hothardware.com/contentimages/newsitem/53868/content/amphetamine-banned.jpg,"{'name': 'Hot Hardware', 'url': 'https://hothardware.com'}"
2021-01-03 19:02:00+00:00,Best Apple Watch deals still available: Series 5 and 6 for $339 and more models on sale,"A lot of the holiday sales have ended, but you can still find a few deals on Apple's flagship wearable.","Deal Savings Price
Holiday Gift Guide 2020
The holidays are now in the rear-view mirror. But if you didn't get that new Apple Watch you secretly wanted, there's some good news: It's still possible to score some decent deals on the popular wearable. S... [3940 chars]",https://www.cnet.com/news/best-apple-watch-deals-still-available-series-6-for-339-and-more-models-on-sale/,https://cnet2.cbsistatic.com/img/eV4cEaS9wP_bJrzL_ZhljCH2lA8=/1200x630/2020/10/07/b762799e-3726-4fdd-851a-8c9d4cd785ad/awse.jpg,"{'name': 'CNET', 'url': 'https://www.cnet.com'}"
2021-01-03 18:30:00+00:00,Apple’s Foldable iPhone Prototypes Pass Internal Durability Test at Foxconn Factory: Report,"Apple’s two foldable iPhone prototypes have passed internal tests for durability, as per a report. One of them is a dual-screen model prototype, stated the report, and the other a clamshell foldable. They were tested at the Foxconn factory in Shenzhen, China.","Apple's foldable iPhone prototypes have passed internal tests for durability, as per a report. Two different prototypes were reportedly tested at the Foxconn factory in Shenzhen, China. One of them is a dual-screen model prototype, as per the report,... [1489 chars]",https://gadgets.ndtv.com/mobiles/news/apple-foldable-iphone-prototypes-pass-internal-durability-test-foxconn-2346556,https://i.gadgets360cdn.com/large/folding_iphone_apple_fpt_1609228248964.jpg,"{'name': 'Gadgets 360', 'url': 'https://gadgets.ndtv.com'}"
2021-01-03 18:30:00+00:00,"Apple's AirPods Max Headphones Offer Big Sound, but Bugs Compromise $549 Price Tag","Apple AirPods Max headphones sound terrific. For almost the price of an iPhone 11, anything less would be a major let-down. Apple’s entry into the rapidly expanding category of over-ear noise-cancelling headphones was inevitable, and the end result lives up to the company’s usual high standards.","The AirPods Max headphones sound terrific. For almost the price of an iPhone 11, anything less would be a major letdown.
Apple's entry into the rapidly expanding category of over-ear noise-cancelling headphones was inevitable, and the end result live... [8705 chars]",https://gadgets.ndtv.com/audio/reviews/apple-airpods-max-headphones-review-price-usd-549-specifications-features-2342883,https://i.gadgets360cdn.com/large/AirPods_Max_battery_1608374009538.jpg,"{'name': 'Gadgets 360', 'url': 'https://gadgets.ndtv.com'}"
2021-01-02 23:00:42+00:00,3 catalysts for Apple stock in 2021,The bulls have more reasons to go wild over Apple in the new year.,"The Motley Fool Australia » International Stock News » 3 catalysts for Apple stock in 2021
This article was originally published on Fool.com. All figures quoted in US dollars unless otherwise stated.
The NASDAQ-100 Technology Sector index has more th... [4829 chars]",https://www.fool.com.au/2021/01/03/3-catalysts-for-apple-stock-in-2021-usfeed/,https://www.fool.com.au/wp-content/uploads/2020/12/Apple-stock-16.9.jpg,"{'name': 'Motley Fool Australia', 'url': 'https://www.fool.com.au'}"
2021-01-02 21:38:22+00:00,The NYC billionaires who got richer amid COVID-19 pandemic,"Big Apple billionaires are booming -- with a collective wealth that ballooned by $81 billion to more than $600 billion during the pandemic, according to an analysis.","Big Apple billionaires are booming — with a collective wealth that ballooned by $81 billion to more than $600 billion during the pandemic, according to an analysis.
That 16 percent surge among Gotham fat cats since mid-March included big gains for fo... [3998 chars]",https://nypost.com/2021/01/02/the-nyc-billionaires-who-got-richer-amid-covid-19-pandemic/,https://nypost.com/wp-content/uploads/sites/2/2021/01/covid-money-2.jpg?quality=90&strip=all&w=1200,"{'name': 'New York Post', 'url': 'https://nypost.com'}"
2021-01-02 21:30:00+00:00,2021 might be even better for Apple [Cult of Mac Magazine 382],"2020 was rough, but the pandemic gave Apple a chance to show its true colors. Can the company pull off an even more amazing year in 2021?","2020 was rough. However, the pandemic gave Apple a chance to show its true colors. From fantastic new products to altruistic accomplishments, the company found many ways to excel.
Read Leander Kahney’s recap for an informed look at Apple’s incredible... [397 chars]",https://www.cultofmac.com/731608/2021-might-be-even-better-than-2020-for-apple-cult-of-mac-magazine-382/,https://cdn.cultofmac.com/wp-content/uploads/2021/01/COM-MAG-382_2.jpg,"{'name': 'Cult of Mac', 'url': 'https://www.cultofmac.com'}"
2021-01-02 20:47:00+00:00,Apple Told This Developer That His App 'Promoted' Drugs,"In Apple’s world, an app can be inappropriate one day, but acceptable the next. That’s what the developer of Amphetamine—an app designed to keep Macs from going to sleep, which is useful in situations such as when a file is downloading or when a specific app is running—learned recently when Apple got in touch with him and told him that his app violated the company’s App Store guidelines.","The Amphetamine icon. Amphetamine is an app for MacOS that prevents the computer from going to sleep. Screenshot : William Gustafson
In Apple’s world, an app can be inappropriate one day, but acceptable the next. That’s what the developer of Amphetam... [6645 chars]",https://gizmodo.com/developer-says-apple-wanted-him-to-change-app-s-brandin-1845978801,"https://i.kinja-img.com/gawker-media/image/upload/c_fill,f_auto,fl_progressive,g_center,h_675,pg_1,q_80,w_1200/uuurdkubjfblltfv5f04.png","{'name': 'Gizmodo', 'url': 'https://gizmodo.com'}"
2021-01-02 19:00:17+00:00,Ugreen X-Kit review,The Ugreen X-Kit is a mobile laptop stand and USB-C multiport hub in one. Here's how well it works with Apple gear.,"Laptop stands make it easier to type as well as see what’s on your MacBook display. USB-C hubs make adding peripherals to your laptop a snap. The Ugreen X-Kit is both a display and a hub. Plus, it’s designed to be used on the go.
I tried out this com... [5245 chars]",https://www.cultofmac.com/731536/ugreen-x-kit-review-macbook-stand-usb-c-multiport-hub/,https://cdn.cultofmac.com/wp-content/uploads/2020/12/B035333A-8ED8-4F48-9E08-EA34E93C0403.jpeg,"{'name': 'Cult of Mac', 'url': 'https://www.cultofmac.com'}"
2021-01-02 18:25:20+00:00,Apple Backtracks After Popular Mac App 'Amphetamine' Threatened With Removal Over Branding,"Popular Mac app ""Amphetamine"" will remain on the Mac App Store after reportedly being threatened with removal over its name and branding,...","Popular Mac app ""Amphetamine"" will remain on the Mac App Store after reportedly being threatened with removal over its name and branding, which Apple had said breached App Store guidelines.
Amphetamine is a free Mac app that helps users to keep their... [2778 chars]",https://www.macrumors.com/2021/01/02/amphetamine-app-store-removal-threat/,https://images.macrumors.com/t/tcXbijFGnxajsX7d7TiTVxxLsEg=/1890x/https://images.macrumors.com/article-new/2021/01/amphetamine.jpg,"{'name': 'MacRumors', 'url': 'https://www.macrumors.com'}"
2021-01-02 17:55:49+00:00,Apple will let Amphetamine app stay in the App Store after wrongly telling developer it violated App Store rules,"The developer of Amphetamine, an app that prevents Macs from going into sleep mode, says Apple told him it violates App Store guidelines, even though it has nothing to do with drug use. The company reversed its decision Saturday.","The developer of Amphetamine, an app that prevents Macs from going into sleep mode, says Apple told him it violated App Store guidelines, even though it’s been in the App Store since 2014, and has nothing to do with drug use. Not long after The Verge... [3442 chars]",https://www.theverge.com/2021/1/2/22210295/apple-developer-amphetamine-app-violate-drug-app-store-rules,https://cdn.vox-cdn.com/thumbor/Q8c-p-NnlUAK9XlWeNDTxusAeoI=/0x0:1552x813/fit-in/1200x630/cdn.vox-cdn.com/uploads/chorus_asset/file/22209545/Screen_Shot_2021_01_02_at_11.46.06_AM.png,"{'name': 'The Verge', 'url': 'https://www.theverge.com'}"
2021-01-02 15:30:15+00:00,Hong Kong news outlet to close amid crackdown on dissent,"Citizen News is the third news outlet to close in recent months, following pro-democracy newspaper Apple Daily and online site Stand News","Police officers guard outside the building of Stand News' office in Hong Kong, Wednesday, Dec. 29, 2021.Vincent Yu/The Associated Press
A Hong Kong online news site said Sunday that it would cease operations in light of deteriorating press freedoms, ... [2111 chars]",https://www.theglobeandmail.com/world/article-hong-kong-news-outlet-to-close-amid-crackdown-on-dissent-2/,https://www.theglobeandmail.com/resizer/Wv7g8mbG_s8mNi9rnshurdrbd2M=/1200x800/filters:quality(80)/cloudfront-us-east-1.images.arcpublishing.com/tgam/F5NJSUZKNNP43MVRRPINZBPYAM.jpg,"{'name': 'The Globe and Mail', 'url': 'https://www.theglobeandmail.com'}"
2021-01-02 14:06:13+00:00,Apple Removes iPhone App For Encouraging Underground COVID-19 Parties,"Apple removed party app Vybe Together from the App Store, with the app having helped people to arrange and attend gatherings during COVID-19.","Apple has taken down an iPhone app called Vybe Together for encouraging people to attend parties during the COVID-19 pandemic. Restrictions have been put on social gatherings across the United States, in an attempt to stem the rising numbers of coron... [3530 chars]",https://screenrant.com/apple-removes-vybe-together-iphone-app-covid-19-parties/,https://static0.srcdn.com/wordpress/wp-content/uploads/2020/12/vybe-app-store-1.jpg,"{'name': 'Screen Rant', 'url': 'https://screenrant.com'}"
2021-01-02 13:50:14+00:00,Apple's new Mac Mini is killing my Hackintosh,"Commentary: Four years ago, I built a PC, then tricked it to run Mac software. Soon, Apple will stop it from working.","Apple
One of my favorite nerdy hobbies is ending, whether I want it to or not. And it's Apple's fault.
Back in 2016, I was frustrated that Apple hadn't updated its Mac Mini, iMac or Mac Pro computers in at least a year. The company pumped out new iPh... [8442 chars]",https://www.cnet.com/news/apple-new-m1-mac-mini-is-killing-my-hackintosh/,https://cnet2.cbsistatic.com/img/izWF-5rWB0U9az0OGssOfhSqxkQ=/1200x630/2020/11/16/960f010d-d467-47ef-9688-4f55b2c427c7/img-1746.jpg,"{'name': 'CNET', 'url': 'https://www.cnet.com'}"
2021-01-01 20:30:22+00:00,Save up to 72% on hot Apple Watch accessories in our New Year sale,"The Cult of Mac Store today kicked off its big New Year sale, saving you up to 72% on bands, stands, and other Apple Watch accessories.","New Year, new you? Maybe not. But how about a new look for your Apple Watch instead? The Cult of Mac Store today kicked off its big New Year sale, saving you up to 72% on bands, stands, and other brilliant accessories. Take advantage before the disco... [841 chars]",https://www.cultofmac.com/731598/save-com-store-new-year-2021/,https://cdn.cultofmac.com/wp-content/uploads/2020/08/2B8F2078-B3BE-4648-8F4C-D970CC29446E.jpeg,"{'name': 'Cult of Mac', 'url': 'https://www.cultofmac.com'}"
2021-01-01 20:01:06+00:00,"Expect exciting new MacBooks, iPad, Apple Watch and more in 2021","Expected a really significant year for Apple in 2021. Mac, iPad and Apple Watch will get redesigned, with plenty of new features.","Apple broke new ground in 2020, and will build on that in many ways in 2021. It should be a really significant year for Mac. And iPad and Apple Watch are expected to get important new features as well.
Plus, this could be the year a product Apple has... [4720 chars]",https://www.cultofmac.com/731581/macbook-ipad-apple-watch-iphone-apple-2021-predictions/,https://cdn.cultofmac.com/wp-content/uploads/2021/01/A271EEC4-6E26-434B-97C5-DB3F1F10616E.jpeg,"{'name': 'Cult of Mac', 'url': 'https://www.cultofmac.com'}"
2021-01-01 19:30:50+00:00,"Apple news: Foldable iPhone tests, AirPods Pro 2, more","Want to know the latest exciting Apple news from the past week? Check out our Apple news roundup for the week ending January 1, 2021.","This week in Apple news, we heard about the future of foldable iPhones. Allegedly, Apple has completed durability testing on two foldable prototypes. Of course, it’s anyone’s guess if either model will make it to a commercial state, or when that coul... [6912 chars]",https://www.androidauthority.com/apple-news-january-01-2021-1188705/,https://cdn57.androidauthority.net/wp-content/uploads/2020/12/foldable-iPhone-concept-feature-920x470.png,"{'name': 'Android Authority', 'url': 'https://www.androidauthority.com'}"
2021-01-01 19:00:00+00:00,Bellroy Phone Case review,Today we are taking a closer look at the the company’s new covers for Apple’s latest handsets in our Bellroy Phone Case review.,"Founded in 2009, Bellroy is the maker of a wide range of accessories, from bags, cable folios, and backpacks to wallets, laptop sleeves, and more. But today, we are taking a closer look at the Australian-based company’s new covers for Apple’s latest ... [4711 chars]",https://9to5toys.com/2021/01/01/bellroy-phone-case-review/,https://i1.wp.com/9to5toys.com/wp-content/uploads/sites/5/2020/12/Bellroy-Phone-Case-review.jpeg?resize=1200%2C628&ssl=1,"{'name': '9to5Toys', 'url': 'https://9to5toys.com'}"
2021-01-01 19:00:00+00:00,Chrissy Teigen shares her 98th ‘two-year cinnamon rolls’ recipe ahead of cookbook release,Chrissy Teigen showcases the development of her cookbook while making home-made apple cinnamon rolls,"Chrissy Teigen shares her 98th ‘two-year cinnamon rolls’ recipe ahead of cookbook release
Chrissy Teigen recently gave fans a behind the scenes look into her two-year cinnamon rolls recipe over on social media and social media is abuzz over the decad... [632 chars]",https://www.thenews.com.pk/latest/768134-chrissy-teigen-shares-her-98th-two-year-cinnamon-rolls-recipe-ahead-of-cookbook-release,https://www.thenews.com.pk/assets/uploads/updates/2021-01-02/l_768134_061922_updates.jpg,"{'name': 'The News International', 'url': 'https://www.thenews.com.pk'}"
2021-01-01 18:58:20+00:00,Amazon’s New Year’s Day sale slashes Sony noise cancelling headphones to $88,"Amazon is celebrating New Year's Day with some truly fantastic deals on best-selling headphones. Apple's AirPods Pro and AirPods 2 are on sale with discounts up to $50, but there are even deeper discounts available on Sony over-ear ANC headphones.","If you purchase an independently reviewed product or service through a link on our website, we may receive an affiliate commission.
Amazon is celebrating New Year’s Day with some truly fantastic deals on best-selling headphones.
Apple’s AirPods Pro a... [3634 chars]",https://bgr.com/2021/01/01/sony-noise-cancelling-headphones-amazon-deals-new-years-day/,https://bgr.com/wp-content/uploads/2019/08/sony-wh1000xm3-wireless-noise-canceling-headphones.jpg?quality=70&strip=all,"{'name': 'BGR', 'url': 'https://bgr.com'}"
2021-01-01 18:00:26+00:00,How to make your New Year’s resolutions stick with Apple Fitness+,Apple Fitness+ makes it easier than ever to get in shape. So you should have no problem smashing your New Year's resolution. Right? Wrong. The sad fact,"Apple Fitness+ makes it easier than ever to get in shape. So you should have no problem smashing your New Year’s resolution. Right?
Wrong. The sad fact is, despite the best of intentions, most New Year’s resolutions fail. But it doesn’t have to be th... [8087 chars]",https://www.cultofmac.com/731383/how-to-make-your-new-years-resolutions-stick-with-apple-fitness/,https://cdn.cultofmac.com/wp-content/uploads/2020/12/2021a-activity.jpg,"{'name': 'Cult of Mac', 'url': 'https://www.cultofmac.com'}"
2021-01-01 16:15:16+00:00,NYC's first baby of 2021 born in Brooklyn,The first tot to be born in the Big Apple this year came into the world at precisely midnight at Coney Island Hospital in Brooklyn.,The first tot to be born in the Big Apple this year came into the world at precisely midnight at Coney Island Hospital in Brooklyn....,https://www.nydailynews.com/news/politics/new-york-elections-government/ny-baby-new-year-2021-jaxel-rodriguez-brooklyn-coney-island-20210101-5g36vgot5betzn6lankiaokeua-story.html,https://www.nydailynews.com/resizer/42AQTBIKMSR5bCTaBWLUsB6Obnc=/1200x0/top/cloudfront-us-east-1.images.arcpublishing.com/tronc/DMRMVA4THZGPTDU2YVGZAL3SHY.jpg,"{'name': 'New York Daily News', 'url': 'https://www.nydailynews.com'}"
2021-01-01 15:18:00+00:00,Apple's new Mac computers are spelling the end of my Hackintosh,"Commentary: Four years ago, I built a PC, then tricked it to run Mac software. Soon, Apple will stop it from working.","Apple
One of my favorite nerdy hobbies is coming to an end, whether I want it to or not. And it's Apple's fault.
Back in 2016, I was frustrated that Apple hadn't updated its Mac Mini, iMac or Mac Pro computers in at least a year. The company pumped o... [8452 chars]",https://www.cnet.com/news/apple-new-m1-mac-computers-are-spelling-the-end-of-my-hackintosh/,https://cnet2.cbsistatic.com/img/izWF-5rWB0U9az0OGssOfhSqxkQ=/1200x630/2020/11/16/960f010d-d467-47ef-9688-4f55b2c427c7/img-1746.jpg,"{'name': 'CNET', 'url': 'https://www.cnet.com'}"
2021-01-01 15:14:16+00:00,Start the new year with a one-day sale on open-box iPad and MacBook models,Woot is holding a one-day sale on the latest Apple iPad and MacBook models in open-box condition. They're nearly brand new and come with a 120-day Apple warranty as well.,"New year, new you, new iPad? Woot is having a one-day sale on open-box Apple iPad and MacBook models for New Year's Day. Though these devices aren't exactly brand new, they are pretty close to it. Open-box items generally have no signs of use — other... [1892 chars]",https://www.imore.com/start-new-year-one-day-sale-recent-ipad-and-macbook-models,https://www.imore.com/sites/imore.com/files/styles/large/public/field/image/2019/11/16-macbook-pro-vs-13-inch-vs-air-hero.jpg,"{'name': 'iMore', 'url': 'https://www.imore.com'}"
2020-12-31 23:30:07+00:00,"Best college laptop for 2021: Apple, Microsoft, Dell and more",Find an affordable laptop for every type of student.,"For most students, one of the most significant investments they'll make is also the primary academic tool they'll need: a laptop. You can find a passable entry-level laptop with an adequate display, battery life, graphics card and hard drive for less... [4813 chars]",https://www.cnet.com/news/best-college-laptop-for-2021-apple-microsoft-dell-and-more/,https://cnet2.cbsistatic.com/img/z2eC7BwoLYEj3yz-loYXbiNGMsQ=/1200x630/2020/03/18/96027c2d-3a48-4cc6-b04a-a8cfd989ed45/macbook-air-promoimage-1.png,"{'name': 'CNET', 'url': 'https://www.cnet.com'}"
